와인명,와인 영문명,URL,생산자,국가/생산지역,주요품종,스타일,등급,알코올,음용온도,추천음식,기타정보,수입사,당도,산도,바디,타닌,아로마,음식매칭,숙성,양조
"뱅상 르디, 부르고뉴 피노 누아 레 꼼브","Vincent Ledy, Bourgogne Pinot Noir Les Combes",https://www.wine21.com/13_search/wine_view.html?Idx=168688&lq=LIST,뱅상 르디  Vincent Ledy,프랑스(France) / 부르고뉴(Bourgogne) / 꼬뜨 드 뉘(Côte de Nuits),피노 누아 (Pinot Noir),,,,14~16 ℃,"로스트비프, 오리고기, 닭고기, 연어, 참치, 송이버섯, 아스파라거스, 콩테, 다양한 치즈와 잘 어울린다.",,크리스탈와인,1/5,4/5,3/5,3/5,,,"18 months in used oak barrel, Over 5 years used oak barrel","100% destemming, Indigenous yeast, Cold maceration, Malolactic fermentation in oak barrel, Very low sulfur, No fining, No filtration"
"뱅상 르디, 부르고뉴 피노 누아","Vincent Ledy, Bourgogne Pinot Noir",https://www.wine21.com/13_search/wine_view.html?Idx=168689&lq=LIST,뱅상 르디  Vincent Ledy,프랑스(France) / 부르고뉴(Bourgogne) / 꼬뜨 드 뉘(Côte de Nuits),피노 누아 (Pinot Noir),Burgundy Côte de Nuits Red,,,14~16 ℃,"로스트비프, 오리고기, 닭고기, 연어, 참치, 송이버섯, 아스파라거스, 콩테, 다양한 치즈와 잘 어울린다.",,크리스탈와인,1/5,4/5,3/5,3/5,,,오크배럴에서 18개월 숙성,오크배럴에서 말로라틱 발효
"로랑 퐁소, 샹베르땅 그랑 크뤼 퀴베 뒤 쉔","Laurent Ponsot, Chambertin Grand Cru Cuvee du Chene",https://www.wine21.com/13_search/wine_view.html?Idx=168690&lq=LIST,로랑 퐁소  Laurent Ponsot,프랑스(France) / 부르고뉴(Bourgogne) / 꼬뜨 드 뉘(Côte de Nuits) / 쥬브레-샹베르땅(Gevrey-Chambertin),피노 누아 (Pinot Noir),,,,14~16 ℃,"로스트비프, 오리고기, 닭고기, 연어, 참치, 송이버섯, 아스파라거스, 콩테, 다양한 치즈와 잘 어울린다.",*Wine Spectator Vintage Chart 2018 Cotes de Nuit Red: 93점,에노테카코리아,1/5,4/5,3/5,3/5,"블랙베리, 자두",,,
"로랑 퐁소, 본 로마네 퀴베 뒤 세리지에","Laurent Ponsot, Vosne Romanee Cuvee du Cerisier",https://www.wine21.com/13_search/wine_view.html?Idx=168691&lq=LIST,로랑 퐁소  Laurent Ponsot,프랑스(France) / 부르고뉴(Bourgogne) / 꼬뜨 드 뉘(Côte de Nuits) / 본-로마네(Vosne-Romanee),피노 누아 (Pinot Noir),,,,14~16 ℃,"로스트비프, 오리고기, 닭고기, 연어, 참치, 송이버섯, 아스파라거스, 콩테, 다양한 치즈와 잘 어울린다.",*Wine Spectator Vintage Chart 2018 Cotes de Nuit Red 93점,에노테카코리아,1/5,4/5,3/5,3/5,,,,
"로랑 퐁소, 몽라셰 퀴베 데 소르키데","Laurent Ponsot, Montrachet Cuvee des Orchidees",https://www.wine21.com/13_search/wine_view.html?Idx=168692&lq=LIST,로랑 퐁소  Laurent Ponsot,프랑스(France) / 부르고뉴(Bourgogne) / 꼬뜨 드 본(Côte de Beaune) / 샤샤뉴-몽라셰(Chassagne-Montrachet),샤르도네 (Chardonnay),,,,10~12 ℃,"훈제오리, 오리로스, 치킨, 훈제연어, 장어구이, 해산물, 숙성 치즈, 피자, 파스타, 탕수육 등과 잘 어울린다.",*Burghound 94점,에노테카코리아,1/5,4/5,3/5,1/5,"꽃, 미네랄, 헤이즐넛","해산물, 수육, 탕수육, 치즈",,
"로랑 퐁소, 샤름 샹베르땅 그랑 크뤼 퀴베 뒤 시프레","Laurent Ponsot, Charmes Chambertin Grand Cru Cuvee Cypres",https://www.wine21.com/13_search/wine_view.html?Idx=168693&lq=LIST,로랑 퐁소  Laurent Ponsot,프랑스(France) / 부르고뉴(Bourgogne) / 꼬뜨 드 뉘(Côte de Nuits) / 쥬브레-샹베르땅(Gevrey-Chambertin),피노 누아 (Pinot Noir),,,,14~16 ℃,"로스트비프, 오리고기, 닭고기, 연어, 참치, 송이버섯, 아스파라거스, 콩테, 다양한 치즈와 잘 어울린다.",*Wine Spectator Vintage Chart 2018 Cotes de Nuit Red 93점,에노테카코리아,1/5,4/5,3/5,3/5,꽃,,,
"로랑 퐁소, 클로 드 부조 그랑 크뤼 퀴베 뒤 세드르","Laurent Ponsot, Clos de Vougeot Grand Cru Cuvee du Cedre",https://www.wine21.com/13_search/wine_view.html?Idx=168694&lq=LIST,로랑 퐁소  Laurent Ponsot,프랑스(France) / 부르고뉴(Bourgogne) / 꼬뜨 드 뉘(Côte de Nuits) / 부조(Vougeot),피노 누아 (Pinot Noir),,,,14~16 ℃,"로스트비프, 오리고기, 닭고기, 연어, 참치, 송이버섯, 아스파라거스, 콩테, 다양한 치즈와 잘 어울린다.",*Wine Spectator Vintage Chart 2018 Cotes de Nuit Red 93점,에노테카코리아,1/5,4/5,3/5,3/5,"블랙베리, 삼나무, 흙",,,
"버메스터, 타베도 화이트","Burmester, Tavedo White",https://www.wine21.com/13_search/wine_view.html?Idx=168695&lq=LIST,버메스터  Burmester,포르투갈(Portugal) / 도우루(Douro),말바시아 피나 (Malvasia Fina) / 고바이오 (Gouveio) / 라비가토 (Rabigato) / 폴가사오 (Folgasao) / 세르시알 (Sercial),,,12~13 %,10~12 ℃,"샐러드, 과일, 생선 요리 등과 잘 어울린다.",,,1/5,4/5,2/5,1/5,"꽃, 미네랄, 허브","샐러드, 과일",,
"버메스터, 소토 보체 리저브 루비 포트","Burmester, Sotto Voce Reserve Ruby Port",https://www.wine21.com/13_search/wine_view.html?Idx=168696&lq=LIST,버메스터  Burmester,포르투갈(Portugal) / 도우루(Douro),투리가 나시오날 (Touriga Nacional) / 투리가 프란카 (Touriga Franca) / 틴타 로리즈 (Tinta Roriz),,,19~20 %,14~16 ℃,"진한 초콜릿 푸딩 또는 베리 푸팅, 치즈케이크, 중간 텍스처 치즈 등과 잘 어울린다.",*2023 대한민국 주류대상 '주정강화 와인 Best of 2023' 수상*2023 대한민국 주류대상 '주정강화 와인부문 대상' 수상,비케이 트레이딩,5/5,3/5,5/5,3/5,,치즈,,
"버메스터, 타베도 레드","Burmester, Tavedo Red",https://www.wine21.com/13_search/wine_view.html?Idx=168697&lq=LIST,버메스터  Burmester,포르투갈(Portugal) / 도우루(Douro),투리가 프란카 (Touriga Franca) / 틴타 로리즈 (Tinta Roriz) / 틴타 까오 (Tinta Cao) / 틴타 바로카 (Tinta Barroca) / 투리가 나시오날 (Touriga Nacional),,,12~13 %,14~16 ℃,붉은 육류 요리와 잘 어울린다.,,,1/5,3/5,3/5,3/5,"체리, 초콜릿",,,
"버메스터, 타베도 로제","Burmester, Tavedo Rose",https://www.wine21.com/13_search/wine_view.html?Idx=168698&lq=LIST,버메스터  Burmester,포르투갈(Portugal) / 도우루(Douro),틴타 로리즈 (Tinta Roriz) / 틴타 바로카 (Tinta Barroca) / 틴타 아마렐라 (Tinta Amarela),,,12~13 %,10~12 ℃,"초밥, 샐러드, 생선 요리 등과 잘 어울린다.",,,1/5,3/5,2/5,1/5,"레드커런트, 장미","초밥, 샐러드",,
"캐논볼, 엔젤스 카우보이즈 브륏 로제","Cannonball, Angels & Cowboys Brut Rose",https://www.wine21.com/13_search/wine_view.html?Idx=168699&lq=LIST,캐논볼 와인즈  Cannonball Wines,미국(U.S.A) / 캘리포니아(California),피노 누아 (Pinot Noir) / 샤르도네 (Chardonnay) / 피노 뮈니에 (Pinot Meunier),,,12~13 %,6~8 ℃,"신선한 해산물 , 샐러드와 조화롭게 잘 어울린다.",,,1/5,4/5,2/5,1/5,"딸기, 라임","해산물, 샐러드",,
"미구엘 토레스, 안디카 소비뇽 블랑 리제르바","Miguel Torres, Andica Sauvignon Blanc Reserva",https://www.wine21.com/13_search/wine_view.html?Idx=168700&lq=LIST,미구엘 토레스 칠레  Miguel Torres Chile,칠레(Chile) / 쿠리코 밸리(Curico Valley),소비뇽 블랑 (Sauvignon Blanc),,,13~14 %,8~10 ℃,식전주 혹은 해산물 등과 잘 어울린다.,,신동와인,1/5,4/5,2/5,1/5,"열대과일, 허브","해산물, 식전주",,
"발레벨보, 까띠나 모스까또 다스티","Vallebelbo, Catina Moscato d'Asti",https://www.wine21.com/13_search/wine_view.html?Idx=168701&lq=LIST,발레벨보  Vallebelbo,이탈리아(Italy) / 피에몬테(Piemonte) / 아스티(Asti),모스카토  (Moscato ),,,5~6 %,8~10 ℃,"비스킷 등 각종 디저트 류, 마체도니아 등과 잘 어울린다.",*이마트 트레이더스 전용*15 'Cathay Pacific Hong Kong International Wine & Spirit Competition' Silver Medal,레뱅,3/5,3/5,2/5,1/5,"복숭아, 리치, 꿀","복숭아, 디저트",,
"콜롬비아 크레스트, 리저브 와토마 카베르네 소비뇽","Columbia Crest, Reserve Cabernet Sauvignon Wautoma Springs Vineyard",https://www.wine21.com/13_search/wine_view.html?Idx=168702&lq=LIST,콜럼비아 크레스트   Columbia Crest,미국(U.S.A) / 워싱턴(Washington State) / 콜롬비아 밸리(Columbia Valley),카베르네 소비뇽 (Cabernet Sauvignon) 100%,,Columbia Valley AVA,,17~19 ℃,"스테이크, 갈비, 불고기, 양갈비, 버섯, 하몽, 살라미, 한국음식 과 잘 어울린다.",,신세계엘앤비,1/5,3/5,5/5,5/5,"배, 오크","스테이크, 양갈비, 버섯",,
"베세라 드 벨퐁, 블루 브뤼","Besserat de Bellefon, Bleu Brut",https://www.wine21.com/13_search/wine_view.html?Idx=168703&lq=LIST,베세라 드 벨퐁  Besserat de Bellefon,프랑스(France) / 샹빠뉴(Champagne),피노 뮈니에 (Pinot Meunier) 45% / 샤르도네 (Chardonnay) 30% / 피노 누아 (Pinot Noir) 25%,,,,6~8 ℃,"스시, 회, 해산물, 굴, 랍스터, 게, 다양한 치즈, 샐러드, 아시아요리, 동남아요리, 과일, 디저트 등과 잘 어울린다.",*Gold: Sommelier Wine awards (uk)*Very Well Made Wine” – Guide Hachette des vins,나라셀라,1/5,5/5,2/5,1/5,"꽃, 미네랄, 헤이즐넛","스시, 샐러드, 과일, 치즈, 디저트","3년간 앙금 숙성, 데고르쥬망(dégorgement) 이후 6개월 숙성",30% 솔레라 리저브
"레오파드 립, 퀴베 브륏","Leopard's Leap, Cuvee Brut",https://www.wine21.com/13_search/wine_view.html?Idx=168704&lq=LIST,레오파드 립  Leopard's Leap,남아프리카(South Africa) / 코스탈 리젼(Coastal Region) / 팔(Paarl),샤르도네 (Chardonnay) / 슈냉 블랑 (Chenin Blanc),,,12~13 %,6~8 ℃,"시저 샐러드, 프로슈토, 생선 카르파치오 뿐 아니라 프라이드 치킨과도 잘 어울린다.",,에노테카코리아,1/5,5/5,2/5,1/5,"백도, 멜론, 꽃","프로슈토, 치킨, 샐러드",,
"레오파드 립, 샤르도네 피노누아","Leopard's Leap, Chardonnay Pinot Noir",https://www.wine21.com/13_search/wine_view.html?Idx=168705&lq=LIST,레오파드 립  Leopard's Leap,남아프리카(South Africa) / 웨스턴 케이프(Western Cape),샤르도네 (Chardonnay) / 피노 누아 (Pinot Noir),,,12~13 %,10~12 ℃,"식전주로도 좋고, 오리, 지중해 요리, 스시, 연성 치즈 등과 잘 어울린다.",,에노테카코리아,1/5,3/5,2/5,1/5,크랜베리,"스시, 식전주, 치즈",,
"레오파드 립, 샤르도네","Leopard's Leap, Chardonnay",https://www.wine21.com/13_search/wine_view.html?Idx=168706&lq=LIST,레오파드 립  Leopard's Leap,남아프리카(South Africa) / 코스탈 리젼(Coastal Region) / 팔(Paarl) / 웰링턴(Wellington),샤르도네 (Chardonnay),,,12~13 %,10~12 ℃,"홍합 파스타처럼 화이트와인으로 조리한 요리와 가장 좋은 페어링을 보여주며, 생선요리, 익힌 조개 요리, 브리 치즈와 함께 마셔도 잘 어울린다.",,에노테카코리아,1/5,3/5,2/5,1/5,,파스타,,
"레오파드 립, 컬리나리아 뮈스카","Leopard's Leap, Culinaria Muscat",https://www.wine21.com/13_search/wine_view.html?Idx=168707&lq=LIST,레오파드 립  Leopard's Leap,남아프리카(South Africa) / 브리드 리버 밸리(Breede River Valley) / 로버트슨(Robertson),뮈스까 (Muscat) 100%,,,11~12 %,10~12 ℃,"식전주, 샐러드, 과일, 말린과일, 디저트, 케이크, 스낵 등과 잘 어울린다.",,에노테카코리아,3/5,3/5,3/5,1/5,"복숭아, 리치","식전주, 샐러드","손 수확한 포도를 차갑게 식힌 뒤 줄기 제거를 한다. 4-6시간 동안 침용한 후 별도의 압착 없이 추출되는 프리런(Free run)주스만을 사용, 스테인리스 스틸 탱크에서 적정 당도가 남을때까지 발효를 진행하며, 병입 후 3개월간 숙성을 거쳐 출시",웨스턴 케이프의 로버트슨 지역에서 생산한 뮈스카로 양조
"레오파드 립, 헤리티지 블렌드","Leopard's Leap, Heritage Blend",https://www.wine21.com/13_search/wine_view.html?Idx=168708&lq=LIST,레오파드 립  Leopard's Leap,남아프리카(South Africa) / 코스탈 리젼(Coastal Region) / 팔(Paarl),시라/쉬라즈 (Syrah/Shiraz) / 쌩쏘 (Cinsault) / 그르나슈 누아  (Grenache Noir),,,13~14 %,16~18 ℃,스테이크와 토마토 스튜 등과 잘 어울린다.,,에노테카코리아,1/5,3/5,4/5,4/5,"딸기, 자두, 오크",,,
"파스칼 클레멍, 뫼르소 프리미에 크루 레 샤름","Masion Pascal Clement, Meursault 1er Cru Les Charmes",https://www.wine21.com/13_search/wine_view.html?Idx=168709&lq=LIST,파스칼 클레멍  Pascal Clement,프랑스(France) / 부르고뉴(Bourgogne) / 꼬뜨 드 본(Côte de Beaune) / 뫼르소(Meursault),샤르도네 (Chardonnay),,Meursault 1er Cru AOC(AOP),13~14 %,8~10 ℃,"버터 소스를 곁들인 관자요리, 오리 꽁피  등 가금류 요리 등과 잘 어울린다.","*Robert Parker 92점, Wine Enthusiast 91점",동원와인플러스,1/5,4/5,2/5,1/5,"배, 꽃, 헤이즐넛, 크림",,,
"파스칼 클레멍, 뫼르소 나르보","Masion Pascal Clement, Meursault Narvaux",https://www.wine21.com/13_search/wine_view.html?Idx=168710&lq=LIST,파스칼 클레멍  Pascal Clement,프랑스(France) / 부르고뉴(Bourgogne) / 꼬뜨 드 본(Côte de Beaune) / 뫼르소(Meursault),샤르도네 (Chardonnay),,,13~14 %,8~10 ℃,"버터 소스를 곁들인 관자요리, 오리 꽁피 등 가금류 요리 등과 잘 어울린다.","*Robert Parker 92점, Wine Enthusiast 91점",동원와인플러스,1/5,3/5,2/5,1/5,"시트러스, 브리오슈, 버터",,,
"파스칼 클레멍, 본 로마네","Masion Pascal Clement, Vosne-Romanee",https://www.wine21.com/13_search/wine_view.html?Idx=168712&lq=LIST,파스칼 클레멍  Pascal Clement,프랑스(France) / 부르고뉴(Bourgogne) / 꼬뜨 드 뉘(Côte de Nuits) / 본-로마네(Vosne-Romanee),피노 누아 (Pinot Noir),Burgundy Côte de Nuits Red,Vosne-Romanée AOC(AOP),13~14 %,14~16 ℃,"소고기 스테이크와 같은 붉은 육류 요리, 뵈프 부르기뇽 등과 잘 어울린다.",*Robert Parker 90점,동원와인플러스,1/5,4/5,3/5,2/5,"블랙베리, 체리, 블루베리, 라스베리, 후추, 연기, 초콜릿, 가죽","스튜, 소고기, 스테이크, 붉은육류, 가금류, 치즈, 고다, 브리, 콩테","오크숙성 전 정화작업을 거치며, 18개월 동안 프렌치 오크에서 숙성 시킴.",30%만 송이 째 바로 압착 후 20~25일간 알코올 발효를 진행.
샤또 드라곤,Chateau Du Ragon,https://www.wine21.com/13_search/wine_view.html?Idx=168713&lq=LIST,샤또 드라곤  Chateau Du Ragon,프랑스(France) / 보르도(Bordeaux),메를로 (Merlot) / 카베르네 소비뇽 (Cabernet Sauvignon),,,13~14 %,16~18 ℃,"가금류 요리, 그릴에 구운 육류 요리, 각종 치즈 등과 잘 어울린다.",*Gilbert & Gaillard Gold Medal,동원와인플러스,1/5,4/5,3/5,3/5,,"가금류, 치즈",,
"피에르 베시굿, 마콩 샤흐네 브와 마레샬","Pierre Vessigaud, Macon Charnay Bois Marechal",https://www.wine21.com/13_search/wine_view.html?Idx=168714&lq=LIST,도멘 피에르 베시굿  Domaine Pierre Vessigaud,프랑스(France) / 부르고뉴(Bourgogne) / 마꼬네(Maconnais),샤르도네 (Chardonnay),,,12~13 %,10~12 ℃,"아페리티프, 생선 요리, 가금류 요리, 치즈 등과 잘 어울린다.",*Le Guide Hachette des Vins 2 Stars (2004),동원와인플러스,1/5,4/5,2/5,1/5,버터,"가금류, 아페리티프, 치즈",,
"피에르 베시굿, 마콩 퓌세 레 오뜨 드 퓌세","Pierre Vessigaud, Macon Fuisse Le Haut de Fuisse",https://www.wine21.com/13_search/wine_view.html?Idx=168715&lq=LIST,도멘 피에르 베시굿  Domaine Pierre Vessigaud,프랑스(France) / 부르고뉴(Bourgogne) / 마꼬네(Maconnais),샤르도네 (Chardonnay),,,13~14 %,12~13 ℃,"생선 요리, 해산물 요리, 가금류 요리, 치즈 등과 잘 어울린다.",*Tim Atkin 88 pts (2014)*프랑스 와인 전문 블로그 Burdivino 평가*20유로 이하 부르고뉴 화이트 중 최고의 와인!,동원와인플러스,1/5,4/5,2/5,1/5,"꽃, 미네랄","가금류, 해산물, 치즈",,
"피에르 베시굿, 마콩 퓌세 레 타슈","Pierre Vessigaud, Macon Fuisse Les tâches",https://www.wine21.com/13_search/wine_view.html?Idx=168716&lq=LIST,도멘 피에르 베시굿  Domaine Pierre Vessigaud,프랑스(France) / 부르고뉴(Bourgogne) / 마꼬네(Maconnais),샤르도네 (Chardonnay),,,13~14 %,12~13 ℃,"생선 요리, 해산물 요리, 가금류 요리, 치즈 등과 잘 어울린다.","*Robert Parker 91점 (2015), 90점 (2017), Tim Atkin 91점 (2014)",동원와인플러스,1/5,4/5,2/5,1/5,미네랄,"가금류, 해산물, 치즈",,
"피에르 베시굿, 푸이 퓌세 비에유 비뉴","Pierre Vessigaud, Pouilly Fuisse Vieilles Vignes",https://www.wine21.com/13_search/wine_view.html?Idx=168717&lq=LIST,도멘 피에르 베시굿  Domaine Pierre Vessigaud,프랑스(France) / 부르고뉴(Bourgogne) / 마꼬네(Maconnais),샤르도네 (Chardonnay),,,13~14 %,12~13 ℃,"생선 요리, 가금류 요리, 푸아그라, 아페리티프 등과 잘 어울린다.","*Robert Parker 91점 (2017, 16)*뿌이 퓌세 아펠라시옹의 대표격인 와인*Wine Spectator 90점 (2011)*Tim Atkin 93점 (2014)*Wine Enthusiast 90점 (2008)",동원와인플러스,1/5,4/5,2/5,1/5,"시트러스, 미네랄, 버터",아페리티프,,
"메짜코로나, 디노떼 레드 블렌드","Mezzacorona, Dinotte Red Blend",https://www.wine21.com/13_search/wine_view.html?Idx=168718&lq=LIST,메짜코로나  Mezzacorona,이탈리아(Italy),테롤데고 (Teroldego) / 마르제미노 (Marzemino) / 메를로 (Merlot),,,13~14 %,16~18 ℃,"블고기, 양념갈비, 로스트비프, 바비큐,그릴요리, 파스타, 탕수육, 한국음식 과 잘 어울린다.","*Berlin Wine Trophy 2020 Gold, International Wine Challenge 92점",하이트진로,1/5,4/5,3/5,3/5,"블랙베리, 코코아","바비큐, 파스타, 탕수육",,
"피에르 베시굿, 푸이 퓌세 피에르 아 까나르","Pierre Vessigaud, Pouilly Fuisse Pierres A Canards",https://www.wine21.com/13_search/wine_view.html?Idx=168719&lq=LIST,도멘 피에르 베시굿  Domaine Pierre Vessigaud,프랑스(France) / 부르고뉴(Bourgogne) / 마꼬네(Maconnais),샤르도네 (Chardonnay),,,13~14 %,12~13 ℃,"생선 요리, 가금류 요리, 푸아그라, 아페리티프 등과 잘 어울린다.",*Robert Parker 91점 (2017),동원와인플러스,1/5,4/5,2/5,1/5,미네랄,아페리티프,,
"피에르 베시굿, 푸이 퓌세 프리미에 크뤼 레 비네 블랑쉐 버 아그니에르","Pierre Vessigaud, Pouilly Fuisse 1er Cru Les Vignes Blanches Vers Agnieres",https://www.wine21.com/13_search/wine_view.html?Idx=168720&lq=LIST,도멘 피에르 베시굿  Domaine Pierre Vessigaud,프랑스(France) / 부르고뉴(Bourgogne) / 마꼬네(Maconnais) / 뿌이-퓌세(Pouilly-Fuisse),샤르도네 (Chardonnay) 100%,,"Pouilly-Fuissé AOC(AOP), 'Les Vignes Blanches'",13~14 %,12~14 ℃,"복숭아, 치즈, 연어, 참치, 흰살 생선, 해산물, 가금류 요리, 리코타치즈, 크림치즈, 부각, 어묵과 잘 어울린다.",* 2018 빈티지 - Tim Atkin Best Value White 수상* 2014 빈티지 - Tim Atkin 93점,동원와인플러스,1/5,4/5,2/5,1/5,"살구, 복숭아, 배, 미네랄, 삼나무","로스트비프, 꼬치구이, 바비큐, 가금류, 연어, 참치, 흰살생선, 해산물, 부각, 어묵, 리조토, 피자, 중국요리, 복숭아, 치즈, 리코타, 크림치즈","앙금과 함께 5년 산 600L 오크 배럴에서 12개월 숙성, 스테인레스 스틸 탱크에서 6개월 추가 숙성.",35년 이상의 오래된 포도나무에서 모두 손 수확 후 송이 째 압착.
"군트럼, 니르슈타인 리즐링 트로켄","Guntrum, Niersteiner Riesling Troken",https://www.wine21.com/13_search/wine_view.html?Idx=168721&lq=LIST,바인굿 루이스 군트럼  Weingut Louis Guntrum,독일(Germany) / 라인헤센(Rheinhessen),리슬링 (Riesling),,,12~13 %,8~10 ℃,"사천요리, 해산물, 파스타, 매콤한 음식 등과 잘 어울린다.",*Robert Parker 91점,동원와인플러스,1/5,4/5,2/5,1/5,미네랄,"해산물, 파스타",,
루이 에슈너 보르도 므왈레,Louis Eschenauer Bordeaux Molleux,https://www.wine21.com/13_search/wine_view.html?Idx=168723&lq=LIST,GCF 그룹  GCF Group,프랑스(France) / 보르도(Bordeaux) / 엉트르-두-메르(Entre-Deux-Mers),세미용 (Semillon) / 뮈스까델 (Muscadelle),,,11~12 %,8~10 ℃,"푸아그라, 가금류 요리, 초콜릿 퐁듀나 케이크 등의 디저트 등과 잘 어울린다.",,동원와인플러스,4/5,3/5,4/5,1/5,"복숭아, 꽃, 꿀",,,
루이 에슈너 보르도 엘레베 앙 퓌드쉔,Louis Eschenauer Bordeaux Eleve En Futs de Chene,https://www.wine21.com/13_search/wine_view.html?Idx=168724&lq=LIST,GCF 그룹  GCF Group,프랑스(France) / 보르도(Bordeaux) / 엉트르-두-메르(Entre-Deux-Mers),메를로 (Merlot) / 카베르네 프랑 (Cabernet Franc) / 카베르네 소비뇽 (Cabernet Sauvignon),,,12~13 %,16~18 ℃,"다양한 붉은 육류 요리, 스튜, 치즈 등과 잘 어울린다.",,동원와인플러스,1/5,3/5,3/5,3/5,"바닐라, 오크","스튜, 치즈",,
"제라드 듀플레시스, 샤블리 프리미에 크뤼 바이용","Gerard Duplessis, Chablis Premier Cru 'Vaillons'",https://www.wine21.com/13_search/wine_view.html?Idx=168725&lq=LIST,도멘 제라드 듀플레시스  Domaine Gerard Duplessis,프랑스(France) / 부르고뉴(Bourgogne) / 샤블리(Chablis) / 샤블리 프리미에 크뤼(Chablis Premier Cru),샤르도네 (Chardonnay),,,12~13 %,8~10 ℃,"생선 요리, 가금류 요리, 오래 숙성한 치즈 등과 잘 어울린다.","*Wine Enthusiast 90점 (2013)*Vinous 90점 (2016)*Robert Parker 92점 (2011) – ‘블라인드로 마시면 마치 꼬뜨 드 본 화이트를 연상시키는, 매우 잘 다듬어진 바이용 샤블리!’",동원와인플러스,1/5,4/5,3/5,1/5,"백도, 시트러스, 미네랄, 오크","가금류, 치즈",,
"제라드 듀플레시스, 샤블리 프리미에 크뤼 몽망","Gerard Duplessis, Chablis Premier Cru 'Montmains'",https://www.wine21.com/13_search/wine_view.html?Idx=168726&lq=LIST,도멘 제라드 듀플레시스  Domaine Gerard Duplessis,프랑스(France) / 부르고뉴(Bourgogne) / 샤블리(Chablis) / 샤블리 프리미에 크뤼(Chablis Premier Cru),샤르도네 (Chardonnay),,,12~13 %,8~10 ℃,"해산물 요리, 생선 요리, 가금류 요리 등과 잘 어울린다.",*Wine & Spirits 98점 (2016)*Wine Enthusiast 91점 (2013)*Robert Parker 91점 (2012) – '샤블리에서 기대하는 모든 것을 갖춘 샤블리!',동원와인플러스,1/5,4/5,2/5,1/5,"시트러스, 미네랄","가금류, 해산물",,
"제라드 듀플레시스, 샤블리 그랑 크뤼 '레 끌로'","Gerard Duplessis, Chablis Grand Cru Les Clos",https://www.wine21.com/13_search/wine_view.html?Idx=168727&lq=LIST,도멘 제라드 듀플레시스  Domaine Gerard Duplessis,프랑스(France) / 부르고뉴(Bourgogne) / 샤블리(Chablis) / 샤블리 그랑 크뤼(Chablis Grand Cru),샤르도네 (Chardonnay),,,13~14 %,8~10 ℃,"관자요리, 월넛밀크를 곁들인 야채구이, 금태구이 등과 잘 어울린다.","*Robert Parker 92-94점 (2016), 92점(2015), 93점(2014)",동원와인플러스,1/5,4/5,3/5,1/5,"시트러스, 아몬드",야채,,
"번 빈야드, 100배츠 쉬라즈","Byrne Winery, 100 Bats Shiraz",https://www.wine21.com/13_search/wine_view.html?Idx=168728&lq=LIST,번 빈야즈  Byrne Vineyards,호주(Australia) / 사우스 오스트레일리아(South Australia),시라/쉬라즈 (Syrah/Shiraz),Australian Shiraz,,15~16 %,16~18 ℃,"레어 티본 스테이크, BBQ 포크 립, 양갈비 등과 잘 어울린다.",* 2020 빈티지 - Wine Showcase Magazine 91점* 2019 빈티지 - SILVER Riverland Wine Show 2019* 2017 빈티지 - International Wine & Spirit Competition 2018 Bronze Medal,,1/5,3/5,4/5,4/5,"블랙커런트, 블랙체리, 블랙베리, 블루베리, 라스베리, 바닐라, 시나몬, 허브, 초콜릿, 오크, 가죽","소고기, 스테이크, 붉은육류, 포크, 양갈비, 양념갈비, 갈비찜, 한식, 치즈, 파르미지아노, 그라노파다노, 콩테, 스모크",,
"번 와이너리, 100 배츠 샤도네이","Byrne Winery, 100 Bats Oaked Chardonnay",https://www.wine21.com/13_search/wine_view.html?Idx=168729&lq=LIST,번 빈야즈  Byrne Vineyards,호주(Australia) / 사우스 오스트레일리아(South Australia),샤르도네 (Chardonnay),,,14~15 %,10~12 ℃,"그릴드 피쉬, 랍스터, 갈릭새우, 뇨끼 등과 잘 어울린다.",*4 STARS Winestate Magazine 2019,,1/5,4/5,2/5,1/5,"복숭아, 라임, 열대과일, 바닐라, 크림",복숭아,,
"쥴 레베크, 앵트레피드 베르주라크","J. Lebegue, L'intrepide Bergerac",https://www.wine21.com/13_search/wine_view.html?Idx=168730&lq=LIST,쥴 레베크  J. Lebegue,프랑스(France) / 사우스웨스트 프랑스(Southwest France),카베르네 소비뇽 (Cabernet Sauvignon) / 메를로 (Merlot),,,14~15 %,16~18 ℃,"버섯과 함께 한 양고기, 송아지고기 등과 잘 어울린다.",*2018 빈티지: Feminalise Paris 2019 Gold Medal,콜리코,1/5,4/5,4/5,3/5,딸기,"송아지, 양고기, 버섯",,
도멘 드 페눌리에 엉 뿌어 투스 포제르,Domaine de Fenouillet Un Pour Tous Faugeres,https://www.wine21.com/13_search/wine_view.html?Idx=168731&lq=LIST,비뇨블 쟝쟝  Vignobles JeanJean,프랑스(France) / 서던 프랑스(Southern France) / 랑그독 루씨용(Languedoc Roussillon) / 포줴흐(Faugeres),시라/쉬라즈 (Syrah/Shiraz) / 그르나슈 (Grenache) / 까리냥 (Carignan/Carignane),,,13~14 %,16~18 ℃,"버섯과 함께 한 양고기, 송아지고기와 잘 어울린다.",,콜리코,1/5,3/5,4/5,4/5,딸기,"송아지, 양고기, 버섯",,
