와인명,와인 영문명,URL,생산자,국가/생산지역,주요품종,스타일,등급,알코올,음용온도,추천음식,기타정보,수입사,당도,산도,바디,타닌,아로마,음식매칭,숙성,양조
"에네미고, 말벡","Enemigo, Malbec",https://www.wine21.com/13_search/wine_view.html?Idx=169209&lq=LIST,에네미고  Enemigo,아르헨티나(Argentina) / 멘도사(Mendoza),말벡 (Malbec) 89% / 카베르네 프랑 (Cabernet Franc) 6% / 쁘띠 베르도 (Petit Verdot) 5%,Argentinian Malbec,,,16~18 ℃,"각종 바비큐 요리, 베이컨. 만체고, 에멘탈, 꽁떼과 같은 하드 치즈 등과 잘 어울린다.",,신동와인,1/5,3/5,4/5,4/5,"블랙커런트, 블랙체리, 블랙베리, 장미, 미네랄, 후추, 다크초콜릿, 낙엽","소고기, 돼지고기, 양고기, 한국음식",,
"알렉사나, 떼루아 셀렉션 피노누아 윌라메트 밸리","Alexana, Terroir Selection Pinot Noir Willamette Valley",https://www.wine21.com/13_search/wine_view.html?Idx=169210&lq=LIST,마다야 레바나  Madaiah Revana,미국(U.S.A) / 오리건(Oregon) / 윌라메트 밸리(Willamette Valley),피노 누아 (Pinot Noir),Oregon Pinot Noir,Dundee Hills AVA,13~14 %,14~16 ℃,"로스트비프, 오리고기, 닭고기, 연어, 참치, 버섯, 다양한 치즈, 파스타와 잘 어울린다.",,와인투유코리아,1/5,3/5,2/5,1/5,감초,"파스타, 버섯, 치즈",,
"디오블릿, 피노누아 산타바바라","Deovlet, Pinot Noir Santa Barbara",https://www.wine21.com/13_search/wine_view.html?Idx=169211&lq=LIST,라이언 디오블릿  Ryan Deovlet,미국(U.S.A) / 캘리포니아(California) / 산타 바바라 카운티(Santa Barbara County),피노 누아 (Pinot Noir),Californian Pinot Noir,,13~14 %,14~16 ℃,"로스트비프, 오리고기, 닭고기, 연어, 참치, 버섯, 다양한 치즈, 파스타와 잘 어울린다.","AntonioGalloni, Vinous - 92 pts (2018)",와인투유코리아,1/5,3/5,2/5,2/5,,"파스타, 버섯, 치즈",,
"디오블릿, 조토비치 패밀리 빈야드 피노 누아","Deovlet, Zotovich Family Vineyard Pinot Noir",https://www.wine21.com/13_search/wine_view.html?Idx=169212&lq=LIST,라이언 디오블릿  Ryan Deovlet,미국(U.S.A) / 캘리포니아(California) / 산타 바바라 카운티(Santa Barbara County) / 산타 리타 힐스(Santa Rita Hills),피노 누아 (Pinot Noir),Californian Pinot Noir,,13~14 %,14~16 ℃,"로스트비프, 오리고기, 닭고기, 연어, 참치, 버섯, 다양한 치즈, 파스타와 잘 어울린다.",*2018 빈티지: Vinous 94점,와인투유코리아,1/5,3/5,2/5,2/5,"석류, 오렌지, 민트","파스타, 버섯, 치즈",,
"듀몰, 웨스터 리치 피노 누아","DuMOL, Wester Reach Pinot Noir",https://www.wine21.com/13_search/wine_view.html?Idx=169213&lq=LIST,듀몰  DuMOL,미국(U.S.A) / 캘리포니아(California) / 소노마 카운티(Sonoma County) / 러시안 리버 밸리(Russian River Valley),피노 누아 (Pinot Noir),Californian Pinot Noir,,14~15 %,14~16 ℃,"로스트비프, 오리고기, 닭고기, 연어, 참치, 버섯, 다양한 치즈, 파스타와 잘 어울린다.",,와인투유코리아,1/5,3/5,3/5,2/5,"체리, 딸기, 라스베리, 오렌지, 리치, 제비꽃, 붉은꽃, 후추, 홍차, 민트, 젖은흙","송아지, 로스트비프, 바비큐, 돼지고기, 건육, 오리고기, 훈제오리, 찜닭, 가금류, 참치, 보쌈, 불고기, 파스타, 피자, 버섯, 치즈, 파르미지아노, 체다, 고다, 그라노파다노, 콩테",40%의 New French Oak Barrel에서 12개월 동안  숙성,
"잼 셀러즈, 버터 샤도네이","JaM Cellars, Butter Chardonnay",https://www.wine21.com/13_search/wine_view.html?Idx=169214&lq=LIST,존 앤서니 패밀리 오브 와인스  John Anthony Family of Wines,미국(U.S.A) / 캘리포니아(California),샤르도네 (Chardonnay) 100%,Californian Chardonnay,,14~15 %,10~12 ℃,"바비큐, 훈제오리, 오리로스, 치킨, 훈제연어, 장어구이, 참치, 새우, 해산물, 숙성 치즈, 피자, 파스타, 탕수육 등과 잘 어울린다.","* 2020 빈티지 -  San Francisco Chronicle Wine Competition: Gold Medal* 2020 빈티지 -  2022 대한민국 주류대상, 화이트 와인 신대륙 부문 대상",와인투유코리아,1/5,3/5,3/5,1/5,"서양배, 사과, 시트러스, 열대과일, 리치, 파인애플, 바닐라, 오크","바비큐, 닭강정, 후라이드, 수육, 중국요리, 탕수육, 치즈, 그라노파다노",,특유의 복합미를 유지하기 위해 차가운 온도에서 천천히 발효
"클링커 브릭, 1850° 레드 와인 로디","Klinker Brick, 1850° Red Wine Lodi",https://www.wine21.com/13_search/wine_view.html?Idx=169215&lq=LIST,클링커 브릭  Klinker Brick,미국(U.S.A) / 캘리포니아(California) / 샌 호아퀸 카운티(San Joaquin County) / 로다이(Lodi),카베르네 소비뇽 (Cabernet Sauvignon) 60% / 쁘띠 쉬라 (Petit Syrah) 30% / 진판델 (Zinfandel) 10%,Californian Red Blend,,15~16 %,16~18 ℃,"붉은육류, 스테이크, 양갈비, 바비큐, 불고기, 파스타, 다양한 치즈, 햄버거, 한국음식 등과 잘 어울린다.",,와인투유코리아,1/5,3/5,4/5,4/5,"자두, 가죽","양갈비, 치즈",60%의 New French Oak에서 16개월 동안의 숙성 과정을 거침,
"클링커브릭, 브릭메이슨 레드 블렌드 로디","Klinker Brick, Brickmason Red blend Lodi",https://www.wine21.com/13_search/wine_view.html?Idx=169216&lq=LIST,클링커 브릭  Klinker Brick,미국(U.S.A) / 캘리포니아(California) / 샌 호아퀸 카운티(San Joaquin County) / 로다이(Lodi),진판델 (Zinfandel) 80% / 시라/쉬라즈 (Syrah/Shiraz) 10% / 카베르네 소비뇽 (Cabernet Sauvignon) 5% / 쁘띠 시라  (Petite Sirah) 5%,Californian Red Blend,,14~15 %,16~18 ℃,"양고기, 양갈비, 스테이크, 갈비, 불고기, 말린과일, 견과류 와 잘 어울린다.",,와인투유코리아,1/5,3/5,4/5,3/5,바닐라,"스테이크, 불고기, 견과류",,
"클링커 브릭, 까베르네 쇼비뇽 로디","Klinker Brick, Cabernet Sauvignon Lodi",https://www.wine21.com/13_search/wine_view.html?Idx=169217&lq=LIST,클링커 브릭  Klinker Brick,미국(U.S.A) / 캘리포니아(California) / 샌 호아퀸 카운티(San Joaquin County) / 로다이(Lodi),카베르네 소비뇽 (Cabernet Sauvignon),Californian Cabernet Sauvignon,,14~15 %,16~18 ℃,"붉은육류, 스테이크, 양갈비, 바비큐, 불고기, 파스타, 다양한 치즈, 햄버거, 한국음식 등과 잘 어울린다.",,와인투유코리아,1/5,3/5,4/5,4/5,체리,"양갈비, 치즈",French Oak에서 16개월 동안의 숙성,
"클링커 브릭, 마리사 빈야드 올드바인 진판델 로디","Klinker Brick, Marisa Vineyard Old Vine Zinfandel Lodi",https://www.wine21.com/13_search/wine_view.html?Idx=169218&lq=LIST,클링커 브릭  Klinker Brick,미국(U.S.A) / 캘리포니아(California) / 샌 호아퀸 카운티(San Joaquin County) / 로다이(Lodi),진판델 (Zinfandel),Californian Zinfandel,,15~16 %,16~18 ℃,"양갈비, 양고기, 스테이크, 스튜, 치즈, 살라미, 견과류, 말린과일 과 잘 어울린다.",,와인투유코리아,1/5,3/5,4/5,4/5,"블루베리, 시나몬, 유칼립투스","살라미, 견과류, 치즈",,
파베트 카베르네 소비뇽,Pavette Cabernet Sauvignon,https://www.wine21.com/13_search/wine_view.html?Idx=169219&lq=LIST,발레이븐  Valravn,미국(U.S.A) / 캘리포니아(California),카베르네 소비뇽 (Cabernet Sauvignon) 95% / 말벡 (Malbec) 3% / 쁘띠 베르도 (Petit Verdot) 2%,Californian Cabernet Sauvignon,,14~15 %,16~18 ℃,"붉은육류, 스테이크, 양갈비, 바비큐, 불고기, 파스타, 다양한 치즈, 햄버거, 한국음식 등과 잘 어울린다.",,,1/5,3/5,4/5,4/5,"블랙베리, 아니스","양갈비, 치즈",12개월 동안 French Oak와 American Oak에서 숙성,껍질째 발효시키면서 자연스러운 말로락틱 과정을 거침
파베트 쇼비뇽 블랑,Pavette Sauvignon Blanc,https://www.wine21.com/13_search/wine_view.html?Idx=169220&lq=LIST,발레이븐  Valravn,미국(U.S.A) / 캘리포니아(California),소비뇽 블랑 (Sauvignon Blanc) 100%,Californian Sauvignon Blanc,,12~13 %,8~10 ℃,"훈제 연어, 농어, 광어, 생선구이, 조개구이, 새우, 해산물, 샐러드, 야채, 동남아요리, 아시아요리 등과 잘 어울린다.",,와인투유코리아,1/5,4/5,1/5,1/5,꽃,,,당도가 21브릭스를 막 넘겼을 때 일찍이 수확한 포도를 낮은 온도에서 천천히 발효
"스프링 마운틴 빈야드, 카베르네 소비뇽 나파 밸리","Spring Mountain Vineyard, Cabernet Sauvignon Napa Valley",https://www.wine21.com/13_search/wine_view.html?Idx=169221&lq=LIST,스프링 마운틴 빈야드  Spring Mountain Vineyard,미국(U.S.A) / 캘리포니아(California) / 나파 카운티(Napa County) / 나파 밸리(Napa Valley),카베르네 소비뇽 (Cabernet Sauvignon),Californian Cabernet Sauvignon,,14~15 %,16~18 ℃,"붉은육류, 스테이크, 양갈비, 바비큐, 불고기, 파스타, 다양한 치즈, 햄버거, 한국음식 등과 잘 어울린다.",,,1/5,3/5,4/5,4/5,"라벤더, 허브, 오크","양갈비, 치즈",,
"잼 셀러즈, 슈가 스윗 화이트 와인 머스캣","JaM Cellars, Sugar Sweet White Muscat",https://www.wine21.com/13_search/wine_view.html?Idx=169222&lq=LIST,존 앤서니 패밀리 오브 와인스  John Anthony Family of Wines,미국(U.S.A) / 캘리포니아(California),뮈스까 (Muscat) 100%,Californian Muscat,,8~9 %,8~10 ℃,"식전주, 샐러드, 과일, 말린과일, 디저트, 케이크, 스낵 등과 잘 어울린다.",,와인투유코리아,3/5,3/5,1/5,1/5,"복숭아, 시트러스, 레몬, 꽃, 꿀","식전주, 샐러드, 복숭아",,캘리포니아의 전통적인 양조 기법으로 양조
씨슬 & 쏜 카베르네 소비뇽 나파 벨리,Thistle & Thorn Cabernet Sauvignon Napa Valley,https://www.wine21.com/13_search/wine_view.html?Idx=169223&lq=LIST,스튜어트 셀라스  Stewart Cellars,미국(U.S.A) / 캘리포니아(California) / 나파 카운티(Napa County) / 나파 밸리(Napa Valley),카베르네 소비뇽 (Cabernet Sauvignon),Californian Cabernet Sauvignon,,14~15 %,16~18 ℃,"붉은육류, 스테이크, 양갈비, 바비큐, 불고기, 파스타, 다양한 치즈, 햄버거, 한국음식 등과 잘 어울린다.",,와인투유코리아,1/5,3/5,4/5,4/5,"자두, 리치, 바닐라, 오크","양갈비, 치즈",,
"발레이븐, 카베르네 소비뇽","Valravn, Cabernet Sauvignon Sonoma County",https://www.wine21.com/13_search/wine_view.html?Idx=169224&lq=LIST,발레이븐  Valravn,미국(U.S.A) / 캘리포니아(California) / 소노마 카운티(Sonoma County),카베르네 소비뇽 (Cabernet Sauvignon),Californian Cabernet Sauvignon,,14~15 %,16~18 ℃,"붉은육류, 스테이크, 양갈비, 바비큐, 불고기, 파스타, 다양한 치즈, 햄버거, 한국음식 등과 잘 어울린다.",*Vinous(2018) - 90점,와인투유코리아,1/5,3/5,4/5,4/5,"블랙커런트, 블랙베리, 리치, 정향, 허브, 토스트, 커피, 에스프레소, 흑연","소고기, 스테이크, 붉은육류, 바비큐, 양갈비, 불고기, 양념갈비, 갈비찜, 족발, 치즈, 체다, 고다, 브리",프렌치 오크 배럴에서 18개월의 숙성.,스테인리스 스틸 발효.
"레 파셀레르 드 쏘, 부르고뉴 샤르도네 '레 뮈르소뜨'","Les Parcellaires de Saulx, Bourgogne Chardonnay 'Les Mursottes'",https://www.wine21.com/13_search/wine_view.html?Idx=169225&lq=LIST,레 파셀레르 드 쏘  Les Parcellaires de Saulx,프랑스(France) / 부르고뉴(Bourgogne) / 마꼬네(Maconnais),샤르도네 (Chardonnay),Burgundy White,Bourgogne AOC(AOP),,10~12 ℃,"아페리티프, 염소 치즈, 그릴드 치킨, 프라이드 피쉬 등과 잘 어울린다.",,(주)와이넬,1/5,4/5,2/5,1/5,미네랄,"치킨, 아페리티프, 치즈",동일한 올드 프렌치 오크 배럴(1년 사용)에서 최소 12개월 간 숙성,
"레 파셀레르 드 쏘, 샹볼 뮈지니","Les Parcellaires de Saulx, Chambolle Musigny",https://www.wine21.com/13_search/wine_view.html?Idx=169226&lq=LIST,레 파셀레르 드 쏘  Les Parcellaires de Saulx,프랑스(France) / 부르고뉴(Bourgogne) / 꼬뜨 드 뉘(Côte de Nuits) / 샹볼 뮈지니(Chambolle Musigny),피노 누아 (Pinot Noir),Burgundy Côte de Nuits Red,Chambolle-Musigny AOC(AOP),,14~16 ℃,"양고기와 소고기 등의 붉은 육류 구이 요리, 부드러운 치즈 등과 잘 어울린다.",,(주)와이넬,1/5,4/5,3/5,3/5,,"소고기, 양고기, 치즈",동일한 올드 프렌치 오크 배럴(1년 사용)에서 최소 15개월 간 숙성,
"브레드 & 버터, 나파 리저브 카베르네 소비뇽","Bread & Butter, Napa Reserve Cabernet Sauvignon",https://www.wine21.com/13_search/wine_view.html?Idx=169227&lq=LIST,브레드&버터  Bread&Butter,미국(U.S.A) / 캘리포니아(California) / 나파 카운티(Napa County) / 나파 밸리(Napa Valley),카베르네 소비뇽 (Cabernet Sauvignon) 98% / 쁘띠 시라  (Petite Sirah) 2%,Napa Valley Cabernet Sauvignon,,,,"그릴에 구운 등심 스테이크, 베이컨 크림 파스타와 잘 어울린다.",,롯데칠성음료,1/5,2/5,4/5,4/5,"바닐라, 카카오","베이컨, 파스타",나파밸리의카베르네소비뇽을16개월간프렌치오크에서숙성,
"피도라, 프로세코 프리잔테 콜 폰도","Fidora, Prosecco Frizzante Col Fondo",https://www.wine21.com/13_search/wine_view.html?Idx=169229&lq=LIST,피도라  Fidora,이탈리아(Italy) / 베네토(Veneto),글레라 (Glera) 100%,Italian Prosecco,,,,"식전주, 전채요리, 회, 스시, 해산물, 건육, 살라미, 하몽, 스낵 등과 잘 어울린다.",,,1/5,3/5,2/5,1/5,,"스시, 해산물, 식전주, 전채요리, 스낵",,
"요르그 브레츠, 레드만","Jorg Bretz, Redmann",https://www.wine21.com/13_search/wine_view.html?Idx=169230&lq=LIST,요르그 브레츠  Jorg Bretz,오스트리아(Austria) / 니더외스터라이히(Niederosterreich),츠바이겔트 (Zweigelt) 100%,,,,,"붉은육류, 스테이크, 훈제오리, 닭고기, 치즈, 라쟈나, 파스타와 잘 어울린다.",,,1/5,3/5,3/5,3/5,,"파스타, 치즈",,
"요르그 브레츠, 바이스브루군더 렌드바인","Jorg Bretz, Weissburgunder",https://www.wine21.com/13_search/wine_view.html?Idx=169231&lq=LIST,요르그 브레츠  Jorg Bretz,오스트리아(Austria) / 니더외스터라이히(Niederosterreich),바이스부르군더 (Weissburgunder) 100%,,,,,"연어, 참치, 새우, 해산물, 건육, 프로슈토, 하몽, 다양한 치즈, 파스타 등과 잘 어울린다.",,,1/5,3/5,2/5,1/5,,"파스타, 치즈",,
"요르그 브레츠, 부쉬버그 렌드바인","Jorg Bretz, Buschberg",https://www.wine21.com/13_search/wine_view.html?Idx=169232&lq=LIST,요르그 브레츠  Jorg Bretz,오스트리아(Austria) / 니더외스터라이히(Niederosterreich),샤르도네 (Chardonnay) 60% / 그뤼너 벨트리너 (Gruner Veltliner) 40%,,,,,"흰살생선, 샐러드, 건육, 하몽, 프로슈토, 동남아요리, 파스타 등과 잘 어울린다.",,,1/5,3/5,2/5,1/5,,"흰살생선, 파스타, 동남아요리, 샐러드",,
"다리오 프린칙, 블랑코","Dario Princic, Blanco",https://www.wine21.com/13_search/wine_view.html?Idx=169233&lq=LIST,다리오 프린칙  Dario Princic,이탈리아(Italy) / 프리울리 베네찌아 줄리아(Friuli Venezia Giulia),피노 그리 (Pinot Gris) / 샤르도네 (Chardonnay) / 소비뇽 블랑 (Sauvignon Blanc),,,,,"흰살생선, 샐러드, 건육, 하몽, 프로슈토, 동남아요리, 파스타 등과 잘 어울린다.",,,1/5,3/5,2/5,1/5,,"흰살생선, 파스타, 동남아요리, 샐러드",,
"다리오 프린칙, 로쏘","Dario Princic, Rosso",https://www.wine21.com/13_search/wine_view.html?Idx=169234&lq=LIST,다리오 프린칙  Dario Princic,이탈리아(Italy) / 프리울리 베네찌아 줄리아(Friuli Venezia Giulia),메를로 (Merlot) 85% / 카베르네 소비뇽 (Cabernet Sauvignon) 15%,,,,,"스테이크, 훈제오리, 치킨, 바비큐, 소시지, 브리 치즈와 잘 어울린다.",,,1/5,3/5,3/5,3/5,,스테이크,,
"다리오 프린칙, 시비","Dario Princic, Sivi",https://www.wine21.com/13_search/wine_view.html?Idx=169235&lq=LIST,다리오 프린칙  Dario Princic,이탈리아(Italy) / 프리울리 베네찌아 줄리아(Friuli Venezia Giulia),피노 그리지오 (Pinot Grigio) 100%,,,,,"흰살생선, 샐러드, 건육, 하몽, 프로슈토, 동남아요리, 파스타 등과 잘 어울린다.",,,1/5,3/5,2/5,1/5,,"흰살생선, 파스타, 동남아요리, 샐러드",,
"도멘 베르상, 생 브리 꾸베 몽 엠브라세","Domaine Bersan, Saint Bris Cuvée Mont Embrasé",https://www.wine21.com/13_search/wine_view.html?Idx=169236&lq=LIST,도메인 베르상  Domaine Bersan,프랑스(France) / 부르고뉴(Bourgogne) / 샤블리(Chablis) / 생-브리(Saint-Bris),소비뇽 블랑 (Sauvignon Blanc) 100%,Burgundy White,,,,"회, 스시, 연어, 광어, 생선구이, 조개구이, 새우, 해산물, 샐러드, 야채, 동남아요리, 아시아요리 등과 잘 어울린다.",,,1/5,3/5,1/5,1/5,,,,
"도멘 베르상, 샤블리 레 우쉬","Domaine Bersan, Chablis Les Ouches",https://www.wine21.com/13_search/wine_view.html?Idx=169237&lq=LIST,도메인 베르상  Domaine Bersan,프랑스(France) / 부르고뉴(Bourgogne) / 샤블리(Chablis),샤르도네 (Chardonnay) 100%,Burgundy White,,,,"훈제 연어, 스시, 회, 굴, 조개, 해산물, 다양한 치즈, 아시아요리, 동남아요리, 피자, 파스타 등과 잘 어울린다.",,,1/5,3/5,1/5,1/5,,"해산물, 치즈",,
"도멘 베르상, 꼬뜨 도세르 꾸베 루이 베르상","Domaine Bersan, Côtes d'Auxerre Cuvée Louis Bersan",https://www.wine21.com/13_search/wine_view.html?Idx=169238&lq=LIST,도메인 베르상  Domaine Bersan,프랑스(France) / 부르고뉴(Bourgogne),샤르도네 (Chardonnay) 100%,,,,,"훈제오리, 오리로스, 치킨, 훈제연어, 장어구이, 해산물, 숙성 치즈, 피자, 파스타, 탕수육 등과 잘 어울린다.",,,1/5,3/5,3/5,1/5,,"해산물, 수육, 탕수육, 치즈",,
"도멘 베르상, 이렁씨 꾸베 루이 베르상","Domaine Bersan, Irancy Cuvee Louis Bersan",https://www.wine21.com/13_search/wine_view.html?Idx=169239&lq=LIST,도메인 베르상  Domaine Bersan,프랑스(France) / 부르고뉴(Bourgogne) / 샤블리(Chablis) / 이랑시(Irancy),피노 누아 (Pinot Noir) 100%,Burgundy Red,,,,"로스트비프, 오리고기, 닭고기, 연어, 참치, 버섯, 다양한 치즈, 파스타와 잘 어울린다.",,,1/5,3/5,3/5,2/5,,"파스타, 버섯, 치즈",,
"도멘 테흐닉, 암포라 생 브리","Domaine Ternynck, Amphore Saint Bris",https://www.wine21.com/13_search/wine_view.html?Idx=169240&lq=LIST,도멘 테흐닉  Domaine Ternynck,프랑스(France) / 부르고뉴(Bourgogne) / 샤블리(Chablis) / 생-브리(Saint-Bris),소비뇽 블랑 (Sauvignon Blanc) 100%,Burgundy White,,,,"회, 스시, 연어, 광어, 생선구이, 조개구이, 새우, 해산물, 샐러드, 야채, 동남아요리, 아시아요리 등과 잘 어울린다.",,,1/5,3/5,1/5,1/5,,,,
"도멘 테흐닉, 암포라 샤블리","Domaine Ternynck, Amphore Chablis",https://www.wine21.com/13_search/wine_view.html?Idx=169241&lq=LIST,도멘 테흐닉  Domaine Ternynck,프랑스(France) / 부르고뉴(Bourgogne) / 샤블리(Chablis),샤르도네 (Chardonnay) 100%,Burgundy Chablis,,,,"훈제 연어, 스시, 회, 굴, 조개, 해산물, 다양한 치즈, 아시아요리, 동남아요리, 피자, 파스타 등과 잘 어울린다.",,,1/5,3/5,1/5,1/5,,"해산물, 치즈",,
"도멘 테흐닉, 암포라 세자","Domaine Ternynck, Amphore Cesar",https://www.wine21.com/13_search/wine_view.html?Idx=169242&lq=LIST,도멘 테흐닉  Domaine Ternynck,프랑스(France) / 부르고뉴(Bourgogne),세자 (Cesar) 100%,Burgundy Red,,,,"붉은육류, 스테이크, 그릴요리, 버섯, 라자냐 등과 잘 어울린다.",,,1/5,3/5,3/5,3/5,,"라자냐, 버섯",,
"도멘 테흐닉, 암포라 피노누아","Domaine Ternynck, Amphore Pinot Noir",https://www.wine21.com/13_search/wine_view.html?Idx=169243&lq=LIST,도멘 테흐닉  Domaine Ternynck,프랑스(France) / 부르고뉴(Bourgogne),피노 누아 (Pinot Noir) 100%,Burgundy Red,,,,"로스트비프, 오리고기, 닭고기, 연어, 참치, 버섯, 다양한 치즈, 파스타와 잘 어울린다.",,,1/5,3/5,2/5,2/5,,"파스타, 버섯, 치즈",,
"테르핀, 야콧","Teprin,Jakot",https://www.wine21.com/13_search/wine_view.html?Idx=169244&lq=LIST,테르핀  Terpin,이탈리아(Italy) / 프리울리 베네찌아 줄리아(Friuli Venezia Giulia),야콧 (Jakot) 100%,,,,,"닭고기, 연어, 참치, 다양한 치즈, 리조또, 파스타 등과 잘 어울린다.",*오렌지 와인,,1/5,3/5,2/5,2/5,,"닭고기, 치즈",,
"테르핀, 시알리스 그리지오","Terpin, Sialis Grigio",https://www.wine21.com/13_search/wine_view.html?Idx=169245&lq=LIST,테르핀  Terpin,이탈리아(Italy) / 프리울리 베네찌아 줄리아(Friuli Venezia Giulia),피노 그리지오 (Pinot Grigio) 100%,,,,,"흰살생선, 샐러드, 건육, 하몽, 프로슈토, 동남아요리, 파스타 등과 잘 어울린다.",,,1/5,3/5,2/5,1/5,,"흰살생선, 파스타, 동남아요리, 샐러드",,
"바틱, 자리아","Batic, Zaria",https://www.wine21.com/13_search/wine_view.html?Idx=169247&lq=LIST,바틱  Batic,슬로베니아(Slovenia) / 비파바(Vipava),피넬라 (Pinella) 55% / 젤렌 (Zelen) 20% / 레불라 (Rebula) 14% / 비토브스카 (Vitovska) 5% / 클라르니카 (Klarnica) 3% / 루메니 머스캣 (Rumeni Muskat) 2% / 샤르도네 (Chardonnay) 1%,,,,,"훈제오리, 오리로스, 치킨, 훈제연어, 생선구이, 장어구이, 해산물, 숙성 치즈, 피자, 파스타 등과 잘 어울린다.",*오렌지 와인,,1/5,3/5,3/5,1/5,,"해산물, 치즈",,
"클리넥, 야콧","Klinec, Jakot",https://www.wine21.com/13_search/wine_view.html?Idx=169248&lq=LIST,클리넥  Klinec,슬로베니아(Slovenia) / 고리스카 브르다(Goriska Brda),야콧 (Jakot) 100%,,,,,"닭고기, 연어, 참치, 다양한 치즈, 리조또, 파스타 등과 잘 어울린다.",*오렌지 와인,,1/5,3/5,1/5,2/5,,"닭고기, 치즈",,
"토마스 쿠지네, 지올","Tomas Cusine, Geol",https://www.wine21.com/13_search/wine_view.html?Idx=169249&lq=LIST,토마스 쿠지네  Tomas Cusine,스페인(Spain) / 코스터스 델 세그레(Costers del Segre),까리냥 (Carignan/Carignane) / 메를로 (Merlot) / 카베르네 소비뇽 (Cabernet Sauvignon),Spanish Red,,14~15 %,16~18 ℃,"블고기, 양념갈비, 로스트비프, 바비큐, 그릴요리, 탕수육 과 잘 어울린다.",*2009 빈티지: 2013 International wine guide 금상 수상*VIVINO 4.0,젠니혼주류,1/5,3/5,3/5,3/5,"블랙베리, 자두, 유칼립투스","바비큐, 탕수육, 자두",프렌치오크 14개월 숙성,발효온도: 24-26ºC
"토마스 쿠지네, 빌로셀","Tomas Cusine, Vilosell",https://www.wine21.com/13_search/wine_view.html?Idx=169250&lq=LIST,토마스 쿠지네  Tomas Cusine,스페인(Spain) / 코스터스 델 세그레(Costers del Segre),템프라니요 (Tempranillo) / 시라/쉬라즈 (Syrah/Shiraz),Spanish Red,,14~15 %,16~18 ℃,"양념갈비, 불고기, 하몽, 말린과일, 견과류, 크림 치즈, 한국음식 과 잘 어울린다.",*PENIN: 92점* VIVINO 3.7*2023 대한민국 주류대상 '레드와인 구대륙 부문 대상',젠니혼주류,1/5,3/5,3/5,3/5,,"하몽, 견과류, 치즈",프렌치오크 9개월 숙성,발효온도: 22-26ºC
"토마스 쿠지네, 아우젤","Tomas Cusine, Auzells",https://www.wine21.com/13_search/wine_view.html?Idx=169251&lq=LIST,토마스 쿠지네  Tomas Cusine,스페인(Spain) / 코스터스 델 세그레(Costers del Segre),마카베오 (Macabeo) / 리슬링 (Riesling) / 소비뇽 블랑 (Sauvignon Blanc) / 샤르도네 (Chardonnay) / 알바리뇨 (Albarino(Alvarinho)),,,12~13 %,10~12 ℃,"회, 스시, 해산물, 샐러드, 야채, 파스타 등과 잘 어울린다.",*PENIN: 94점* VIVINO 3.7,젠니혼주류,1/5,3/5,2/5,1/5,미네랄,"스시, 해산물, 파스타",10% 는 프렌치오크에서 3개월간 효모숙성하며 나머지 90% 는 스테인레스 스틸탱크에서 숙성한 뒤 출시,발효온도: 16-20ºC
"토마스 쿠지네, 예브레","Tomas Cusine, Llebre",https://www.wine21.com/13_search/wine_view.html?Idx=169252&lq=LIST,토마스 쿠지네  Tomas Cusine,스페인(Spain) / 코스터스 델 세그레(Costers del Segre),템프라니요 (Tempranillo),Spanish Tempranillo,,13.5~14.5 %,16~18 ℃,"양념갈비, 불고기, 하몽, 말린과일, 견과류, 크림 치즈, 한국음식 과 잘 어울린다.",*Vivino 3.6,젠니혼주류,1/5,3/5,3/5,3/5,체리,"하몽, 견과류, 치즈",프렌치오크 3개월 숙성,발효온도: 22-26ºC
"테 마타, 에스테이트 샤도네이",Te Mata. Estate Chardonnay,https://www.wine21.com/13_search/wine_view.html?Idx=169253&lq=LIST,테 마타  Te Mata,뉴질랜드(New Zealand) / 노스 아일랜드(North Island) / 혹스 베이(Hawke's Bay),샤르도네 (Chardonnay),New Zealand Chardonnay,,13~14 %,10~12 ℃,"해산물, 치즈, 스낵류 등과 잘 어울린다.",* 2022 빈티지 - Wine Orbit 93점,에노테카코리아,1/5,3/5,2/5,1/5,"복숭아, 자몽, 파인애플, 미네랄, 캐슈넛, 오크","항정살, 돼지고기, 닭볶음탕, 후라이드, 오리고기, 해산물, 조개구이, 편육, 만두, 중국요리, 동남아요리, 아시아요리, 복숭아, 치즈, 리코타, 크림치즈, 스낵",스테인레스 탱크에서 10개월 간 숙성,"수확 된 포도 중 일부는 줄기를 분리하지 않고 송이채 압착하여 과즙을 프렌치 오크통에서 발효(MLF)하고, 나머지 포도는 줄기를 분리하여 샤도네이가 가진 향과 신선한 맛을 유지하기 위해 스테인레스 탱크에서 발효"
