와인명,와인 영문명,URL,생산자,국가/생산지역,주요품종,스타일,등급,알코올,음용온도,추천음식,기타정보,수입사,당도,산도,바디,타닌,아로마,음식매칭,숙성,양조
"스몰타운 빈야드, 클로벨라","Smalltown Vineyards, Clovella",https://www.wine21.com/13_search/wine_view.html?Idx=168970&lq=LIST,스몰타운 빈야드  Smalltown Vineyards,호주(Australia) / 사우스 오스트레일리아(South Australia) / 바로사 밸리(Barossa Valley),마타로 (Mataro) 70% / 그르나슈 (Grenache) 30%,,,,16~18 ℃,"그릴에 구운 양고기, 유린기, 양념치킨, 피자 등과 잘 어울린다.",,,1/5,3/5,4/5,4/5,자두,"양고기, 피자, 자두",22개월간 Neutral  French Oak에서 숙성,
"엠 샤푸티에, 데샹트 생 조셉 '아티스트 레이블'","M. Chapoutier, Deschants Saint Joseph",https://www.wine21.com/13_search/wine_view.html?Idx=168971&lq=LIST,엠 샤푸티에  M. Chapoutier,프랑스(France) / 론(Rhone) / 생-죠셉(Saint-Joseph),시라/쉬라즈 (Syrah/Shiraz) 100%,Northern Rhône Saint-Joseph,Saint-Joseph AOC(AOP),13~14 %,16~18 ℃,"붉은 육류, 치즈, 피자, 파스타 등과 잘 어울린다.",,금양인터내셔날,1/5,3/5,4/5,4/5,"배, 꽃, 감초",치즈,,
"스톤캡, 리슬링","Stonecap, Riesling",https://www.wine21.com/13_search/wine_view.html?Idx=168972&lq=LIST,스톤캡  Stonecap,미국(U.S.A) / 워싱턴(Washington State) / 콜롬비아 밸리(Columbia Valley),리슬링 (Riesling) 100%,Washington State Riesling,Columbia Valley AVA,12~13 %,8~10 ℃,"해산물, 샐러드, 오일 파스타, 삼겹살, 치즈 등과 잘 어울린다.",*Wine Spectator – Top Value Wines*Wine Enthusiast – Best Buy,,1/5,2/5,3/5,1/5,미네랄,"삼겹살, 해산물, 파스타, 샐러드, 치즈",아메리칸 오크 숙성,
"칼라브리아, 가이딩 스타 샤르도네","Calabria, Guiding Star Chardonnay",https://www.wine21.com/13_search/wine_view.html?Idx=168973&lq=LIST,칼라브리아 패밀리 와인즈  Calabria Family Wines,호주(Australia) / 사우스 오스트레일리아(South Australia),샤르도네 (Chardonnay),Australian Chardonnay,,12~13 %,10~12 ℃,"해산물과 크리미한 파스타, 신선한 치즈를 곁들인 무화과가 잘 어울린다.",,에노테카코리아,1/5,3/5,2/5,1/5,"레몬, 미네랄","해산물, 파스타, 치즈",,
"칼라브리아, 가이딩 스타 쉬라즈","Calabria, Guiding Star Shiraz",https://www.wine21.com/13_search/wine_view.html?Idx=168974&lq=LIST,칼라브리아 패밀리 와인즈  Calabria Family Wines,호주(Australia) / 사우스 오스트레일리아(South Australia),시라/쉬라즈 (Syrah/Shiraz),Australian Shiraz,,14~15 %,16~18 ℃,"로즈마리 향을 입힌 양고기와 발사믹 소스, 매콤한 아라비아따 파스타, 그릴에 구운 버섯과 마늘을 곁들인 소고기 스테이크 등이 잘 어울린다.",,에노테카코리아,1/5,3/5,4/5,3/5,"자두, 잼","양고기, 파스타, 버섯",,
"칼라브리아, 가이딩 스타 카베르네 소비뇽","Calabria,Guiding Star Cabernet Sauvignon",https://www.wine21.com/13_search/wine_view.html?Idx=168975&lq=LIST,칼라브리아 패밀리 와인즈  Calabria Family Wines,호주(Australia) / 사우스 오스트레일리아(South Australia),카베르네 소비뇽 (Cabernet Sauvignon),Australian Cabernet Sauvignon,,14~15 %,16~18 ℃,그릴에 구운 파프리카를 곁들인 소고기 스테이크가 잘 어울린다.,,에노테카코리아,1/5,3/5,4/5,3/5,"자두, 바닐라, 오크",,,
"칼라브리아, 가이딩 스타 모스카토","Calabria, Guiding Star Moscato",https://www.wine21.com/13_search/wine_view.html?Idx=168976&lq=LIST,칼라브리아 패밀리 와인즈  Calabria Family Wines,호주(Australia) / 사우스 오스트레일리아(South Australia),모스카토  (Moscato ) 100%,,,6~7 %,8~10 ℃,부드러운 치즈나 과일 플래터와 잘 어울린다.,,에노테카코리아,3/5,2/5,3/5,1/5,"복숭아, 레몬, 패션프루트, 장미","복숭아, 과일, 치즈",,
"칼라브리아, 나인 스톤즈 아들레이드 힐즈 샤르도네","Calabria, Nine Stones Adelaide Hills Chardonnay",https://www.wine21.com/13_search/wine_view.html?Idx=168977&lq=LIST,칼라브리아 패밀리 와인즈  Calabria Family Wines,호주(Australia) / 사우스 오스트레일리아(South Australia) / 애들레이드 힐즈(Adelaide Hills),샤르도네 (Chardonnay),Australian Chardonnay,,13~14 %,10~12 ℃,"허브를 곁들인 닭 요리와 스팀 채소, 연한 치즈와 잘 어울린다.",,에노테카코리아,1/5,3/5,3/5,1/5,"복숭아, 시트러스, 오크","채소, 치즈",,스테인레스 발효 후 프렌치 오크로 추가 발효
"티나찌, 말네라","Tinazzi, Malnera",https://www.wine21.com/13_search/wine_view.html?Idx=168978&lq=LIST,티나찌  Tinazzi,이탈리아(Italy) / 뿔리아(Puglia),메를로 (Merlot) / 말바시아 네라 (Malvasia nera),,,14~15 %,16~18 ℃,"애피타이저, 소고기, 돼지고기, 그릴요리, 숙성치즈 등과 잘 어울린다.",,에노테카코리아,1/5,3/5,3/5,3/5,"딸기, 자두, 후추",치즈,,
"로건, 릿지 오브 티어스 쉬라즈 '머지'","Logan, Ridge of Tears Shiraz 'Mudgee'",https://www.wine21.com/13_search/wine_view.html?Idx=168979&lq=LIST,로건 와인즈  Logan Wines,호주(Australia) / 뉴 사우스 웨일즈(New South Wales) / 멋지(Mudgee),시라/쉬라즈 (Syrah/Shiraz),Australian Shiraz,,13~14 %,16~18 ℃,"스테이크, 갈비, 스튜, 양고기, 그릴요리, 치즈, 탕수육, 한국음식 과 잘 어울린다.",,에노테카코리아,1/5,5/5,5/5,5/5,"체리, 자두, 타임, 타바코, 가죽","양고기, 탕수육, 자두, 치즈","15개월 French oak(225L,300L,500L) 숙성 후 블렌딩",
"티나찌, 메갈레","Tinazzi, Magale",https://www.wine21.com/13_search/wine_view.html?Idx=168980&lq=LIST,티나찌  Tinazzi,이탈리아(Italy) / 뿔리아(Puglia),네그로아마로 (Negroamaro),,,14~15 %,16~18 ℃,"애피타이저, 소고기, 돼지고기, 그릴요리, 숙성치즈 등과 잘 어울린다.",,에노테카코리아,1/5,3/5,3/5,3/5,"체리, 시나몬",치즈,아메리칸 오크에서 4-8개월 숙성,
"티나찌, 프리미티보","Tinazzi, Primitivo",https://www.wine21.com/13_search/wine_view.html?Idx=168981&lq=LIST,티나찌  Tinazzi,이탈리아(Italy) / 뿔리아(Puglia),프리미티보 (Primitivo),Southern Italy Primitivo,,14~15 %,16~18 ℃,"양고기, 경성 치즈, 프리모 피아토(이탈리아 정찬 코스 첫 번째 요리)",,에노테카코리아,1/5,3/5,3/5,3/5,체리,"양고기, 치즈",프렌치 & 아메리칸 오크에서 4-6개월 숙성,
"카스텔로 디 아마, 퍼플 로제","Castello di Ama, Purple Rose",https://www.wine21.com/13_search/wine_view.html?Idx=168982&lq=LIST,카스텔로 디 아마 [까스텔로 디 아마]   Castello di Ama,이탈리아(Italy) / 토스카나(Toscana),산지오베제 (Sangiovese),,Toscana IGT(IGP),13~14 %,10~12 ℃,"연어, 참치, 해산물, 새우, 다양한 치즈, 건육, 살라미, 프로슈토, 파스타 등과 잘 어울린다.",,에노테카코리아,1/5,3/5,2/5,1/5,"꽃, 미네랄","파스타, 치즈",,"압착한 포도즙 중 일부를 오크(Used)에서 발효, 그 후 12시간동안 스킨 컨택을 거치는 세니에 방식으로 만들어졌다."
"페트라, 10주년 스페셜 에디션","Petra, 10th Special Edition",https://www.wine21.com/13_search/wine_view.html?Idx=168983&lq=LIST,페트라  Petra,이탈리아(Italy) / 토스카나(Toscana),카베르네 소비뇽 (Cabernet Sauvignon) / 메를로 (Merlot),,,14~15 %,16~18 ℃,"붉은육류, 스테이크, 로스트비프, 양갈비, 바비큐, 불고기, 파스타, 다양한 치즈, 한국음식 등과 잘 어울린다.",,에노테카코리아,1/5,3/5,4/5,4/5,"블루베리, 잼, 코코아, 가죽","바비큐, 양갈비, 파스타, 치즈",양조 후 10년동안 셀러 숙성,
"알레그리니, 루가나","Allegrini, Lugana",https://www.wine21.com/13_search/wine_view.html?Idx=168984&lq=LIST,알레그리니  Allegrini,이탈리아(Italy) / 베네토(Veneto) / 베로나(Verona) / 루가나(Lugana),투르비아노 (Turbiano) / 코르테제 (Cortese),,Lugana DOC(DOP),12~13 %,10~12 ℃,"식전주로도 좋고, 흰살 생선 요리, 생선회(연어, 참치 등), 스시와도 좋은 페어링을 보여주는 와인이다.",,에노테카코리아,1/5,4/5,3/5,1/5,"꽃, 아몬드",식전주,4개월간 스테인리스 스틸 숙성,
"카사 로호, 라 가바차","Casa Rojo, La Gabacha",https://www.wine21.com/13_search/wine_view.html?Idx=168985&lq=LIST,카사 로호  Casa Rojo,스페인(Spain) / 루에다(Rueda),소비뇽 블랑 (Sauvignon Blanc),Spanish Sauvignon Blanc,,13~14 %,8~10 ℃,"해산물 요리, 특히 가재,크랩 요리에 잘 어울린다.",,금양인터내셔날 / 에노테카코리아,1/5,3/5,2/5,1/5,"살구, 복숭아, 시트러스, 감귤, 잔디, 허브","초밥, 생선회, 해산물, 식전주, 샐러드, 과일",,
제프 까렐 가주이,Gazouillis by Jeff Carrel,https://www.wine21.com/13_search/wine_view.html?Idx=168986&lq=LIST,제프 까렐  Jeff Carrel,프랑스(France) / 서던 프랑스(Southern France) / 랑그독 루씨용(Languedoc Roussillon),말벡 (Malbec) 100%,,,,16~18 ℃,"붉은 육류, 숙성된 치즈와 잘 어울린다.","*2019 빈티지: Gilbert & Gaillard: Gold Medal*유기농 와인*천연 효모만을 사용하며, 양조와 숙성시 SO2 무첨가*병입시 SO2 극소량 첨가*연평균 생산량: 40,000병",하이트진로,1/5,3/5,3/5,3/5,"체리, 모카",치즈,,
"브롤리아, 로베렐로","Broglia, Roverello",https://www.wine21.com/13_search/wine_view.html?Idx=168988&lq=LIST,브롤리아  Broglia,이탈리아(Italy) / 피에몬테(Piemonte) / 가비(Gavi),코르테제 (Cortese) 100%,,,,6~8 ℃,"칵테일 새우, 카나페, 광어 카르파쵸, 스낵이나 크림 치즈 등과 잘 어울린다.",,씨에스알와인,1/5,4/5,2/5,1/5,"세이지, 오크","광어, 새우, 치즈, 스낵",,
"라포스톨, 아팔타","Lapostolle, Apalta",https://www.wine21.com/13_search/wine_view.html?Idx=168989&lq=LIST,라포스톨 [까사 라포스톨]  Lapostolle [Casa Lapostolle],칠레(Chile) / 라펠 밸리(Rapel Valley) / 콜차구아 밸리(Cholchagua Valley) / 아팔타 밸리(Apalta Valley),카베르네 소비뇽 (Cabernet Sauvignon) 75% / 시라/쉬라즈 (Syrah/Shiraz) 15% / 카르메네르 (Carmenere) 10%,,,14~15 %,16~18 ℃,"불고기, 양갈비, 돼지갈비, 스테이크, 피자 등과 잘 어울린다.","*2018 빈티지: Tim Atkin 90점*라포스톨의 뛰어난 블렌딩 기술, 철학, 떼루아가 1병으로 모두 압축된 와인*칠레 최고의 와인 끌로 아팔타의 3rd Wine으로 데일리로 즐기는 프리미엄 와인",레뱅,1/5,3/5,4/5,3/5,,"스테이크, 돼지, 양갈비, 불고기, 피자",프렌치 오크배럴 13개월 숙성,
"리오 마지오, 발로네 로쏘 피케노","Rio Maggio, Vallone Rosso Piceno",https://www.wine21.com/13_search/wine_view.html?Idx=168990&lq=LIST,리오 마지오  Rio Maggio,이탈리아(Italy) / 마르케(Marche),몬테풀치아노 (Montepulciano) 70% / 산지오베제 (Sangiovese) 30%,Central Italy Red,Rosso Piceno DOC(DOP),13~14 %,16~18 ℃,"육류 요리, 숙성된 치즈, 트러플 요리 등과 잘 어울린다.",,지에프비노,1/5,3/5,4/5,4/5,"블랙커런트, 자두, 건포도, 말린과일, 정향, 시나몬, 다크초콜릿, 오크","소고기, 스테이크, 육류요리, 양갈비, 양고기, 양념갈비, 갈비찜, 족발, 라자냐, 크림파스타, 버섯, 트러플, 치즈, 파르미지아노, 그라노파다노","프렌치 바리크에서 최소 8~10개월 숙성, 병입되어 4-6개월 숙성",껍질째로 12~15일 동안 18~26도로 제어된 온도에서 발효
"리오 마지오, 텔루시아노 비앙코 마르케","Rio Maggio, Telusiano Bianco Marche",https://www.wine21.com/13_search/wine_view.html?Idx=168991&lq=LIST,리오 마지오  Rio Maggio,이탈리아(Italy) / 마르케(Marche),트레비아노 (Trebbiano) / 페코리노 (Pecorino) / 베르디키오 비앙코 (Verdicchio Bianco),Central Italy White,Marche IGT(IGP),13~14 %,10~12 ℃,"생선구이, 생선 수프, 닭고기 등과 잘 어울린다.",,지에프비노,1/5,3/5,2/5,1/5,"아카시아, 꿀","닭고기, 생선구이",,
"리오 마지오, 꼴레 몬테베르데 팔레리오 페코리노","Rio Maggio, Colle Monteverde Falerio Pecorino",https://www.wine21.com/13_search/wine_view.html?Idx=168992&lq=LIST,리오 마지오  Rio Maggio,이탈리아(Italy) / 마르케(Marche),페코리노 (Pecorino),Central Italy White,Falerio dei Colli Ascolani DOC(DOP),13~14 %,10~12 ℃,"흰 육류, 해산물 요리, 치즈 등과 잘 어울린다.",,지에프비노,1/5,4/5,3/5,1/5,백도,"해산물, 치즈",,
바롱 드 보삭 오크 샤르도네,Baron de Baussac Oak Chardonnay,https://www.wine21.com/13_search/wine_view.html?Idx=168993&lq=LIST,엘지아이 와인  LGI Wines,프랑스(France) / 서던 프랑스(Southern France) / 랑그독 루씨용(Languedoc Roussillon),샤르도네 (Chardonnay) 100%,,Pays d'Oc IGP,12~13 %,8~10 ℃,"치즈 바게트, 구운 닭 요리와 해산물 구이 등과 잘 어울린다.",*2023 대한민국 주류대상 '화이트와인 구대륙 부문 대상',,1/5,3/5,2/5,1/5,"배, 바닐라, 꿀","해산물, 치즈, 바게트",,"저온 발효, French Oak 사용, 랙킹 전 젖산발효"
"리오 마지오, 비눔 62 비앙코 마르케","Rio Maggio, Vinum 62 Bianco Marche",https://www.wine21.com/13_search/wine_view.html?Idx=168994&lq=LIST,리오 마지오  Rio Maggio,이탈리아(Italy) / 마르케(Marche),트레비아노 (Trebbiano) / 베르디키오 비앙코 (Verdicchio Bianco),Central Italy White,Marche IGT(IGP),13~14 %,10~12 ℃,"말린 대구, 숙성된 치즈, 푸아그라 등과 잘 어울린다.",,지에프비노,2/5,3/5,3/5,1/5,"리치, 미네랄, 꿀","푸아그라, 치즈",,
바롱 드 보삭 메를로,Baron de Baussac Merlot,https://www.wine21.com/13_search/wine_view.html?Idx=168995&lq=LIST,엘지아이 와인  LGI Wines,프랑스(France) / 서던 프랑스(Southern France) / 랑그독 루씨용(Languedoc Roussillon),메를로 (Merlot),,Pays d'Oc IGP,13~14 %,15~17 ℃,"돼지고기, 버섯구이, 살라미, 치즈 등과 잘 어울린다.",,,1/5,3/5,3/5,3/5,"블루베리, 자두, 민트","살라미, 버섯, 치즈",Amerian Oak 5개월 숙성,과일향을 향상시키고 타닌과 색을 추출하기 위해 전통적인 프랑스 와인 제조 기술과 현대시술의 조합으로 양조
"리비오 펠루가, 멀롯","Livio Felluga, Merlot",https://www.wine21.com/13_search/wine_view.html?Idx=168996&lq=LIST,리비오 펠루가  Livio Felluga,이탈리아(Italy) / 프리울리 베네찌아 줄리아(Friuli Venezia Giulia),메를로 (Merlot),Northern Italy Red,Colli Orientali del Friuli DOC(DOP),13~14 %,16~18 ℃,"붉은 육류, 구운 고기류, 숙성된 치즈 등과 잘 어울린다.",,지에프비노,1/5,3/5,3/5,3/5,"블랙커런트, 레드커런트, 블랙체리, 라스베리, 꽃, 후추, 감초, 커피","그릴요리, 육류요리, 붉은육류, 베이컨, 꼬치구이, 바비큐, 소시지, 항정살, 오겹살, 삼겹살, 돼지고기, 양꼬치, 건육, 훈제오리, 불고기, 육포, 양념갈비, 갈비찜, 치즈, 파르미지아노, 그라노파다노, 블루치즈, 스모크",프렌치 오크통엥서 12개월 간 숙성,온도 제어된 스테인리스 탱크에서 껍질과 발효 후 여과
"칸티네 체치, 주세페 베르디 람브루스코 로사 아마빌레","Cantine Ceci, Giuseppe Verdi Lambrusco Rosa Amabile",https://www.wine21.com/13_search/wine_view.html?Idx=168997&lq=LIST,칸티네 체치   Cantine Ceci,이탈리아(Italy) / 에밀리아 로마냐(Emilia-Romagna),람브루스코 (Lambrusco),,Emilia IGT(IGP),8~9 %,8~10 ℃,"해산물 요리, 구운 흰 육류, 가벼운 튀김 등과 잘 어울린다.",,지에프비노,3/5,3/5,2/5,1/5,"시트러스, 꽃","해산물, 튀김",,
"칸티네 체치, 주세페 베르디 말바시아 브륏","Cantine Ceci, Giuseppe Verdi Malvasia Brut",https://www.wine21.com/13_search/wine_view.html?Idx=168998&lq=LIST,칸티네 체치   Cantine Ceci,이탈리아(Italy) / 에밀리아 로마냐(Emilia-Romagna),말바시아 (Malvasia) 100%,,,11~12 %,6~8 ℃,"해산물, 달걀요리 , 야채튀김, 숙성된 치즈 등과 잘 어울린다.",,지에프비노,1/5,4/5,2/5,1/5,"복숭아, 시트러스","해산물, 튀김, 야채, 치즈",,Charmat Method로 양조
"칸티네 체치, 1938 스푸만테 브륏","Cantine Ceci, 1938 Spumante Brut",https://www.wine21.com/13_search/wine_view.html?Idx=168999&lq=LIST,칸티네 체치   Cantine Ceci,이탈리아(Italy) / 에밀리아 로마냐(Emilia-Romagna),샤르도네 (Chardonnay) / 피노 누아 (Pinot Noir),,,12~13 %,6~8 ℃,"생선요리, 조개요리 등과 잘 어울린다.",,지에프비노,1/5,4/5,2/5,1/5,"시트러스, 꽃",,,
노 에스 피투코 파이스 로제,No es Pituko Pais Rose,https://www.wine21.com/13_search/wine_view.html?Idx=169000&lq=LIST,에체베리아  Echeverria,칠레(Chile) / 마울레 밸리(Maule Valley),파이스 (Pais),,,12~13 %,10~12 ℃,"모짜렐라 치즈, 리코타 샐러드, 오일 파스타 등과 잘 어울린다.",,지에프비노,1/5,4/5,2/5,1/5,"딸기, 바나나","파스타, 샐러드",스테인리스 탱크에서 25일동안 천연 효모로 발효,수확한 포도를 10도의 차가운 온도에서 4-5일 압착 및 발효
에스 쿠이코 오크드 카버네 소비뇽,Es Cuiko Oaked Cabernet Sauvignon,https://www.wine21.com/13_search/wine_view.html?Idx=169001&lq=LIST,에체베리아  Echeverria,칠레(Chile) / 쿠리코 밸리(Curico Valley),카베르네 소비뇽 (Cabernet Sauvignon),,,13~14 %,16~18 ℃,"토마토 파스타, 하드 치즈 등과 잘 어울린다.",,지에프비노,1/5,4/5,4/5,3/5,,"파스타, 치즈",,
레 뻬이로땅 시라 그르나쉬,Les Peyrautins Syrah Grenache,https://www.wine21.com/13_search/wine_view.html?Idx=169002&lq=LIST,엘지아이 와인  LGI Wines,프랑스(France) / 서던 프랑스(Southern France),시라/쉬라즈 (Syrah/Shiraz) / 그르나슈 (Grenache),,,13~14 %,16~18 ℃,그릴에 구운 육류나 양고기 구이 등 풍성한 맛의 육류요리 등과 잘 어울린다.,,신세계엘앤비,1/5,3/5,5/5,4/5,후추,"육류요리, 양고기",,
레 뻬이로땅 시라,Les Peyrautins Syrah,https://www.wine21.com/13_search/wine_view.html?Idx=169003&lq=LIST,엘지아이 와인  LGI Wines,프랑스(France) / 서던 프랑스(Southern France),시라/쉬라즈 (Syrah/Shiraz),,,13~14 %,16~18 ℃,그릴에 구운 육류나 양고기 구이 등 풍성한 맛의 육류요리 등과 잘 어울린다.,,신세계엘앤비,1/5,3/5,5/5,4/5,"배, 오크","육류요리, 양고기",,
"깔멜 앤 조셉, 레 떼루아 포제르","Calmel & Joseph, Les Terroirs Faugeres",https://www.wine21.com/13_search/wine_view.html?Idx=169004&lq=LIST,깔멜 앤 조셉  Calmel & Joseph,프랑스(France) / 서던 프랑스(Southern France) / 랑그독 루씨용(Languedoc Roussillon),시라/쉬라즈 (Syrah/Shiraz) / 그르나슈 (Grenache) / 까리냥 (Carignan/Carignane),Languedoc-Roussillon Red,Faugères AOC(AOP),13~14 %,16~18 ℃,"니수아즈 샐러드, 허브를 올려 구운 붉은 육류요리 및 가금류, 라따뚜이 등과 잘 어울린다.",,신세계엘앤비,1/5,3/5,4/5,4/5,"타르, 동물","육류요리, 가금류, 샐러드",발효 후 탱크에서 12개월 숙성,
"깔멜 앤 조셉, 레 떼루아 생 쉬니앙","Calmel & Joseph, Les Terroirs Saint Chinian",https://www.wine21.com/13_search/wine_view.html?Idx=169005&lq=LIST,깔멜 앤 조셉  Calmel & Joseph,프랑스(France) / 서던 프랑스(Southern France) / 랑그독 루씨용(Languedoc Roussillon),시라/쉬라즈 (Syrah/Shiraz) / 그르나슈 (Grenache) / 쌩쏘 (Cinsault),Languedoc-Roussillon Red,Saint-Chinian AOC(AOP),13~14 %,16~18 ℃,"니수아즈 샐러드, 허브를 올려 구운 붉은 육류요리 및 가금류, 라따뚜이 등과 잘 어울린다.",,신세계엘앤비,1/5,3/5,4/5,4/5,"미네랄, 효모","육류요리, 가금류, 샐러드",콘크리트 탱크에서 발효 후 효모 찌꺼기와 함께 1년간 숙성,
"깔멜 앤 조셉, 레 떼루아 뷰 까리냥","Calmel & Joseph, Les Terroirs Vieux Carignan",https://www.wine21.com/13_search/wine_view.html?Idx=169006&lq=LIST,깔멜 앤 조셉  Calmel & Joseph,프랑스(France) / 서던 프랑스(Southern France) / 랑그독 루씨용(Languedoc Roussillon),까리냥 (Carignan/Carignane),Languedoc-Roussillon Red,,14~15 %,16~18 ℃,"붉은 육류요리, 돼지고기 로스트, 칠면조 요리, 오리고기 등과 잘 어울린다.",,신세계엘앤비,1/5,3/5,4/5,4/5,자두,육류요리,12개월 간 숙성 후 병입,
"깔멜 앤 조셉, 레 떼루아 미네르부아","Calmel & Joseph, Les Terroirs Minervois",https://www.wine21.com/13_search/wine_view.html?Idx=169007&lq=LIST,깔멜 앤 조셉  Calmel & Joseph,프랑스(France) / 서던 프랑스(Southern France) / 랑그독 루씨용(Languedoc Roussillon),시라/쉬라즈 (Syrah/Shiraz) / 그르나슈 (Grenache) / 까리냥 (Carignan/Carignane),Languedoc-Roussillon Red,Minervois AOC(AOP),14~15 %,16~18 ℃,"니수아즈 샐러드, 허브를 올려 구운 붉은 육류요리 및 가금류, 라따뚜이 등과 잘 어울린다.",,신세계엘앤비,1/5,3/5,4/5,4/5,"시나몬, 효모","육류요리, 가금류, 샐러드",스테인리스 스틸 탱크에서 발효 후 효모 찌꺼기와 함께 1년간 숙성,
"깔멜 앤 조셉, 레 떼루아 꼬르비에르","Calmel & Joseph, Les Terroirs, Corbieres",https://www.wine21.com/13_search/wine_view.html?Idx=169008&lq=LIST,깔멜 앤 조셉  Calmel & Joseph,프랑스(France) / 서던 프랑스(Southern France) / 랑그독 루씨용(Languedoc Roussillon),그르나슈 (Grenache) / 시라/쉬라즈 (Syrah/Shiraz),Languedoc-Roussillon Red,Corbières AOC(AOP),13~14 %,16~18 ℃,"구운 육류요리, 소스를 가미한 야생사냥고기, 블루치즈, 오리 가슴살 샐러드, 초콜릿 디저트 등과 잘 어울린다.",,신세계엘앤비,1/5,3/5,4/5,4/5,"배, 민트","육류요리, 샐러드",발효 후 콘크리트 탱크에서 6개월 숙성,
"깔멜 앤 조셉, 레 떼루아 꼬뜨 뒤 루시옹 빌라쥐","Calmel & Joseph, Les Terroirs, Cotes du Roussillon Villages",https://www.wine21.com/13_search/wine_view.html?Idx=169009&lq=LIST,깔멜 앤 조셉  Calmel & Joseph,프랑스(France) / 서던 프랑스(Southern France) / 랑그독 루씨용(Languedoc Roussillon),시라/쉬라즈 (Syrah/Shiraz) / 까리냥 (Carignan/Carignane) / 그르나슈 (Grenache),Languedoc-Roussillon Red,Côtes du Roussillon AOC(AOP),14~15 %,16~18 ℃,"구운 육류요리, 소스를 가미한 야생사냥고기, 블루치즈, 오리 가슴살 샐러드, 초콜릿 디저트 등과 잘 어울린다.",,신세계엘앤비,1/5,3/5,4/5,4/5,"민트, 코코아","육류요리, 샐러드",발효 후 콘크리트 탱크에서 숙성,
"깔멜 앤 조셉, 라 마돈느","Calmel & Joseph, La Madone",https://www.wine21.com/13_search/wine_view.html?Idx=169010&lq=LIST,깔멜 앤 조셉  Calmel & Joseph,프랑스(France) / 서던 프랑스(Southern France) / 랑그독 루씨용(Languedoc Roussillon),그르나슈 (Grenache) / 시라/쉬라즈 (Syrah/Shiraz),Languedoc-Roussillon Red,Corbières AOC(AOP),14~15 %,16~18 ℃,"양고기, 스테이크 등 풍미가 진한 붉은 육류요리 등과 잘 어울린다.",,신세계엘앤비,1/5,3/5,5/5,4/5,"블랙베리, 배, 시나몬",양고기,2년 된 배럴에 담아 15개월간 숙성,25℃ 온도에서 약 4주간 마세레이션과 알코올 발효를 거쳐 젖산발효도 진행
"깔멜 앤 조셉, 빌라 블랑쉬 그르나쉬 로제","Calmel & Joseph, Villa Blanche Grenache Rose",https://www.wine21.com/13_search/wine_view.html?Idx=169011&lq=LIST,깔멜 앤 조셉  Calmel & Joseph,프랑스(France) / 서던 프랑스(Southern France) / 랑그독 루씨용(Languedoc Roussillon),그르나슈 그리 (Grenache Gris) / 그르나슈 (Grenache),Languedoc-Roussillon Rosé,Pays d'Oc IGP,12~13 %,10~12 ℃,"피자, 파스타, 매콤한 해산물 요리, 시즈닝한 바비큐 등과 잘 어울린다.",,신세계엘앤비,1/5,3/5,3/5,1/5,"시트러스, 아니스, 민트, 효모","바비큐, 해산물",효모 찌꺼기와 함께 스테인리스 스틸 탱크에서 숙성,낮은 온도에서 6시간 가량 짧게 마세라시옹 과정을 거쳐 색깔과 풍미를 추출
"깔멜 앤 조셉, 빌라 블랑쉬 샤르도네","Calmel & Joseph, Villa Blanche Chardonnay",https://www.wine21.com/13_search/wine_view.html?Idx=169012&lq=LIST,깔멜 앤 조셉  Calmel & Joseph,프랑스(France) / 서던 프랑스(Southern France) / 랑그독 루씨용(Languedoc Roussillon),샤르도네 (Chardonnay),Languedoc-Roussillon White,Pays d'Oc IGP,13~14 %,10~12 ℃,"신선한 해산물, 생선구이, 크림소스 파스타 등과 잘 어울린다.",,신세계엘앤비,1/5,3/5,3/5,1/5,"열대과일, 꽃, 아니스, 민트, 오크","생선구이, 해산물, 파스타",오크 배럴에서 3개월 숙성,
"프레스코발디, 니포짜노 키안티 루피나 몬테소디","Frescobaldi, Nipozzano Chianti Rufina Riserva Montesodi",https://www.wine21.com/13_search/wine_view.html?Idx=169014&lq=LIST,프레스코발디  Frescobaldi,이탈리아(Italy) / 토스카나(Toscana) / 키안티(Chianti),산지오베제 (Sangiovese),Central Italy Red,Chianti Rufina DOCG(DOP),13~14 %,16~18 ℃,"오리고기, 소고기 스튜, 육전 등과 잘 어울린다.",,신세계엘앤비,1/5,3/5,3/5,4/5,"꽃, 오크",오리고기,15개월 간 프랑스와 오스트리아 산 오크 배럴에서 숙성,
