와인명,와인 영문명,URL,생산자,국가/생산지역,주요품종,스타일,알코올,음용온도,추천음식,수입사,당도,산도,바디,타닌,아로마,음식매칭,등급,기타정보,숙성,양조
"파머스 테이블, 샤도네이","Farmer's Table, Chardonnay",https://www.wine21.com/13_search/wine_view.html?Idx=163732&lq=LIST,파머스 테이블 와인  Farmer's Table Wines,미국(U.S.A) / 캘리포니아(California),샤르도네 (Chardonnay),Californian Chardonnay,,8~10 ℃,"바비큐, 훈제오리, 오리로스, 치킨, 훈제연어, 장어구이, 참치, 새우, 해산물, 숙성 치즈, 피자, 파스타, 탕수육 등과 잘 어울린다.",,1/5,3/5,3/5,1/5,바닐라,"바비큐, 수육, 탕수육, 치즈",California AVA,,,
"레드트리, 카베르네 소비뇽","Redtree, Cabernet Sauvignon",https://www.wine21.com/13_search/wine_view.html?Idx=163733&lq=LIST,레드트리  Redtree,미국(U.S.A) / 캘리포니아(California),카베르네 소비뇽 (Cabernet Sauvignon) 100%,Californian Cabernet Sauvignon,,15~17 ℃,"스테이크, 로스트비프, 양갈비, 바비큐, 불고기, 양념갈비, 족발, 한국음식과 잘 어울린다.",씨에스알와인,1/5,3/5,3/5,3/5,삼나무,"바비큐, 양갈비",California AVA,,,
"오베하 네그라, 싱글 빈야드 카르메네르","Oveja Negra, Single Vineyard Carmenere",https://www.wine21.com/13_search/wine_view.html?Idx=163734&lq=LIST,오베하 네그라  Oveja Negra,칠레(Chile) / 마울레 밸리(Maule Valley),카르메네르 (Carmenere) 97% / 쁘띠 베르도 (Petit Verdot) 3%,Chilean Carménère,,15~17 ℃,"붉은 육류, 스테이크, 갈비찜, 불고기, 양갈비, 한국음식과 잘 어울린다.",,1/5,3/5,4/5,3/5,오크,"스테이크, 양갈비",,,,
"오베하 네그라, 싱글 빈야드 시라","Oveja Negra, Single Vineyard Syrah",https://www.wine21.com/13_search/wine_view.html?Idx=163735&lq=LIST,오베하 네그라  Oveja Negra,칠레(Chile) / 마울레 밸리(Maule Valley),시라/쉬라즈 (Syrah/Shiraz) 97% / 비오니에 (Viognier) 3%,Chilean Syrah,,15~17 ℃,"스테이크, 로스트비프, 양갈비, 바비큐, 불고기, 양념갈비, 족발, 한국음식, 햄버거, 감자튀김 등과 잘 어울린다.",,1/5,3/5,4/5,3/5,"꽃, 허브","양갈비, 햄버거",,,,
"실버 고스트, 스페셜 에디션 카베르네 소비뇽","Silver Ghost, Special Edition Cabernet Sauvignon",https://www.wine21.com/13_search/wine_view.html?Idx=163736&lq=LIST,실버고스트  Silver Ghost,칠레(Chile) / 센트럴 밸리(Central Valley),카베르네 소비뇽 (Cabernet Sauvignon) 100%,Chilean Cabernet Sauvignon,,15~17 ℃,"토마토 파스타, 그릴에 구운 등심 스테이크, 숙성된 치즈 등과 잘 어울린다.",,1/5,4/5,4/5,4/5,코코아,"파스타, 치즈",,,,
"실버 고스트, 스페셜 에디션 샤도네이","Silver Ghost, Special Edition Chardonnay",https://www.wine21.com/13_search/wine_view.html?Idx=163737&lq=LIST,실버고스트  Silver Ghost,칠레(Chile) / 센트럴 밸리(Central Valley),샤르도네 (Chardonnay) 100%,Chilean Chardonnay,,8~10 ℃,"바비큐, 훈제오리, 오리로스, 치킨, 훈제연어, 장어구이, 참치, 새우, 해산물, 숙성 치즈, 피자, 파스타, 탕수육 등과 잘 어울린다.",,1/5,3/5,3/5,1/5,,"바비큐, 수육, 탕수육, 치즈",,,,
"실버 고스트, 싱글 빈야드 샤도네이","Silver Ghost, Single Vineyard Chardonnay",https://www.wine21.com/13_search/wine_view.html?Idx=163738&lq=LIST,실버고스트  Silver Ghost,칠레(Chile) / 라펠 밸리(Rapel Valley),샤르도네 (Chardonnay) 100%,Chilean Chardonnay,,8~10 ℃,"생선찜, 갑각류, 감바스 알 아히요 등과 잘 어울린다.",,1/5,3/5,3/5,1/5,"레몬, 파인애플, 미네랄, 토스트, 오크",생선찜,,,,
"실버 고스트, 싱글 빈야드 카베르네 소비뇽","Silver Ghost, Single Vineyard Cabernet Sauvignon",https://www.wine21.com/13_search/wine_view.html?Idx=163739&lq=LIST,실버고스트  Silver Ghost,칠레(Chile) / 라펠 밸리(Rapel Valley),카베르네 소비뇽 (Cabernet Sauvignon) 100%,Chilean Cabernet Sauvignon,,15~17 ℃,"붉은육류, 스테이크, 양갈비, 바비큐, 불고기, 파스타, 다양한 치즈, 햄버거, 한국음식 등과 잘 어울린다.",,1/5,3/5,3/5,4/5,,"양갈비, 치즈",,,,
"7 컬러즈, 소비뇽 블랑","7 Colores, Sauvignon Blanc",https://www.wine21.com/13_search/wine_view.html?Idx=163740&lq=LIST,세븐 컬러즈  7 Colores,칠레(Chile) / 센트럴 밸리(Central Valley),소비뇽 블랑 (Sauvignon Blanc) 100%,Chilean Sauvignon Blanc,,6~8 ℃,"훈제 연어, 농어, 광어, 생선구이, 조개구이, 새우, 해산물, 샐러드, 야채, 동남아요리, 아시아요리 등과 잘 어울린다.",씨에스알와인,1/5,4/5,2/5,1/5,,,,,,
"7 컬러즈, 카르메네르","7 Colores, Carmenere",https://www.wine21.com/13_search/wine_view.html?Idx=163741&lq=LIST,세븐 컬러즈  7 Colores,칠레(Chile) / 센트럴 밸리(Central Valley),카르메네르 (Carmenere) 100%,Chilean Carménère,,15~17 ℃,"붉은 육류, 스테이크, 갈비찜, 불고기, 양갈비, 한국음식과 잘 어울린다.",씨에스알와인,1/5,3/5,4/5,3/5,흙,"스테이크, 양갈비",,,,
"7 컬러즈, 메를로","7 Colores, Merlot",https://www.wine21.com/13_search/wine_view.html?Idx=163742&lq=LIST,세븐 컬러즈  7 Colores,칠레(Chile) / 센트럴 밸리(Central Valley),메를로 (Merlot) 100%,Chilean Merlot,,15~17 ℃,"스테이크, 훈제오리, 바비큐, 소시지, 수육, 프로슈토, 파스타, 피자 와 잘 어울린다.",씨에스알와인,1/5,3/5,3/5,3/5,초콜릿,"스테이크, 프로슈토, 훈제오리, 수육",,,,
"7 컬러즈, 리제르바 소비뇽 블랑-토론텔","7 Colores, Reserva Sauvignon Blanc-Torontel",https://www.wine21.com/13_search/wine_view.html?Idx=163743&lq=LIST,세븐 컬러즈  7 Colores,칠레(Chile) / 아콩카구아(Aconcagua) / 카사블랑카 밸리(Casablanca Valley),소비뇽 블랑 (Sauvignon Blanc) 90% / 토론테스 (Torrontes) 10%,,,6~8 ℃,"훈제 연어, 농어, 광어, 생선구이, 조개구이, 새우, 해산물, 샐러드, 야채, 동남아요리, 아시아요리 등과 잘 어울린다.",씨에스알와인,1/5,4/5,2/5,1/5,,,,,,
"7 컬러즈, 리제르바 까베르네 소비뇽-파이스","7 Colores, Reserva Cabernet Sauvignon-Pais",https://www.wine21.com/13_search/wine_view.html?Idx=163744&lq=LIST,세븐 컬러즈  7 Colores,칠레(Chile) / 마이포 밸리(Maipo Valley),카베르네 소비뇽 (Cabernet Sauvignon) 90% / 파이스 (Pais) 10%,,,15~17 ℃,"큐브 스테이크, 닭강정, 숙성된 치즈 등과 잘 어울린다.",씨에스알와인,1/5,3/5,4/5,3/5,"바닐라, 오크","스테이크, 닭강정, 치즈",,*The Global Cabernet Sauvignon Masters by The Drinks Business – Silver Medal*와인21닷컴 2019년 1월 이달의 와인으로 선정 - BEST WINE,,
"몰리두커, 걸 온 더 고","Mollydooker, Girl on the Go",https://www.wine21.com/13_search/wine_view.html?Idx=163745&lq=LIST,몰리두커  Mollydooker,호주(Australia) / 사우스 오스트레일리아(South Australia) / 맥라렌 베일(McLaren Vale),베르델호 (Verdelho) 100%,,,6~8 ℃,"샐러드, 치킨, 튀김, 바베큐, 떡볶이, 순대, 자장면, 피자 등과 잘 어울린다.",씨에스알와인,2/5,4/5,3/5,1/5,,"치킨, 피자, 자장면, 튀김, 샐러드",,,,
"몰리두커,더 스쿠터","Mollydooker, The Scooter",https://www.wine21.com/13_search/wine_view.html?Idx=163746&lq=LIST,몰리두커  Mollydooker,호주(Australia) / 사우스 오스트레일리아(South Australia) / 맥라렌 베일(McLaren Vale),메를로 (Merlot) 100%,Australian Merlot,,15~17 ℃,"통삼겹살구이, 갈비찜, 불고기버거 등과 잘 어울린다.",씨에스알와인,1/5,3/5,5/5,4/5,"잼, 삼나무",,,*2017 빈티지: Wine Spectator 90점*2016 빈티지: Wine Spectator 90점,,
"소호, 핑크 쉽 로제","Soho, Pink Sheep Rose",https://www.wine21.com/13_search/wine_view.html?Idx=163747&lq=LIST,소호  Soho,뉴질랜드(New Zealand) / 사우스 아일랜드(South Island) / 말보로(Marlborough),피노 누아 (Pinot Noir) 100%,,,6~8 ℃,"생선회, 훈제 연어, 닭고기 테린 등과 잘 어울린다.",씨에스알와인,1/5,3/5,2/5,1/5,"복숭아, 꽃","닭고기, 복숭아",,,,
샤또 귀로 튜브 100ml,Chateau Guiraud Tube 100ml,https://www.wine21.com/13_search/wine_view.html?Idx=163748&lq=LIST,"샤또 귀로  Chateau Guiraud, 1st Cru Classe - Sauternes",프랑스(France) / 보르도(Bordeaux) / 소테른(Sauternes),세미용 (Semillon) 65% / 소비뇽 블랑 (Sauvignon Blanc) 35%,Bordeaux Sauternes,,6~8 ℃,"바비큐, 꼬치구이, 양념치킨, 생선구이, 튀김, 샐러드, 중국요리, 아시아요리, 순대, 떡볶이 등과 잘 어울린다.",,5/5,3/5,3/5,1/5,,"생선구이, 중국요리, 아시아요리, 튀김, 샐러드",,*2002 빈티지: Robert Parker 91점,,
샤또 라투르 마티악 튜브 100ml,Chateau Latour-Martillac Tube 100ml,https://www.wine21.com/13_search/wine_view.html?Idx=163749&lq=LIST,샤또 라뚜르 마르띠악  Chateau Latour Martillac,프랑스(France) / 보르도(Bordeaux) / 뻬싹-레오냥(Pessac-Leognan),카베르네 소비뇽 (Cabernet Sauvignon) 51% / 메를로 (Merlot) 42% / 쁘띠 베르도 (Petit Verdot) 7%,Bordeaux Pessac-Léognan,,15~17 ℃,"붉은육류, 불고기, 갈비찜, 양갈비, 치킨, 순대, 햄버거, 피자, 한국음식 등과 잘 어울린다.",,1/5,4/5,4/5,4/5,,"붉은육류, 햄, 양갈비, 치킨",,"*2012 빈티지: Robert Parker 90점, James Suckling 93점, Wine Spectator 89점, Wine Enthusiast 91점",,
샤또 키르완 튜브 100ml,Chateau Kirwan Tube 100ml,https://www.wine21.com/13_search/wine_view.html?Idx=163750&lq=LIST,"샤또 끼르완  Chateau Kirwan, Grand Cru Classe,3rd Cru",프랑스(France) / 보르도(Bordeaux) / 마고(Margaux),카베르네 소비뇽 (Cabernet Sauvignon) 68% / 메를로 (Merlot) 20% / 카베르네 프랑 (Cabernet Franc) 7% / 쁘띠 베르도 (Petit Verdot) 5%,Bordeaux Margaux,,15~17 ℃,"붉은육류, 불고기, 갈비찜, 양갈비, 치킨, 순대, 햄버거, 피자, 한국음식 등과 잘 어울린다.",,1/5,4/5,4/5,4/5,,"붉은육류, 햄, 양갈비, 치킨",,"*2012 빈티지: Robert Parker 90+점, James Suckling 91점, Wine Enthusiast 90점",,
샤또 베이슈벨 튜브 100ml,Chateau Beychevelle Tube 100ml,https://www.wine21.com/13_search/wine_view.html?Idx=163751&lq=LIST,"샤또 베이슈벨  Chateau Beychevelle, Grand Cru Classe,4th Cru",프랑스(France) / 보르도(Bordeaux) / 생-쥴리앙(Saint-Julien),카베르네 소비뇽 (Cabernet Sauvignon) 55% / 메를로 (Merlot) 36% / 쁘띠 베르도 (Petit Verdot) 9%,Bordeaux Saint-Julien,,15~17 ℃,"붉은육류, 불고기, 갈비찜, 양갈비, 치킨, 순대, 햄버거, 피자, 한국음식 등과 잘 어울린다.",,1/5,4/5,4/5,4/5,,"붉은육류, 햄, 양갈비, 치킨",,"*2013 빈티지: James Suckling 92점, Wine Enthusiast 92점",,
"발타사 레스, 리슬링 아우스레제 튜브 100ml","Balthasar Ress, Riesling Auslese Tube 100ml",https://www.wine21.com/13_search/wine_view.html?Idx=163752&lq=LIST,발타사 레스  Balthasar Ress,독일(Germany) / 라인가우(Rheingau),리슬링 (Riesling) 100%,German Riesling,,8~10 ℃,"샐러드, 크림치즈, 리코타, 말린과일, 초콜릿, 스낵 등 디저트와 잘 어울린다.",씨에스알와인,3/5,5/5,3/5,1/5,,샐러드,,*2005 빈티지: Wine Spectator 94점,,
샤또 블루엥,Chateau Blouin,https://www.wine21.com/13_search/wine_view.html?Idx=163753&lq=LIST,메종 몽따냑  MAISON MONTAGNAC,프랑스(France) / 보르도(Bordeaux),메를로 (Merlot) / 카베르네 프랑 (Cabernet Franc),Bordeaux Red,12.5 %,15~17 ℃,"스테이크, 훈제오리, 치킨, 바비큐, 소시지, 브리 치즈와 잘 어울린다.",,1/5,4/5,3/5,5/5,"배, 흙",스테이크,Bordeaux AOC(AOP),,,
"샤또 르 포르, 화이트","Chateau Le Faure, White",https://www.wine21.com/13_search/wine_view.html?Idx=163754&lq=LIST,메종 몽따냑  MAISON MONTAGNAC,프랑스(France) / 보르도(Bordeaux),세미용 (Semillon) / 소비뇽 블랑 (Sauvignon Blanc) / 뮈스까델 (Muscadelle),Bordeaux White,12~13 %,10~12 ℃,"바비큐, 꼬치구이, 양념치킨, 생선구이, 튀김, 샐러드, 중국요리, 아시아요리, 순대, 떡볶이 등과 잘 어울린다.",,1/5,2/5,2/5,1/5,꽃,"생선구이, 중국요리, 아시아요리, 튀김, 샐러드",Bordeaux AOC(AOP),,,
"샤또 르 포르, 레드","Chateau Le Faure, Red",https://www.wine21.com/13_search/wine_view.html?Idx=163755&lq=LIST,메종 몽따냑  MAISON MONTAGNAC,프랑스(France) / 보르도(Bordeaux),메를로 (Merlot) / 카베르네 소비뇽 (Cabernet Sauvignon) / 카베르네 프랑 (Cabernet Franc),Bordeaux Red,13~14 %,15~17 ℃,"스테이크, 로스트비프, 훈제오리, 바비큐, 소시지, 수육, 숙성 치즈, , 파스타, 피자 와 잘 어울린다.",,1/5,3/5,3/5,3/5,,"훈제오리, 수육, 치즈",Bordeaux AOC(AOP),,,
"체키, 끼안티 클라시코 리제르바","Cecchi, Chianti Classico Riserva",https://www.wine21.com/13_search/wine_view.html?Idx=163756&lq=LIST,체키  Cecchi,이탈리아(Italy) / 토스카나(Toscana) / 키안티 클라시코(Chianti Classico),산지오베제 (Sangiovese) 95% / 기타 품종 (Other Grapes) 5%,,13~14 %,16~18 ℃,"스테이크, 로스트비프, 양갈비, 포크, 바비큐, 그릴요리, 오리고기, 프로슈토, 라자냐, 파스타, 피자, 수육 과 잘 어울린다.",비케이 트레이딩,1/5,4/5,4/5,3/5,"레드커런트, 블랙체리, 체리, 자두, 꽃, 정향, 시나몬, 허브, 오크, 가죽","로스트비프, 스테이크, 바비큐, 양갈비, 프로슈토, 오리고기, 수육, 라자냐, 파스타, 자두, 파르미지아노, 그라노파다노, 콩테, 모짜렐라",Chianti Classico DOCG(DOP),,12개월 프렌치 바리크(Barrique)와 토노(Tonneaux) 및  3개월 병입 숙성.,
"체끼, 끼안티 고베르노","Cecchi, Chianti Governo",https://www.wine21.com/13_search/wine_view.html?Idx=163757&lq=LIST,체키  Cecchi,이탈리아(Italy) / 토스카나(Toscana) / 키안티(Chianti),산지오베제 (Sangiovese) 90% / 기타 품종 (Other Grapes) 10%,Central Italy Red,13~14 %,15~17 ℃,"스테이크, 로스트비프, 포크, 바비큐, 그릴요리, 오리고기, 프로슈토, 라자냐, 파스타, 피자, 수육 과 잘 어울린다.",비케이 트레이딩,2/5,3/5,3/5,3/5,,"프로슈토, 오리고기, 수육",Chianti DOCG(DOP),*Berliner Wine Trophy –Gold Medal*Mundus Vini–Gold Medal,,
"체끼, 라모라 메를로 디 토스카나","Cecchi, La Mora Merlot di Toscana",https://www.wine21.com/13_search/wine_view.html?Idx=163758&lq=LIST,체키  Cecchi,이탈리아(Italy) / 토스카나(Toscana) / 마렘마(Maremma),메를로 (Merlot),Central Italy Red,13~14 %,15~17 ℃,"스테이크, 훈제오리, 바비큐, 소시지, 수육, 프로슈토, 파스타, 피자 와 잘 어울린다.",,1/5,4/5,3/5,3/5,허브,"스테이크, 프로슈토, 훈제오리, 수육",,*2014 빈티지: Gambero Rosso - 2 biccieri,,
"체끼, 라모라 베르멘티노","Cecchi, La Mora Vermentino",https://www.wine21.com/13_search/wine_view.html?Idx=163759&lq=LIST,체키  Cecchi,이탈리아(Italy) / 토스카나(Toscana) / 마렘마(Maremma),베르멘티노 (Vermentino) / 기타 품종 (Other Grapes),,13~14 %,10~12 ℃,"샐러드, 치킨, 튀김, 바베큐, 떡볶이, 순대, 자장면, 피자 등과 잘 어울린다.",,1/5,2/5,1/5,1/5,,"치킨, 피자, 자장면, 튀김, 샐러드",,,,
"체끼, 라모라 모렐리노 디 스칸사노","Cecchi, La Mora Morellino di Scansano",https://www.wine21.com/13_search/wine_view.html?Idx=163760&lq=LIST,체키  Cecchi,이탈리아(Italy) / 토스카나(Toscana),산지오베제 (Sangiovese) / 기타 품종 (Other Grapes),Central Italy Red,13~14 %,15~17 ℃,"로스트비프, 포크, 바비큐, 그릴요리, 오리고기, 프로슈토, 라자냐, 파스타, 피자, 수육 과 잘 어울린다.",,1/5,4/5,3/5,3/5,,"프로슈토, 오리고기, 수육",,"*2015 빈티지: Berliner Wine Trophy – Gold Medal, Mundus Vini – Silver Medal, Berliner Wine Trophy – Gold Medal",,
"체끼, 비노 노빌레 디 몬테풀치아노","Cecchi, Vino Nobile di Montepulciano",https://www.wine21.com/13_search/wine_view.html?Idx=163761&lq=LIST,체키  Cecchi,이탈리아(Italy) / 토스카나(Toscana) / 몬테풀치아노(Montepulciano),산지오베제 (Sangiovese) / 기타 품종 (Other Grapes),Central Italy Red,13~14 %,15~17 ℃,"그릴에 구운 소고기, 양고기와 치즈 등과 잘 어울린다.",비케이 트레이딩,1/5,3/5,4/5,4/5,"체리, 흙","소고기, 양고기, 치즈",Vino Nobile di Montepulciano DOCG(DOP),"*2013 빈티지: Wine Enthusiast 90점, Wine Spectator 90점*Mundus Vini Gold Medal, Berliner Wine Trophy Gold Medal",,
"체끼, 브루넬로 디 몬탈치노","Cecchi, Brunello di Montalcino",https://www.wine21.com/13_search/wine_view.html?Idx=163762&lq=LIST,체키  Cecchi,이탈리아(Italy) / 토스카나(Toscana) / 몬탈치노(Montalcino),산지오베제 (Sangiovese),Italian Brunello,14 %,15~17 ℃,"붉은육류, 스테이크, 로스트비프, 족발, 라자냐, 파스타, 한국음식 등과 잘 어울린다.",비케이 트레이딩,1/5,3/5,4/5,4/5,"체리, 감초",,Brunello di Montalcino DOCG(DOP),"*2011 빈티지: James Suckling 90점, Tuscan Vines John Fodera 93점",,
"체끼, 이 메를리","Cecchi, I Merli",https://www.wine21.com/13_search/wine_view.html?Idx=163763&lq=LIST,체키  Cecchi,이탈리아(Italy) / 토스카나(Toscana),메를로 (Merlot) / 산지오베제 (Sangiovese),Central Italy Red,13~14 %,15~17 ℃,"로스트비프, 포크, 바비큐, 그릴요리, 오리고기, 프로슈토, 라자냐, 파스타, 피자, 수육 과 잘 어울린다.",비케이 트레이딩,1/5,2/5,3/5,3/5,딸기,"프로슈토, 오리고기, 수육",,,,
"몬테 구엘포, 일 페니코테로","Monte guelfo, Il Fenicottero",https://www.wine21.com/13_search/wine_view.html?Idx=163764&lq=LIST,체키  Cecchi,이탈리아(Italy) / 토스카나(Toscana),산지오베제 (Sangiovese) / 시라/쉬라즈 (Syrah/Shiraz),,12~13 %,10~12 ℃,"붉은육류, 스테이크, 로스트비프, 양갈비, 양고기, 족발, 라자냐, 파스타와 잘 어울린다.",,1/5,2/5,1/5,2/5,허브,족발,,,,
"체끼, 르 레프리","Cecchi, Le Lepri",https://www.wine21.com/13_search/wine_view.html?Idx=163765&lq=LIST,체키  Cecchi,이탈리아(Italy) / 토스카나(Toscana),베르멘티노 (Vermentino) / 샤르도네 (Chardonnay) / 소비뇽 블랑 (Sauvignon Blanc),Central Italy White,12~13 %,10~12 ℃,"샐러드, 치킨, 튀김, 바베큐, 떡볶이, 순대, 자장면, 피자 등과 잘 어울린다.",비케이 트레이딩,1/5,2/5,1/5,1/5,꽃,"치킨, 피자, 자장면, 튀김, 샐러드",,,Stainless Steel 숙성,
"도미니오 데 라 베가, 이딜리쿰 까바 브륏 로제","Dominio de La Vega, Idilicum Brut Rose",https://www.wine21.com/13_search/wine_view.html?Idx=163766&lq=LIST,도미니오 데 라 베가  Dominio de La Vega,스페인(Spain) / 발렌시아(Valencia),가르나차  (Garnacha) 100%,Spanish Sparkling,11.5~12.5 %,6~8 ℃,"식전주, 전채요리, 회, 스시, 해산물, 건육, 살라미, 하몽, 스낵 등과 잘 어울린다.",비케이 트레이딩,1/5,3/5,3/5,1/5,,"스시, 해산물, 식전주, 전채요리, 스낵",Cava DO(DOP),,,
"도미니오 데 라 베가, 이딜리쿰 까바 브륏","Dominio de La Vega, Idilicum Cava Brut",https://www.wine21.com/13_search/wine_view.html?Idx=163767&lq=LIST,도미니오 데 라 베가  Dominio de La Vega,스페인(Spain) / 발렌시아(Valencia),마카베오 (Macabeo),Spanish Cava,12 %,6~8 ℃,"식전주, 전채요리, 회, 스시, 해산물, 건육, 살라미, 하몽, 스낵 등과 잘 어울린다.",비케이 트레이딩,1/5,2/5,2/5,1/5,"사과, 감귤","스시, 해산물, 식전주, 전채요리, 스낵",,,,
"도미니오 데 라 베가, 이딜리쿰 까바 세미-세코","Dominio de La Vega, Idilicum Cava Semi-Seco",https://www.wine21.com/13_search/wine_view.html?Idx=163768&lq=LIST,도미니오 데 라 베가  Dominio de La Vega,스페인(Spain) / 발렌시아(Valencia),그르나슈 (Grenache),Spanish Cava,12 %,6~8 ℃,"샐러드, 치킨, 튀김, 바베큐, 떡볶이, 순대, 자장면, 피자 등과 잘 어울린다.",비케이 트레이딩,3/5,2/5,2/5,1/5,사과,"치킨, 피자, 자장면, 튀김, 샐러드",,,,
"소모스, 크리안자","Sommos, Crianza",https://www.wine21.com/13_search/wine_view.html?Idx=163769&lq=LIST,보데가 소모스  Bodega Sommos,스페인(Spain) / 소몬타노(Somontano),카베르네 소비뇽 (Cabernet Sauvignon) / 시라/쉬라즈 (Syrah/Shiraz) / 메를로 (Merlot),Spanish Red,14~15 %,16~18 ℃,"붉은육류, 스테이크, 불고기, 갈비찜, 양갈비, 치킨, 순대, 한국음식과 잘 어울린다.",비케이 트레이딩,1/5,2/5,3/5,3/5,"블랙베리, 체리, 꽃, 후추, 오크","스테이크, 양갈비, 치킨, 치즈",,*Mundus vini Gold,9개월 오크 숙성 후 병 숙성,
"소모스, 버라이어탈 블랑","Sommos, Varietales Blanc",https://www.wine21.com/13_search/wine_view.html?Idx=163770&lq=LIST,보데가 소모스  Bodega Sommos,스페인(Spain) / 소몬타노(Somontano),샤르도네 (Chardonnay) / 게뷔르츠트라미너 (Gewurztraminer) / 피노 누아 (Pinot Noir),,13~14 %,10~12 ℃,"샐러드, 치킨, 튀김, 바베큐, 떡볶이, 순대, 자장면, 피자 등과 잘 어울린다.",,1/5,2/5,1/5,1/5,"열대과일, 오크","치킨, 피자, 자장면, 튀김, 샐러드",,,,
"소모스, 메를로","Sommos, Merlot",https://www.wine21.com/13_search/wine_view.html?Idx=163771&lq=LIST,보데가 소모스  Bodega Sommos,스페인(Spain) / 소몬타노(Somontano),메를로 (Merlot),Spanish Merlot,14~15 %,15~17 ℃,"스테이크, 훈제오리, 바비큐, 소시지, 수육, 프로슈토, 파스타, 피자 와 잘 어울린다.",비케이 트레이딩,1/5,2/5,1/5,3/5,,"스테이크, 프로슈토, 훈제오리, 수육",,,,
"소모스, 리제르바","Sommos, Reserva",https://www.wine21.com/13_search/wine_view.html?Idx=163772&lq=LIST,보데가 소모스  Bodega Sommos,스페인(Spain) / 소몬타노(Somontano),시라/쉬라즈 (Syrah/Shiraz) / 메를로 (Merlot) / 템프라니요 (Tempranillo) / 카베르네 소비뇽 (Cabernet Sauvignon),Spanish Red,14~15 %,15~17 ℃,"붉은육류, 불고기, 갈비찜, 양갈비, 치킨, 순대, 햄버거, 피자, 한국음식 등과 잘 어울린다.",비케이 트레이딩,1/5,2/5,4/5,4/5,오크,"붉은육류, 햄, 양갈비, 치킨",,*Concours Mondialde Bruxelles Gold*Korea Wine Challenge Silver,,
"소모스, 게뷔르츠트라미너","Sommos, Gewurztraminer",https://www.wine21.com/13_search/wine_view.html?Idx=163773&lq=LIST,보데가 소모스  Bodega Sommos,스페인(Spain) / 소몬타노(Somontano),게뷔르츠트라미너 (Gewurztraminer),,13~14 %,10~12 ℃,"생선회, 생선구이, 조개구이, 새우, 해산물, 샐러드, 야채, 동남아요리, 아시아요리 등과 잘 어울린다.",비케이 트레이딩,1/5,2/5,1/5,1/5,꽃,,,*Korea Wine Challenge Silver,,
"소모스, 프리미엄","Sommos, Premium",https://www.wine21.com/13_search/wine_view.html?Idx=163774&lq=LIST,보데가 소모스  Bodega Sommos,스페인(Spain) / 소몬타노(Somontano),템프라니요 (Tempranillo) / 메를로 (Merlot) / 시라/쉬라즈 (Syrah/Shiraz),Spanish Red,14~15 %,15~17 ℃,"붉은육류, 불고기, 갈비찜, 양갈비, 치킨, 순대, 햄버거, 피자, 한국음식 등과 잘 어울린다.",비케이 트레이딩,1/5,2/5,4/5,4/5,오크,"붉은육류, 햄, 양갈비, 치킨",,,,
"소모스, 버라이어탈 틴토","Sommos, Varietales Tinto",https://www.wine21.com/13_search/wine_view.html?Idx=163775&lq=LIST,보데가 소모스  Bodega Sommos,스페인(Spain) / 소몬타노(Somontano),템프라니요 (Tempranillo) / 메를로 (Merlot) / 시라/쉬라즈 (Syrah/Shiraz),Spanish Red,14~15 %,15~17 ℃,"붉은육류, 불고기, 갈비찜, 양갈비, 치킨, 순대, 한국음식과 잘 어울린다.",,1/5,2/5,3/5,3/5,"체리, 오크","붉은육류, 양갈비, 치킨",,,,
"펜리 이스테이트, 피닉스 까베르네 소비뇽","Penley Estate, Phoenix Cabernet Sauvignon",https://www.wine21.com/13_search/wine_view.html?Idx=163776&lq=LIST,펜리 이스테이트  Penley Estate,호주(Australia) / 사우스 오스트레일리아(South Australia) / 쿠나와라(Coonawarra),카베르네 소비뇽 (Cabernet Sauvignon) 100%,Australian Cabernet Sauvignon,14~15 %,15~17 ℃,"붉은육류, 스테이크, 양갈비, 바비큐, 불고기, 파스타, 다양한 치즈, 햄버거, 한국음식 등과 잘 어울린다.",비케이 트레이딩,1/5,3/5,4/5,4/5,"자두, 꽃, 감초, 오크","양갈비, 자두, 치즈",,"*2016 빈티지: James halliday 89점, Wine Spectator 93점*죽기전에 마셔봐야할 와인 1001*Wine Spectator Top 100 28위",,
"펜리 이스테이트, 팀브렐 블렌드","Penley Estate, Timbrell Blend",https://www.wine21.com/13_search/wine_view.html?Idx=163777&lq=LIST,펜리 이스테이트  Penley Estate,호주(Australia) / 사우스 오스트레일리아(South Australia) / 쿠나와라(Coonawarra),카베르네 소비뇽 (Cabernet Sauvignon) 65% / 시라/쉬라즈 (Syrah/Shiraz) 20% / 메를로 (Merlot) 15%,,14~15 %,15~17 ℃,"붉은육류, 스테이크, 양갈비, 바비큐, 불고기, 파스타, 다양한 치즈, 햄버거, 한국음식 등과 잘 어울린다.",,1/5,3/5,4/5,4/5,"딸기, 감초, 오크, 흙","양갈비, 치즈",,*2016 빈티지: Vinous 90점,,
