와인명,와인 영문명,URL,생산자,국가/생산지역,주요품종,스타일,등급,양조,숙성,음용온도,추천음식,수입사,당도,산도,바디,타닌,아로마,음식매칭,기타정보,알코올
"레오파드 립, 피노타지 쉬라즈","Leopard's Leap, Pinotage Shiraz",https://www.wine21.com/13_search/wine_view.html?Idx=167949&lq=LIST,레오파드 립  Leopard's Leap,남아프리카(South Africa) / 코스탈 리젼(Coastal Region) / 프란스후크(Franschhoek / Franschhoek Valley),피노타주 (Pinotage) / 시라/쉬라즈 (Syrah/Shiraz),,,,,16~18 ℃,"리치한 스타일의 돼지고기 요리나, 오리고기 요리와 잘 어울린다.",에노테카코리아,1/5,3/5,3/5,3/5,후추,오리고기,,13~14 %
"레오파드 립, 스페셜 컬리나리아 그랑 뱅","Leopard's Leap, Culinaria Grand Vin",https://www.wine21.com/13_search/wine_view.html?Idx=167950&lq=LIST,레오파드 립  Leopard's Leap,남아프리카(South Africa) / 코스탈 리젼(Coastal Region) / 프란스후크(Franschhoek / Franschhoek Valley),카베르네 소비뇽 (Cabernet Sauvignon) / 메를로 (Merlot) / 말벡 (Malbec) / 쁘띠 베르도 (Petit Verdot) / 카베르네 프랑 (Cabernet Franc),,,,,16~18 ℃,"스테이크, 치즈 등과 잘 어울린다.",에노테카코리아,1/5,3/5,4/5,4/5,배,"스테이크, 치즈",,13~14 %
"레오파드 립, 슈냉 블랑","Leopard's Leap, Chenin Blanc",https://www.wine21.com/13_search/wine_view.html?Idx=167951&lq=LIST,레오파드 립  Leopard's Leap,남아프리카(South Africa),슈냉 블랑 (Chenin Blanc),,,,,10~12 ℃,"신선한 해산물 요리나, 달콤하거나 아로마틱한 요리들, 브뤼, 그뤼에르, 허브로 만든 염소 치즈등과 같이 연성-반경성 치즈 등과 잘 어울린다.",에노테카코리아,1/5,3/5,2/5,1/5,구아바,해산물,,13~14 %
"레오파드 립, 스페셜 컬리나리아 슈냉 블랑","Leopard's Leap, Culinaria Chenin Blanc",https://www.wine21.com/13_search/wine_view.html?Idx=167952&lq=LIST,레오파드 립  Leopard's Leap,남아프리카(South Africa),슈냉 블랑 (Chenin Blanc),,,,,10~12 ℃,"샐러드, 치즈 등과 잘 어울린다.",에노테카코리아,1/5,3/5,3/5,1/5,"복숭아, 멜론, 오크","샐러드, 치즈",,13~14 %
"생 수페리, 카베르네 소비뇽 달라하이드 에스테이트 빈야드","St. Supery, Cabernet Sauvignon Dollarhide Estate Vineyard",https://www.wine21.com/13_search/wine_view.html?Idx=167953&lq=LIST,생 수페리  St Supery,미국(U.S.A) / 캘리포니아(California) / 나파 카운티(Napa County) / 나파 밸리(Napa Valley),카베르네 소비뇽 (Cabernet Sauvignon),,Napa Valley AVA,,,16~18 ℃,"스테이크, 치즈 등과 잘 어울린다.",에노테카코리아,1/5,3/5,4/5,4/5,"블랙베리, 아니스, 토스트","스테이크, 치즈","*Decanter 94점, Robert Parker 90-92점, James Suckling 91점",14~15 %
"생 수페리, 소비뇽 블랑 달라하이드 에스테이트 빈야드","St. Supery, Sauvignon Blanc Dollarhide Estate Vineyard",https://www.wine21.com/13_search/wine_view.html?Idx=167954&lq=LIST,생 수페리  St Supery,미국(U.S.A) / 캘리포니아(California) / 나파 카운티(Napa County) / 나파 밸리(Napa Valley),소비뇽 블랑 (Sauvignon Blanc),,Napa Valley AVA,,,8~10 ℃,"훈제 연어, 농어, 광어, 생선구이, 조개구이, 새우, 해산물, 샐러드, 야채, 동남아요리, 아시아요리 등과 잘 어울린다.",에노테카코리아,1/5,3/5,3/5,1/5,"배, 오크",,*Wine Spectator 92점*James Suckling 92점,14~15 %
"부두 블랙 매직, 레드 블렌드","Voodoo Black Magic, Red Blend",https://www.wine21.com/13_search/wine_view.html?Idx=167955&lq=LIST,로월 에스테이트  Lawer Estates,미국(U.S.A) / 캘리포니아(California),쁘띠 시라  (Petite Sirah) / 템프라니요 (Tempranillo),,California AVA,,,16~18 ℃,"스테이크, 그릴요리, 양고기, 양갈비, 파스타, 하몽, 순대, 한국음식 등과 잘 어울린다.",와인투유코리아,1/5,3/5,4/5,4/5,토스트,"하몽, 파스타",,14~15 %
"맥매니스, 진판델","McManis, Zinfandel",https://www.wine21.com/13_search/wine_view.html?Idx=167956&lq=LIST,맥매니스 와이너리  McManis Winery,미국(U.S.A) / 캘리포니아(California),진판델 (Zinfandel) / 따나 (Tannat) / 쁘띠 시라  (Petite Sirah),,California AVA,,French and American Oak에서 4~6개월 숙성.,16~18 ℃,"바베큐, 스테이크 등과 잘 어울린다.",와인투유코리아,1/5,3/5,4/5,4/5,"레드커런트, 블랙체리, 딸기, 토스트, 카라멜, 오크","소고기, 스테이크, 붉은육류, 양갈비, 양고기, 양념갈비, 갈비찜, 치즈, 그라노파다노, 고르곤졸라, 로크포르","* 2021 빈티지 - SF International Wine Competition Double Gold / SF Chronicle Wine Competition Double Gold* 2017 빈티지 - 2019 San Francisco International Wine Competition Gold, 2019 California State Fair Gold",14~15 %
"부두 화이트 매직, 화이트 블렌드","Voodoo White Magic, White Blend",https://www.wine21.com/13_search/wine_view.html?Idx=167957&lq=LIST,로월 에스테이트  Lawer Estates,미국(U.S.A) / 캘리포니아(California),비오니에 (Viognier) / 샤르도네 (Chardonnay),,California AVA,,,10~12 ℃,"참치, 연어, 새우, 해산물, 하몽, 프로슈토, 다양한 치즈, 파스타 등과 잘 어울린다.",와인투유코리아,1/5,3/5,3/5,1/5,"복숭아, 레몬그라스","파스타, 치즈",,14~15 %
"텐 에이커, 러시안 밸리 샤도네이","Ten Acre, Russian Valley Chardonnay",https://www.wine21.com/13_search/wine_view.html?Idx=167958&lq=LIST,텐 에이커 와이너리  Ten Acre Winery,미국(U.S.A) / 캘리포니아(California) / 소노마 카운티(Sonoma County) / 러시안 리버 밸리(Russian River Valley),샤르도네 (Chardonnay),,Russian River Valley AVA,,,16~18 ℃,"바비큐, 훈제오리, 오리로스, 치킨, 훈제연어, 장어구이, 참치, 새우, 해산물, 숙성 치즈, 피자, 파스타, 탕수육 등과 잘 어울린다.",와인투유코리아,1/5,3/5,3/5,1/5,"배, 레몬, 꽃, 꿀","바비큐, 수육, 탕수육, 치즈",*Wine & Spirits 93점*James Suckling 90점,14~15 %
"코투리, 브루탈","Coturri, Brutal",https://www.wine21.com/13_search/wine_view.html?Idx=167959&lq=LIST,코투리 와이너리  Coturri Winery,미국(U.S.A) / 캘리포니아(California) / 소노마 카운티(Sonoma County) / 소노마 밸리(Sonoma Valley),까리냥 (Carignan/Carignane) / 진판델 (Zinfandel) / 바르베라 (Barbera),,Sonoma Valley AVA,,,16~18 ℃,"붉은육류, 양고기, 양갈비, 스테이크, 갈비, 불고기, 말린과일, 견과류 와 잘 어울린다.",와인투유코리아,1/5,3/5,4/5,3/5,"블랙베리, 시나몬, 허브, 삼나무, 크림","불고기, 견과류",,12~13 %
"바스티오니 델라 로카, 프리미티보","Bastioni della Rocca, Primitivo",https://www.wine21.com/13_search/wine_view.html?Idx=167960&lq=LIST,바스티오니 델라 로카  Bastioni della Rocca,이탈리아(Italy) / 뿔리아(Puglia),프리미티보 (Primitivo),,Puglia IGT(IGP),,,16~18 ℃,"로스트 비프, 스튜 등과 잘 어울린다.",,1/5,3/5,4/5,4/5,"체리, 무화과",,,14~15 %
"다밀라노, 바롤로 리제르바 깐누비 1752","Damilano, Barolo Riserva  Cannubi 1752",https://www.wine21.com/13_search/wine_view.html?Idx=167961&lq=LIST,다밀라노  Damilano,이탈리아(Italy) / 피에몬테(Piemonte) / 바롤로(Barolo) / 칸누비(Cannubi),네비올로 (Nebbiolo),Italian Barolo,Barolo DOCG(DOP),75년 수령 포도나무.,60개월 슬라보니안 오크 숙성 후 24개월 병입 숙성.,16~18 ℃,"드라이 에이징 스테이크, 숙성치즈, 트러플 등과  잘 어울린다.",빈티지코리아,1/5,3/5,4/5,4/5,"체리, 자두, 꽃, 바닐라, 감초, 커피, 에스프레소, 코코아, 가죽, 버섯","소고기, 스테이크, 붉은육류, 양갈비, 양고기, 훈제오리, 불고기, 양념갈비, 라자냐, 파스타, 서양요리, 버섯, 트러플, 자두, 치즈, 파르미지아노, 그라노파다노","* “1752”는 랑게 지역에서 발견된 가장 오래된 Cannubi병에 쓰여져 있던 연도이다. 이 병은 현재 Manzone famil의 개인 박물관에 전시되어 있으며, 이를 통해 Cannubi의 역사가 1700대부터 이어진 오래된 역사라는 것을 알 수 있다. 현대에 와서 1752는 1(싱글빈야드), 7(총 숙성 기간), 5(배럴 숙성 기간), 2(병입 숙성 기간)을 의미한다. 다밀라노 패밀리는 2008년 언덕의 가장 높고 중심에 위치해 있는 칸누비 빈야드에서 30~50년 수령의 포도나무에서 포도를 재배하여 리저브 와인을 생산하고 있다.",14~15 %
"다밀라노, 바롤로 브루나떼","Damilano, Barolo Brunate",https://www.wine21.com/13_search/wine_view.html?Idx=167962&lq=LIST,다밀라노  Damilano,이탈리아(Italy) / 피에몬테(Piemonte) / 바롤로(Barolo),네비올로 (Nebbiolo),Italian Barolo,Barolo DOCG(DOP),,24개월 슬라보니안 오크 숙성 후 14개월 병입 숙성,16~18 ℃,"드라이 에이징 스테이크, 트러플, 버섯 등과 잘 어울린다.",빈티지코리아,1/5,3/5,4/5,4/5,"체리, 라스베리, 자두, 장미, 꽃, 감초, 시나몬, 버섯, 송로버섯","소고기, 스테이크, 육류요리, 붉은육류, 양갈비, 양고기, 불고기, 갈비찜, 라자냐, 파스타, 새송이, 송이버섯, 치즈, 파르미지아노, 그라노파다노","* 2019 빈티지 - Kerin O'keefe 95P* 브루나떼는 밭의 높낮이 차이가 크고 극심한 기후 변화로 타닌이 연화되는 특징을 가진다. 햇볕이 잘 드는 남향 언덕에 자리해 더 강렬한 와인이 만들어지고, 많은 석회암과 소량의 모래토양, 알카리성 토양으로 섬세한 향을 가지는 것이 특징이다.",14~15 %
"다밀라노, 랑게 아르네이스","Damilano, Langhe Arneis",https://www.wine21.com/13_search/wine_view.html?Idx=167963&lq=LIST,다밀라노  Damilano,이탈리아(Italy) / 피에몬테(Piemonte),아르네이스 (Arneis),,Langhe DOC(DOP),,,10~12 ℃,"조개, 해산물, 생산요리 등과 잘 어울린다.",,1/5,4/5,2/5,1/5,,해산물,"*2019 빈티지: Robert Parker 88점, James Suckling 91점*2018 빈티지: Robert Parker 87점, James Suckling 89점*2017 빈티지: Robert Parker 86점*2016 빈티지: James Suckling 91점*2014 빈티지: James Suckling 88점*2013 빈티지: James Suckling 90점",13~14 %
크리스마스 아스티,Christmas Asti,https://www.wine21.com/13_search/wine_view.html?Idx=167964&lq=LIST,부티노  Boutinot,이탈리아(Italy) / 피에몬테(Piemonte) / 아스티(Asti),모스카토  (Moscato ),,Asti DOCG(DOP),,,6~8 ℃,"각종 과일 샐러드, 생크림 케이크, 레몬 타르트, 마들렌 등과 잘 어울린다.",나라셀라,4/5,2/5,2/5,1/5,,"샐러드, 과일",,4~6 %
"마스카 델 타코, 루 세뿌 네그로아마로","Masca del Tacco, Lu Ceppu Negroamaro",https://www.wine21.com/13_search/wine_view.html?Idx=167965&lq=LIST,마스카 델 타코  Masca del Tacco,이탈리아(Italy) / 뿔리아(Puglia),네그로아마로 (Negroamaro),,Puglia IGT(IGP),,,16~18 ℃,"양갈비, 양고기, 스테이크, 스튜, 블루치즈, 살라미, 견과류, 말린과일 과 잘 어울린다.",비케이 트레이딩,1/5,3/5,4/5,4/5,"체리, 배, 건포도, 꽃, 허브","살라미, 견과류",,14~15 %
"마스카 델 타코, 수수마니엘로","Masca del Tacco, Susumaniello",https://www.wine21.com/13_search/wine_view.html?Idx=167966&lq=LIST,마스카 델 타코  Masca del Tacco,이탈리아(Italy) / 뿔리아(Puglia),수수마니엘로 (Susumaniello),,Puglia IGT(IGP),,,16~18 ℃,"양갈비, 양고기, 스테이크, 스튜, 치즈, 살라미, 견과류, 말린과일 과 잘 어울린다.",비케이 트레이딩,1/5,2/5,3/5,3/5,"블루베리, 허브","살라미, 견과류, 치즈",*Mundus Vino Gold*Luca Maroni 98점*Asia Wine Trophy Grand Gold,14~15 %
"마스카 델 타코, 삐아노 치우소 프리미티보 디 만두리아 리제르바","Masca del Tacco, Piano Chiuso Primitivo di Manduria Riserva",https://www.wine21.com/13_search/wine_view.html?Idx=167967&lq=LIST,마스카 델 타코  Masca del Tacco,이탈리아(Italy) / 뿔리아(Puglia) / 만두리아(Manduria),프리미티보 (Primitivo),,Primitivo di Manduria DOC(DOP),,,16~18 ℃,"양갈비, 양고기, 스테이크, 스튜, 블루치즈, 살라미, 견과류, 말린과일 과 잘 어울린다.",비케이 트레이딩,1/5,2/5,4/5,4/5,미네랄,"살라미, 견과류",*Luca Maroni 99점*Bibenda 5 grappoli*Gambero Rossp 3 bicchieri*Berliner Wine Trophy Gold*Asia Wine Trophy Grand Gold*2023 대한민국 주류대상 '레드와인 구대륙 부문 대상',15~16 %
"마스카 델 타코, 루 라빠이오 프리미티보 디 만두리아","Masca del Tacco, Lu Rappaio Primitivo di Manduria",https://www.wine21.com/13_search/wine_view.html?Idx=167968&lq=LIST,마스카 델 타코  Masca del Tacco,이탈리아(Italy) / 뿔리아(Puglia) / 만두리아(Manduria),프리미티보 (Primitivo),,Primitivo di Manduria DOC(DOP),,,16~18 ℃,"양갈비, 양고기, 스테이크, 스튜, 블루치즈, 살라미, 견과류, 말린과일 과 잘 어울린다.",비케이 트레이딩,1/5,2/5,4/5,4/5,"딸기, 배, 잼","살라미, 견과류",*Luca Maroni 97점*Mundus Vino Gold*Berliner Wine Trophy Gold*Asia Wine Trophy Gold,14~15 %
"마스카 델 타코, 루에따 피아노","Masca del Tacco, L'Uetta Fiano",https://www.wine21.com/13_search/wine_view.html?Idx=167969&lq=LIST,마스카 델 타코  Masca del Tacco,이탈리아(Italy) / 뿔리아(Puglia),피아노 (Fiano) 100%,,Puglia IGT(IGP),,,8~10 ℃,"찜닭, 치킨. 훈제오리, 연어, 농어, 킹크랩, 랍스터, 샐러드, 치즈 와 잘 어울린다.",비케이 트레이딩,1/5,4/5,3/5,1/5,"멜론, 자스민, 흰꽃","샐러드, 치즈",*Mundus Vino Gold*Berliner Wine Trophy Gold*Luca Maroni 97점,13~14 %
"마스카 델 타코, 리 필리띠 프리미티보 디 만두리아 리제르바","Masca del Tacco, Li Filitti Primitivo di Manduria Riserva",https://www.wine21.com/13_search/wine_view.html?Idx=167970&lq=LIST,마스카 델 타코  Masca del Tacco,이탈리아(Italy) / 뿔리아(Puglia) / 만두리아(Manduria),프리미티보 (Primitivo),,Primitivo di Manduria DOC(DOP),,,16~18 ℃,"양갈비, 양고기, 스테이크, 스튜, 치즈, 살라미, 견과류, 말린과일 과 잘 어울린다.",비케이 트레이딩,1/5,2/5,3/5,3/5,"딸기, 자두, 건포도","살라미, 견과류, 치즈",*Luca Maroni 98점*Mundus Vino Gold*Berliner Wine Trophy Gold*Asia Wine Trophy Grand Gold,14~15 %
"마스카 델 타코, 루리 에디지오네 리미타타 프리미티보","Masca del Tacco, Lu'Li Edizione Limitata Primitivo",https://www.wine21.com/13_search/wine_view.html?Idx=167971&lq=LIST,마스카 델 타코  Masca del Tacco,이탈리아(Italy) / 뿔리아(Puglia),프리미티보 (Primitivo) / 기타 품종 (Other Grapes),,Puglia IGT(IGP),,,16~18 ℃,"양갈비, 양고기, 스테이크, 스튜, 블루치즈, 살라미, 견과류, 말린과일 과 잘 어울린다.",비케이 트레이딩,1/5,2/5,5/5,5/5,"꽃, 후추, 허브","살라미, 견과류",,17~18 %
"오이노스, 네로 다볼라 메를로","Oynos, Nero d'Avola Merlot",https://www.wine21.com/13_search/wine_view.html?Idx=167972&lq=LIST,오이노스  Oynos,이탈리아(Italy) / 시칠리아(Sicilia),네로 다볼라 (Nero d'Avola) / 메를로 (Merlot),,Terre Siciliane IGT(IGP),"손 수확, 야생 효모 사용",,16~18 ℃,"지중해 음식, 바베큐, 숙성된 치즈 등과 잘 어울린다.",비케이 트레이딩,1/5,3/5,3/5,3/5,"체리, 리치",치즈,* 유기농 와인* 비건 와인,13~14 %
"오이노스, 피노 그리지오","Oynos, Pinot Grigio",https://www.wine21.com/13_search/wine_view.html?Idx=167973&lq=LIST,오이노스  Oynos,이탈리아(Italy) / 시칠리아(Sicilia),피노 그리지오 (Pinot Grigio),,Terre Siciliane IGT(IGP),,,8~10 ℃,"흰살생선, 샐러드, 건육, 하몽, 프로슈토, 동남아요리, 파스타 등과 잘 어울린다.",비케이 트레이딩,1/5,2/5,3/5,1/5,"배, 사과, 시트러스, 리치, 꽃, 미네랄","생선구이, 흰살생선, 해산물, 나물, 비빔밥, 오일파스타, 중국요리, 자장면, 동남아요리, 아시아요리, 샐러드, 크림치즈, 모짜렐라",,12~13 %
"오이노스, 쉬라","Oynos, Syrah",https://www.wine21.com/13_search/wine_view.html?Idx=167974&lq=LIST,오이노스  Oynos,이탈리아(Italy) / 시칠리아(Sicilia),시라/쉬라즈 (Syrah/Shiraz),,Terre Siciliane IGT(IGP),,,16~18 ℃,"매운 음식, 바비큐 등과 잘 어울린다.",비케이 트레이딩,1/5,3/5,3/5,3/5,,바비큐,,13~14 %
"보떼르, 올트레 피아노","Botter, Oltre Piano",https://www.wine21.com/13_search/wine_view.html?Idx=167975&lq=LIST,보테르  Botter,이탈리아(Italy) / 뿔리아(Puglia),프리미티보 (Primitivo) / 산지오베제 (Sangiovese),,Salento IGT(IGP),,,16~18 ℃,"양갈비, 양고기, 스테이크, 스튜, 치즈, 살라미, 견과류, 말린과일 과 잘 어울린다.",에프엘코리아,1/5,3/5,4/5,3/5,"블랙커런트, 블랙베리, 자두, 잼, 제비꽃, 꽃, 바닐라, 정향","스튜, 소고기, 스테이크, 육류요리, 양갈비, 살라미, 불고기, 갈비찜, 족발, 파스타, 리조토, 서양요리, 말린과일, 말린과일, 견과류, 치즈, 파르미지아노, 그라노파다노, 테트드무안",,
"프랑소와 달렌느, 부르고뉴 피노 누아","Francois d'Allaines, Bourgogne Pinot Noir",https://www.wine21.com/13_search/wine_view.html?Idx=167976&lq=LIST,도멘 프랑소와 달렌느  Domaine Francois d'Allaines,프랑스(France) / 부르고뉴(Bourgogne),피노 누아 (Pinot Noir),,Bourgogne AOC(AOP),발효기간 - 16일,15% 새오크통에서 10개월간 숙성,14~16 ℃,"암소고기, 가금류, 돼지고기 및 양고기 등 모든 육류와 치즈 등과 잘 어울린다.",레드와인앤제이와이,1/5,4/5,3/5,3/5,오크,"소고기, 양고기, 가금류, 치즈",*2017 빈티지: 2019 Bourgogne Aujourd'hui 15.5 / 20점,13~14 %
"프랑소와 달렌느, 부르고뉴 샤르도네","Francois d'Allaines, Bourgogne Chardonnay",https://www.wine21.com/13_search/wine_view.html?Idx=167977&lq=LIST,도멘 프랑소와 달렌느  Domaine Francois d'Allaines,프랑스(France) / 부르고뉴(Bourgogne),샤르도네 (Chardonnay),,Bourgogne AOC(AOP),모든 공정 (발효/숙성) 오크통 사용,약 18개월 (10% new),10~12 ℃,"암송아지 스튜, 닭요리 with 크림소스, 치즈 등과 잘 어울린다.",레드와인앤제이와이,1/5,4/5,2/5,1/5,"파인애플, 오크",치즈,,12~13 %
"레드헤즈 와인, 1888  바로사 밸리 쉬라즈","Redheads wine, 1888 Barossa Valley Shiraz",https://www.wine21.com/13_search/wine_view.html?Idx=167978&lq=LIST,레드헤즈 와인  Redheads wine,호주(Australia) / 사우스 오스트레일리아(South Australia) / 바로사 밸리(Barossa Valley),시라/쉬라즈 (Syrah/Shiraz),Australian Shiraz,,,"프렌치 오크, 아메리칸 오크 사용",16~18 ℃,"Medium-rare의 beef, lamb 그리고 캥거루 고기와 스튜, 구운 오리 및 체다치즈와 베이컨으로 만들어진 버거 등과 잘 어울린다.",레드와인앤제이와이,1/5,3/5,5/5,5/5,"블랙베리, 자두, 바닐라, 감초, 토스트, 타바코, 오크","스튜, 육류요리, 양갈비, 양고기, 훈제오리, 라자냐, 햄버거, 자두, 체다, 고다",*2020 빈티지: Berliner Wine Trophy 2022Gold Medal*2020 빈티지: The Vintage Journal Reviews93점,14~15 %
"리버비, 싱글 빈야드 드라이 리슬링","Riverby, Single Vineyard Dry Riesling",https://www.wine21.com/13_search/wine_view.html?Idx=167979&lq=LIST,리버비 에스테이트  Riverby Estate,뉴질랜드(New Zealand) / 사우스 아일랜드(South Island) / 말보로(Marlborough),리슬링 (Riesling),,,,,8~10 ℃,"해산물, 조개류 등과 잘 어울린다.",레드와인앤제이와이,1/5,4/5,2/5,1/5,"꽃, 허브",해산물,"*2018 빈티지: Canberra Int'l Riesling Challenge 95점 / GOLD, Tom Cannavan 2020 90점, Wine Orbit 94점",12~13 %
"마르키시오, 바롤로","Marchisio, Barolo",https://www.wine21.com/13_search/wine_view.html?Idx=167980&lq=LIST,마르키시오  Marchisio,이탈리아(Italy) / 피에몬테(Piemonte) / 바롤로(Barolo),네비올로 (Nebbiolo),,Barolo DOCG(DOP),,,16~18 ℃,"트러플, 양갈비, 스튜, 그릴요리, 바비큐, 포크, 버섯, 프로슈토, 라자냐, 이탈리안 음식과 잘 어울린다.",,1/5,4/5,4/5,4/5,석류,"양갈비, 프로슈토, 라자냐",,14~15 %
"마르키시오, 로에로","Marchisio, Roero",https://www.wine21.com/13_search/wine_view.html?Idx=167981&lq=LIST,마르키시오  Marchisio,이탈리아(Italy) / 피에몬테(Piemonte) / 랑게(Langhe),네비올로 (Nebbiolo),,Roero DOCG(DOP),,,16~18 ℃,"붉은육류, 훈제오리, 치킨, 바비큐, 소시지, 파스타, 치즈와 잘 어울린다.",콜리코,1/5,4/5,3/5,4/5,"블랙베리, 석류, 감초, 코코아","붉은육류, 파스타, 치즈",*2017 빈티지: 2020 Mundus Vini Silver Medal,14~15 %
"히킨보탐, 트루맨 까베르네 소비뇽","Hickinbotham, Trueman Cabernet Sauvingnon",https://www.wine21.com/13_search/wine_view.html?Idx=167982&lq=LIST,히킨보탐  Hickinbotham,호주(Australia) / 사우스 오스트레일리아(South Australia) / 맥라렌 베일(McLaren Vale),카베르네 소비뇽 (Cabernet Sauvignon),Australian Cabernet Sauvignon,,,,16~18 ℃,"스테이크, 갈비, 불고기, 양갈비, 버섯, 하몽, 살라미, 한국음식 과 잘 어울린다.",하이트진로,1/5,3/5,5/5,5/5,"블랙베리, 자두, 초콜릿","스테이크, 양갈비, 버섯, 자두","*2020 Halliday Wine Companion, August, Campbell Mattinson - 97점*2020 The Wine Front, July, Gary Walsh - 95+점*James Halliday 96점*James Suckling 95점",14~15 %
"히킨보탐, 리바이벌리스트 메를로","Hickinbotham, Revivalist Merlot",https://www.wine21.com/13_search/wine_view.html?Idx=167983&lq=LIST,히킨보탐  Hickinbotham,호주(Australia) / 사우스 오스트레일리아(South Australia) / 맥라렌 베일(McLaren Vale),메를로 (Merlot) / 쁘띠 베르도 (Petit Verdot),Australian Merlot,,,25%는 보르도 산 새 오크 배럴에서 18개월 간 숙성,16~18 ℃,"붉은육류, 로스트비프, 훈제오리, 바비큐, 소시지, 수육, 다양한 치즈, 파스타, 피자 와 잘 어울린다.",하이트진로,1/5,4/5,4/5,4/5,"블랙체리, 블랙베리, 월계수, 토스트, 초콜릿","로스트비프, 붉은육류, 바비큐, 소시지, 훈제오리, 보쌈, 수육, 치즈","*2020 Campbell Mattinson, Halliday Wine Companion, August - 97pt*2021 Joe Czerwinski, Robert Parker Wine Advocate, February - 97pt*2020 Nick Stock, JamesSuckling.com, May - 97pt",14~15 %
"히킨보탐, 브룩스 로드 쉬라즈","Hickinbotham, Brooks Road Shiraz",https://www.wine21.com/13_search/wine_view.html?Idx=167984&lq=LIST,히킨보탐  Hickinbotham,호주(Australia) / 사우스 오스트레일리아(South Australia) / 맥라렌 베일(McLaren Vale),시라/쉬라즈 (Syrah/Shiraz),Australian Shiraz,,,,16~18 ℃,"붉은 육류, 스테이크, 갈비찜, 스튜, 불고기, 양갈비, 한국음식 과 잘 어울린다.",하이트진로,1/5,3/5,4/5,4/5,"블루베리, 자두, 정향, 타임, 오크",양갈비,"*2020 James Halliday, Halliday Wine Companion, August - 98점*2021 MaryAnn Worobiec, Wine Spectator, June - 95점*2021 Christina Pickard, Wine Enthusiast Magazine, May - 93점*2021 Joe Czerwinski, Robert Parker Wine Advocate, February - 92점*James Halliday 96점*James Suckling 94점",14~15 %
"히킨보탐, 더 피크","Hickinbotham, The Peake",https://www.wine21.com/13_search/wine_view.html?Idx=167985&lq=LIST,히킨보탐  Hickinbotham,호주(Australia) / 사우스 오스트레일리아(South Australia) / 맥라렌 베일(McLaren Vale),카베르네 소비뇽 (Cabernet Sauvignon) / 시라/쉬라즈 (Syrah/Shiraz),,,,,16~18 ℃,"스테이크, 갈비, 불고기, 스튜, 양갈비, 버섯, 하몽, 살라미, 한국음식 과 잘 어울린다.",하이트진로,1/5,4/5,5/5,5/5,,"양갈비, 버섯",*2018 빈티지: James Halliday 2021 edition 99점*James Halliday 96점*James Suckling 96 점,14~15 %
"포데레 디 마르치알라, 끼안티","Podere di Marcialla, Chianti",https://www.wine21.com/13_search/wine_view.html?Idx=167986&lq=LIST,포데레 디 마르치알라  Podere di Marcialla,이탈리아(Italy) / 토스카나(Toscana) / 키안티(Chianti),산지오베제 (Sangiovese) / 카나이올로 (Canaiolo) / 콜로리노 (Colorino),,Chianti DOCG(DOP),,,16~18 ℃,"붉은육류, 스테이크, 로스트비프, 양갈비, 양고기, 트러플, 블루치즈, 족발, 라자냐, 파스타와 잘 어울린다.",에프엘코리아,1/5,4/5,3/5,3/5,,"족발, 트러플",,
"포데레 디 마르치알라, 끼안티 리세르바","Podere di Marcialla, Chianti Risreva",https://www.wine21.com/13_search/wine_view.html?Idx=167987&lq=LIST,포데레 디 마르치알라  Podere di Marcialla,이탈리아(Italy) / 토스카나(Toscana) / 키안티(Chianti),산지오베제 (Sangiovese) / 카나이올로 (Canaiolo),,Chianti DOCG(DOP),,,16~18 ℃,"붉은육류, 스테이크, 로스트비프, 양갈비, 양고기, 트러플, 블루치즈, 족발, 라자냐, 파스타와 잘 어울린다.",에프엘코리아,1/5,4/5,4/5,3/5,"배, 건포도, 후추","족발, 트러플",,
"조르쥬 라발, 레 롱그 비올 브뤼 나뚜르","Georges Laval, Les Longues Violes Brut Nature",https://www.wine21.com/13_search/wine_view.html?Idx=167988&lq=LIST,조르쥐 라발  Georges Laval,프랑스(France) / 샹빠뉴(Champagne),피노 누아 (Pinot Noir) / 피노 뮈니에 (Pinot Meunier),,Champagne AOC(AOP),,,6~8 ℃,"스시, 회, 해산물, 굴, 랍스터, 게, 다양한 치즈, 샐러드, 아시아요리, 동남아요리, 과일, 디저트 등과 잘 어울린다.",크리스탈와인,1/5,5/5,3/5,1/5,,"스시, 샐러드, 과일, 치즈, 디저트",*2012 빈티지: Vinous 96점,
