와인명,와인 영문명,URL,생산자,국가/생산지역,주요품종,스타일,등급,양조,숙성,음용온도,추천음식,수입사,당도,산도,바디,타닌,아로마,음식매칭,기타정보,알코올
"얀 베르트랑, 줄리에나 …100%","Yann Bertrand, Juliénas ...100%",https://www.wine21.com/13_search/wine_view.html?Idx=167661&lq=LIST,얀 베르트랑  Yann Bertrand,프랑스(France) / 부르고뉴(Bourgogne) / 보졸레(Beaujolais) / 쥘리에나(Julienas),가메이 (Gamay) 100%,,Juliénas AOC(AOP),14-18일 간 저온 탄산 침용 과정을 진행,최소 7가지의 레드 와인에 사용된 225L 올드 배럴에 8개월 숙성,14~16 ℃,"허브와 시트러스에 재운 로스트 치킨, 칠면조 요리, 미몰레뜨 치즈 등과 잘 어울린다.",(주)와이넬,1/5,3/5,3/5,3/5,"딸기, 복숭아, 감초",복숭아,* 2020 빈티지 - The Wine Front 94점,
"얀 베르트랑, 플뢰리 꾸 드 폴리","Yann Bertrand, Fleurie Coup d'Folie",https://www.wine21.com/13_search/wine_view.html?Idx=167662&lq=LIST,얀 베르트랑  Yann Bertrand,프랑스(France) / 부르고뉴(Bourgogne) / 보졸레(Beaujolais) / 플뢰리(Fleurie),가메이 (Gamay) 100%,,Fleurie AOC(AOP),,,14~16 ℃,"플럼 소스를 얹은 오리 가슴살, 프로방스 허브를 곁들인 닭, 소프트 치즈 등과 잘 어울린다.",(주)와이넬,1/5,3/5,3/5,3/5,"복숭아, 장미","복숭아, 치즈",,
"얀 베르트랑, 플뢰리 뀌베 뒤 카오스","Yann Bertrand, Fleurie Cuvée du Chaos",https://www.wine21.com/13_search/wine_view.html?Idx=167663&lq=LIST,얀 베르트랑  Yann Bertrand,프랑스(France) / 부르고뉴(Bourgogne) / 보졸레(Beaujolais) / 플뢰리(Fleurie),가메이 (Gamay) 100%,,Fleurie AOC(AOP),,,14~16 ℃,"파테(pâté), 장봉(Jambon) 등의 샤퀴테리, 수제 소시지, 브리(Brie) 등의 치즈 등과 잘 어울린다.",(주)와이넬,1/5,3/5,3/5,3/5,,소시지,,
"얀 베르트랑, 모르공 디나미트","Yann Bertrand, Morgon Dynamite",https://www.wine21.com/13_search/wine_view.html?Idx=167664&lq=LIST,얀 베르트랑  Yann Bertrand,프랑스(France) / 부르고뉴(Bourgogne) / 보졸레(Beaujolais) / 모르공(Morgon),가메이 (Gamay) 100%,,Morgon AOC(AOP),,,14~16 ℃,"치미추리 소스를 곁들인 비프 스테이크, 양갈비 스테이크, 꽁떼 치즈 등과 잘 어울린다.",(주)와이넬,1/5,3/5,4/5,3/5,"체리, 자두","양갈비, 자두",,
"도멘 데 그랑드 에스페랑스, 오로르","Domaine des Grandes Esperances, Aurore",https://www.wine21.com/13_search/wine_view.html?Idx=167665&lq=LIST,도멘 데 그랑드 에스페랑스  Domaine des Grandes Esperances,프랑스(France) / 루아르(Loire) / 뚜렌느(Touraine),슈냉 블랑 (Chenin Blanc),,Touraine AOC(AOP),,,10~12 ℃,"토스트, 치즈, 해산물 등과 잘 어울린다.",,1/5,4/5,3/5,1/5,"꽃, 미네랄, 브리오슈, 코코넛, 오크","해산물, 치즈",,
"도멘 데 그랑드 에스페랑스, 르 제니 오랑지","Domaine des Grandes Esperances, Le Genie Orange",https://www.wine21.com/13_search/wine_view.html?Idx=167666&lq=LIST,도멘 데 그랑드 에스페랑스  Domaine des Grandes Esperances,프랑스(France) / 루아르(Loire),슈냉 블랑 (Chenin Blanc),,,,,10~12 ℃,"치즈, 아시아요리 등과 잘 어울린다.",,1/5,4/5,3/5,2/5,아니스,"아시아요리, 치즈",*오렌지 와인,
"도멘 데 그랑드 에스페랑스, 레 젤 푸르프르","Domaine des Grandes Esperances, Les Ailes Pourpres",https://www.wine21.com/13_search/wine_view.html?Idx=167667&lq=LIST,도멘 데 그랑드 에스페랑스  Domaine des Grandes Esperances,프랑스(France) / 루아르(Loire) / 뚜렌느(Touraine),카베르네 프랑 (Cabernet Franc),,Touraine AOC(AOP),,,16~18 ℃,"스테이크, 치즈, 양갈비 등과 잘 어울린다.",,1/5,4/5,3/5,3/5,오크,"스테이크, 양갈비, 치즈",*2014 빈티지: La Revue du Vin de France 16.5 / 20점,
"도멘 떼르 블랑슈, 상세르 '르 발롱'","Domaine de Terres Blanches, Sancerre 'Le Vallon'",https://www.wine21.com/13_search/wine_view.html?Idx=167668&lq=LIST,도멘 떼르 블랑슈  Domaine de Terres Blanches,프랑스(France) / 루아르(Loire) / 센트럴 루아르(Central Loire) / 상세르(Sancerre),소비뇽 블랑 (Sauvignon Blanc),,Sancerre AOC(AOP),,,10~12 ℃,"해산물, 치즈 등과 잘 어울린다.",,1/5,4/5,2/5,1/5,시트러스,"해산물, 치즈",*2015 빈티지: Wine Enthusiast 89점*2014 빈티지: Vinum Wine Magazine 16.5 / 20점,
"도멘 드 라 로시뇰, 상세르","Domaine de la Rossignole, Sancerre",https://www.wine21.com/13_search/wine_view.html?Idx=167669&lq=LIST,도멘 드 라 로시뇰  Domaine de la Rossignole,프랑스(France) / 루아르(Loire) / 센트럴 루아르(Central Loire) / 상세르(Sancerre),소비뇽 블랑 (Sauvignon Blanc),,Sancerre AOC(AOP),,,10~12 ℃,"샐러드, 치즈, 해산물 등과 잘 어울린다.",,1/5,4/5,2/5,1/5,시트러스,"해산물, 샐러드, 치즈",*2018 빈티지: Concours Des Vins Du Loire Silver Medal,
"도멘 데 핀 까이오뜨, 푸이 퓌메","Domaine des Fines Caillottes, Pouilly-Fume",https://www.wine21.com/13_search/wine_view.html?Idx=167670&lq=LIST,도멘 데 핀 까이오뜨  Domaine des Fines Caillottes,프랑스(France) / 루아르(Loire) / 센트럴 루아르(Central Loire) / 뿌이-퓌메(Pouilly-Fume),소비뇽 블랑 (Sauvignon Blanc),,Pouilly-Fumé AOC(AOP),"공기압착 과정으로 최상의 포도즙만 뽑아내며, 네추럴 이스트를 사용한 발효와 저온 침용",", 몇개월간의 리즈컨택",10~12 ℃,"해산물, 샐러드, 치즈 등과 잘 어울린다.",,1/5,4/5,2/5,1/5,"시트러스, 아카시아, 미네랄, 꿀","해산물, 샐러드, 치즈","*2018 빈티지: Medaille Argent Mondial du Sauvignon Silver Medal, Wine Spectator 89점*2017 빈티지: Wine Spectator 91점, Concours Des Vinalies Nationales Prix D'Excellence, Concours Des Vins De Macon Bronze Medal*Vivino Among Top 1% of All Wines in Region",
"도멘 데 핀 까이오뜨, 프레스티지 데 핀 까이오뜨 푸이 퓌메","Domaine des Fines Caillottes, Prestige des Fines Caillottes Pouilly-Fume",https://www.wine21.com/13_search/wine_view.html?Idx=167671&lq=LIST,도멘 데 핀 까이오뜨  Domaine des Fines Caillottes,프랑스(France) / 루아르(Loire) / 센트럴 루아르(Central Loire) / 뿌이-퓌메(Pouilly-Fume),소비뇽 블랑 (Sauvignon Blanc),,Pouilly-Fumé AOC(AOP),,,10~12 ℃,"샐러드, 해산물, 치즈 등과 잘 어울린다.",,1/5,4/5,2/5,1/5,"장미, 미네랄","해산물, 샐러드, 치즈","*2015 빈티지: Wine Spectator 93점, Medaille Argent Mondial du Sauvignon Gold Medal, Medaille d'or Feminalise Silver Medal, Vinalies Nationales Prix D'Excellence",
"비뇨블 투쉐, 물랭 투쉐","Vignobles Touchais, Moulin Touchais",https://www.wine21.com/13_search/wine_view.html?Idx=167672&lq=LIST,비뇨블 투쉐  Vignobles Touchais,프랑스(France) / 루아르(Loire) / 앙쥬-소뮈르(Anjou-Saumur) / 꼬또 뒤 레이옹(Côteaux du Layon),슈냉 블랑 (Chenin Blanc) 100%,,Coteaux du Layon AOC(AOP),,,10~12 ℃,"디저트, 케이크, 견과류 등과 잘 어울린다.",,5/5,4/5,4/5,1/5,"사과, 말린과일, 커피, 꿀","견과류, 치즈, 타르트, 케이크",,
"도멘 드 레꾸, 클래식","Domaine de l'Ecu, Classic",https://www.wine21.com/13_search/wine_view.html?Idx=167673&lq=LIST,도멘 드 레꾸  Domaine de l'Ecu,프랑스(France) / 루아르(Loire) / 뻬이 낭떼(Pays Nantais) / 뮈스까데 세브르 에 멘느(Muscadet Sevre et Maine),믈롱 드 부르고뉴 (Melon de Bourgogne),,Muscadet Sèvre et Maine AOC(AOP),,,10~12 ℃,"샐러드, 해산물, 치즈 등과 잘 어울린다.",,1/5,4/5,2/5,1/5,"배, 리치, 미네랄","해산물, 샐러드, 치즈","*2018 빈티지: Wine Spectator 90점, Wine Enthusiast 90점*2016 빈티지: Wine Spectator 92점",
"도멘 드 레꾸, 그네스",Domaine de l'Ecu. Gneiss,https://www.wine21.com/13_search/wine_view.html?Idx=167674&lq=LIST,도멘 드 레꾸  Domaine de l'Ecu,프랑스(France) / 루아르(Loire) / 뻬이 낭떼(Pays Nantais) / 뮈스까데 세브르 에 멘느(Muscadet Sevre et Maine),믈롱 드 부르고뉴 (Melon de Bourgogne),,Muscadet Sèvre et Maine AOC(AOP),,,10~12 ℃,"치즈, 샐러드, 해산물 등과 잘 어울린다.",,1/5,3/5,3/5,1/5,"리치, 미네랄","해산물, 샐러드, 치즈",,
"도멘 드 레꾸, 그라니트","Domaine de l'Ecu, Granite",https://www.wine21.com/13_search/wine_view.html?Idx=167675&lq=LIST,도멘 드 레꾸  Domaine de l'Ecu,프랑스(France) / 루아르(Loire) / 뻬이 낭떼(Pays Nantais) / 뮈스까데 세브르 에 멘느(Muscadet Sevre et Maine),믈롱 드 부르고뉴 (Melon de Bourgogne),,Muscadet Sèvre et Maine AOC(AOP),,,10~12 ℃,"해산물, 샐러드, 치즈 등과 잘 어울린다.",,1/5,4/5,3/5,1/5,"미네랄, 생강","해산물, 샐러드, 치즈","*2018 빈티지: Wine Spectator 92점, Wine Enthusiast 92점",
"도멘 드 레꾸, 야누스","Domaine de l'Ecu, Janus",https://www.wine21.com/13_search/wine_view.html?Idx=167676&lq=LIST,도멘 드 레꾸  Domaine de l'Ecu,프랑스(France) / 루아르(Loire) / 뻬이 낭떼(Pays Nantais) / 뮈스까데(Muscadet),샤르도네 (Chardonnay),,,,,10~12 ℃,"샐러드, 해산물, 치즈 등과 잘 어울린다.",,1/5,3/5,3/5,1/5,"배, 미네랄","해산물, 샐러드, 치즈",,
"도멘 드 레꾸, 마그리트","Domaine de l'Ecu, Marguerite",https://www.wine21.com/13_search/wine_view.html?Idx=167677&lq=LIST,도멘 드 레꾸  Domaine de l'Ecu,프랑스(France) / 루아르(Loire) / 뻬이 낭떼(Pays Nantais) / 뮈스까데(Muscadet),폴레 블랑슈 (Folle Blanche),,,,,10~12 ℃,"샐러드, 치즈 등과 잘 어울린다.",,1/5,4/5,3/5,1/5,미네랄,"샐러드, 치즈",,
"아테네움, 루더포드 까베르네 소비뇽","Athenaeum, Rutherford Cabernet Sauvignon",https://www.wine21.com/13_search/wine_view.html?Idx=167678&lq=LIST,아테네움  Athenaeum,미국(U.S.A) / 캘리포니아(California) / 나파 카운티(Napa County) / 러더포드(Rutherford),카베르네 소비뇽 (Cabernet Sauvignon) / 메를로 (Merlot),,Rutherford AVA,,,16~18 ℃,"블루 치즈, 까망베르 치즈, 립 스테이크, 다크 초콜릿 등과 잘 어울린다.",,1/5,2/5,4/5,4/5,,"스테이크, 초콜릿",,14~15 %
"까사 델 토키, 코스탈 미스트 소비뇽 블랑","Casas del Toqui, Coastal Mist Sauvignon Blanc",https://www.wine21.com/13_search/wine_view.html?Idx=167679&lq=LIST,까사 델 토키  Casas del Toqui,칠레(Chile) / 라펠 밸리(Rapel Valley) / 콜차구아 밸리(Cholchagua Valley),소비뇽 블랑 (Sauvignon Blanc),,,,,8~10 ℃,"해산물, 치즈, 샐러드 등과 잘 어울린다.",,1/5,4/5,2/5,1/5,"미네랄, 피망, 허브","해산물, 샐러드, 치즈",* Tim Atkin 92점,13~14 %
"체레토, 바롤로 '브루나테'","Ceretto, Barolo 'Brunate'",https://www.wine21.com/13_search/wine_view.html?Idx=167680&lq=LIST,체레토  Ceretto,이탈리아(Italy) / 피에몬테(Piemonte) / 바롤로(Barolo),네비올로 (Nebbiolo) 100%,,Barolo DOCG(DOP),,,15~17 ℃,"스테이크, 치즈 등과 잘 어울린다.",,1/5,4/5,4/5,5/5,,"스테이크, 치즈","*2016 빈티지: Decanter 93점, James Suckling 95점, Mattew Jukes 18.5+/20점, Vinous Antonio Galloni 95점, Wine Advocate 97점",
"아르지올라스, 셀라 로리","Argiolas, Serra Lori",https://www.wine21.com/13_search/wine_view.html?Idx=167681&lq=LIST,아르지올라스  Argiolas,"이탈리아(Italy) / 사르데냐,  사르디니아(Sardegna, Sardinia )",칸노나우 (Cannonau) / 모니카 (Monica) / 까리나노  (Carignano) / 보발레 사르도 (Bovale Sardo),,Isola dei Nuraghi IGT(IGP),,,10~12 ℃,"발사믹 드레싱을 함께한 샐러드 또는 닭고기, 바비큐 돼지고기 등 너무 무겁지 않은 고기 요리 등과 잘 어울린다.",비케이 트레이딩,1/5,3/5,3/5,3/5,"딸기, 장미","닭고기, 샐러드",*Wine Advocate 88점*Wine Enthusiast 88점,13~14 %
"버메스터, 루비 포트","Burmester, Ruby Port",https://www.wine21.com/13_search/wine_view.html?Idx=167682&lq=LIST,버메스터  Burmester,포르투갈(Portugal) / 포르토(Porto),블렌드 (Blend ),,,,,10~12 ℃,"중간 숙성 치즈, 딸기&요거트 무스, 돼지고기, 기름진 생선 등과 잘 어울린다.",비케이 트레이딩,5/5,2/5,4/5,3/5,구즈베리,"딸기, 치즈",,19~20 %
"버메스터, 10년 타우니 포트","Burmester, 10 Year Old Tawny Port",https://www.wine21.com/13_search/wine_view.html?Idx=167684&lq=LIST,버메스터  Burmester,포르투갈(Portugal) / 포르토(Porto),블렌드 (Blend ),,,,,12~14 ℃,"진한 풍미의 치즈 케이크, 말린 과일, 푸아그라, 토피 브라우니, 초콜렛, 피스타치오 등과 잘 어울린다.",비케이 트레이딩,5/5,3/5,5/5,3/5,꿀,"푸아그라, 과일, 피스타치오, 치즈, 초콜렛",*Decanter Outstanding*Vinalise Internationales Gold Medal,20~21 %
"버메스터, 레이트 보틀드 빈티지 포트","Burmester, Late Bottled Vintage Port",https://www.wine21.com/13_search/wine_view.html?Idx=167685&lq=LIST,버메스터  Burmester,포르투갈(Portugal) / 포르토(Porto),투리가 나시오날 (Touriga Nacional) / 투리가 프란카 (Touriga Franca) / 틴타 로리즈 (Tinta Roriz) / 틴타 아마렐라 (Tinta Amarela),,,,,10~12 ℃,"중간 숙성 치즈, 초콜릿 민트, 치즈 케이크 등과 잘 어울린다.",비케이 트레이딩,5/5,3/5,5/5,4/5,,치즈,,20~21 %
"버메스터, 작키 클럽 리저브 타우니 포트","Burmester, Jockey Club Reserve Tawny Port",https://www.wine21.com/13_search/wine_view.html?Idx=167686&lq=LIST,버메스터  Burmester,포르투갈(Portugal) / 포르토(Porto),투리가 나시오날 (Touriga Nacional) / 투리가 프란카 (Touriga Franca) / 틴타 로리즈 (Tinta Roriz),,,,,10~12 ℃,"라즈베리 파이, 펌킨 푸딩, 코코넛 쉬폰 케이크과 돌체 라떼 등과 잘 어울린다.",비케이 트레이딩,5/5,3/5,5/5,4/5,"오렌지, 오크",푸딩,,19~20 %
"소모스, 콜렉시옹 템프라니요","Bodega Sommos, Coleccion Tempranillo",https://www.wine21.com/13_search/wine_view.html?Idx=167687&lq=LIST,보데가 소모스  Bodega Sommos,스페인(Spain) / 소몬타노(Somontano),템프라니요 (Tempranillo),,Somontano DO(DOP),,,16~18 ℃,"치즈, 스테이크 등과 잘 어울린다.",,1/5,2/5,4/5,4/5,오크,"스테이크, 치즈",*Mundus Vini Gold,15~16 %
"소모스, 콜렉시옹 까베르네 소비뇽","Bodega Sommos, Coleccion Cabernet Sauvignon",https://www.wine21.com/13_search/wine_view.html?Idx=167689&lq=LIST,보데가 소모스  Bodega Sommos,스페인(Spain) / 소몬타노(Somontano),카베르네 소비뇽 (Cabernet Sauvignon),,Somontano DO(DOP),,,16~18 ℃,"스테이크, 치즈 등과 잘 어울린다.",,1/5,2/5,4/5,4/5,"감초, 오크","스테이크, 치즈",*Mundus Vini Gold,15~16 %
"아르지올라스, 세네스","Argiolas, Senes",https://www.wine21.com/13_search/wine_view.html?Idx=167691&lq=LIST,아르지올라스  Argiolas,"이탈리아(Italy) / 사르데냐,  사르디니아(Sardegna, Sardinia )",칸노나우 (Cannonau),,Cannonau di Sardegna DOC(DOP),,,16~18 ℃,"치즈, 스테이크 등과 잘 어울린다.",비케이 트레이딩,1/5,3/5,4/5,4/5,"허브, 오크","스테이크, 치즈",*James Suckling 92점*Wine Enthusiast Buying Guide 92점*Wine Spectator Buying Guide 91점,14~15 %
"어쿠스틱 셀러, 오디토리","Acustic Celler, Auditori",https://www.wine21.com/13_search/wine_view.html?Idx=167692&lq=LIST,어쿠스틱 셀러  Acustic Celler,스페인(Spain) / 몬산트(Montsant),그르나슈 (Grenache),,Montsant DO(DOP),,,16~18 ℃,"치즈, 스테이크 등과 잘 어울린다.",비케이 트레이딩,1/5,2/5,4/5,4/5,"꽃, 미네랄, 토스트, 오크, 흙","스테이크, 치즈",*Penin Guide 93점*Robert Parker 94점*James Suckling 99점*Decanter magazine the best Grenache in world 2018 96점,15~16 %
타임리스 나파 밸리,Timeless Napa Valley,https://www.wine21.com/13_search/wine_view.html?Idx=167693&lq=LIST,실버 오크  Silver Oak Wine Cellars,미국(U.S.A) / 캘리포니아(California) / 나파 카운티(Napa County) / 나파 밸리(Napa Valley),카베르네 소비뇽 (Cabernet Sauvignon),,,,,17~19 ℃,"스테이크, 볼로네제 파스타, 소고기, 양고기 요리 등과 잘 어울린다.",하이트진로,1/5,3/5,5/5,5/5,"체리, 감초, 오크","양고기, 파스타",*미국의 대표 컬트 와인 실버 오크에서 새롭게 선보이는 부띠끄 와인,
"테루아 앤 비뇨블, 두","Terroir & Vignobles, Doux",https://www.wine21.com/13_search/wine_view.html?Idx=167694&lq=LIST,떼루아 앤 비뇨블  Terroir et Vignoble,프랑스(France) / 사우스웨스트 프랑스(Southwest France) / 꼬뜨 드 가스꼬뉴(Côtes de Gascogne),까리냥 (Carignan/Carignane) / 그르나슈 (Grenache),,,,,10~12 ℃,"디저트, 케이크 등과 잘 어울린다.",에노테카코리아,4/5,2/5,4/5,3/5,"블루베리, 잼",,,11~12 %
"도멘 루도빅 앙젤방, 크뤼 엘","Domaine Ludovic Engelvin, Cru elles",https://www.wine21.com/13_search/wine_view.html?Idx=167695&lq=LIST,도멘 루도빅 앙젤방  Domaine Ludovic Engelvin,프랑스(France) / 서던 프랑스(Southern France),쌩쏘 (Cinsault) / 그르나슈 (Grenache),,,,,16~18 ℃,"스테이크, 치즈 등과 잘 어울린다.",,1/5,4/5,3/5,3/5,,"스테이크, 치즈",,
"도멘 루도빅 앙젤방, 끌로 세르 카바니","Domaine Ludovic Engelvin, Clos Serre Cabanis",https://www.wine21.com/13_search/wine_view.html?Idx=167696&lq=LIST,도멘 루도빅 앙젤방  Domaine Ludovic Engelvin,프랑스(France) / 서던 프랑스(Southern France),무르베드르 (Mourvedre) / 그르나슈 (Grenache),,,,,16~18 ℃,"스테이크, 치즈 등과 잘 어울린다.",,1/5,3/5,3/5,3/5,,"스테이크, 치즈",,
"도멘 루도빅 앙젤방, 레 비유 롱사르","Domaine Ludovic Engelvin, Les Vieux Ronsard",https://www.wine21.com/13_search/wine_view.html?Idx=167697&lq=LIST,도멘 루도빅 앙젤방  Domaine Ludovic Engelvin,프랑스(France) / 서던 프랑스(Southern France) / 랑그독 루씨용(Languedoc Roussillon),그르나슈 (Grenache),,,,,16~18 ℃,"양갈비, 치즈 등과 잘 어울린다.",,1/5,4/5,3/5,3/5,,"양갈비, 치즈",,
"도멘 루도빅 앙젤방, 투 브링 유 마이 플레쉬","Domaine Ludovic Engelvin, To Bring You My Flesh",https://www.wine21.com/13_search/wine_view.html?Idx=167698&lq=LIST,도멘 루도빅 앙젤방  Domaine Ludovic Engelvin,프랑스(France) / 서던 프랑스(Southern France) / 랑그독 루씨용(Languedoc Roussillon),그르나슈 (Grenache),,,,,16~18 ℃,"양갈비, 치즈 등과 잘 어울린다.",,1/5,4/5,3/5,3/5,"허브, 삼나무","양갈비, 치즈",,
"도멘 뒤 페고, 샤또네프 뒤 빠쁘 뀌베 아 템포 블랑","Domaine du Pegau, Chateauneuf-du-Pape Cuvee A Tempo Blanc",https://www.wine21.com/13_search/wine_view.html?Idx=167699&lq=LIST,도멘 뒤 페고  Domaine du Pegau,프랑스(France) / 론(Rhone) / 샤또네프 뒤 빠쁘(Chateauneuf du Pape),클레렛  (Clairette) / 그르나슈 블랑 (Grenache Blanc) / 루산느 (Roussanne),,Châteauneuf-du-Pape AOC(AOP),Biodynamic Non-Certified  /  Direct pressing  /  Indigenous Yeasts,"In egg-shaped concrete tanks, 4 years barrel, stainless tanks  /  Controlled temperature",10~12 ℃,"바비큐, 베이컨, 오리로스, 치킨, 훈제연어, 참치, 숙성 치즈, 건육, 하몽, 프로슈토 등과 잘 어울린다.",크리스탈와인,1/5,4/5,4/5,1/5,"레몬, 미네랄, 민트",치즈,"* 아 템포 블랑은 다 카포의 여동생 급 와인이며, 페고의 첫 프레스티지 화이트 와인이다. 바이오다이내믹 농법으로 재배된 포도로 양조되었다. Clairette, Roussane, Grenache blanc 3개의 품종이 각각 33.3%로 블랜딩 되었다.흰 꽃과 허브향 그리고 구운 곡물 뉘앙스를 느낄 수 있으며, 복합적인 맛과 향이 인상적인 와인이다.",
"샤또 오 블랑빌, 블랑빌 그란데 리저브 블랑","Chateau Haut Blanville, Blanville Grande Reserve Blanc",https://www.wine21.com/13_search/wine_view.html?Idx=167700&lq=LIST,샤또 오-블랑빌  Chateau Haut-Blanville,프랑스(France) / 서던 프랑스(Southern France) / 랑그독 루씨용(Languedoc Roussillon),샤르도네 (Chardonnay) / 루산느 (Roussanne),,,,,10~12 ℃,"샐러드, 치즈 등과 잘 어울린다.",,1/5,3/5,2/5,1/5,,"샐러드, 치즈",,
"샤또 오 블랑빌, 블랑빌 그란데 리저브 루즈","Chateau Haut Blanville, Blanville Grande Reserve Rouge",https://www.wine21.com/13_search/wine_view.html?Idx=167701&lq=LIST,샤또 오-블랑빌  Chateau Haut-Blanville,프랑스(France) / 서던 프랑스(Southern France) / 랑그독 루씨용(Languedoc Roussillon),카베르네 소비뇽 (Cabernet Sauvignon) / 메를로 (Merlot),,,,,16~18 ℃,"스테이크, 햄버거, 피자, 치즈 등과 잘 어울린다.",,1/5,3/5,3/5,3/5,"배, 감초, 월계수","스테이크, 햄, 치즈",,
"도멘 쌩 다미앙, 꼬뜨 뒤 론 빌라쥐 '플랑 드 디유'","Domaine Saint Damien, Cotes du Rhone Village 'Plan de Dieu'",https://www.wine21.com/13_search/wine_view.html?Idx=167702&lq=LIST,도멘 쌩 다미앙  Domaine Saint Damien,프랑스(France) / 론(Rhone) / 꼬뜨 뒤 론(Côtes du Rhone),그르나슈 (Grenache) 80% / 무르베드르 (Mourvedre) 20%,,Côtes du Rhône Villages AOC(AOP),콘크리트 배럴에서 30일간 발효과정을 거친 후 블렌딩,8개월간 콘크리트 배럴에서 숙성을 거쳐 별도의 여과과정 없이 병입,16~17 ℃,"붉은 육류, 스테이크, 갈비찜, 불고기, 양갈비, 한국음식 과 잘 어울린다.",,1/5,3/5,3/5,3/5,허브,"스테이크, 양갈비",*2018 빈티지: Robert Parker 90-92점*2015 빈티지: Robert Parker 90점*2014 빈티지: Robert Parker 91점*Bio-Dynamic 와인,
"도멘 데 크레스, 레 크레스","Domaine des Creisses, Les Creisses",https://www.wine21.com/13_search/wine_view.html?Idx=167703&lq=LIST,도멘 데 크레스  Domaine des Creisses,프랑스(France) / 서던 프랑스(Southern France) / 랑그독 루씨용(Languedoc Roussillon),카베르네 소비뇽 (Cabernet Sauvignon) / 시라/쉬라즈 (Syrah/Shiraz) / 그르나슈 (Grenache) / 무르베드르 (Mourvedre) / 까리냥 (Carignan/Carignane) / 쌩쏘 (Cinsault),,,,,16~18 ℃,"피자, 파스타, 치즈 등과 잘 어울린다.",,1/5,3/5,3/5,3/5,,치즈,*2011 빈티지: Bettane et Desseauve 14점,
"도멘 데 크레스, 레 브륀","Domaine des Creisses, Les Brunes",https://www.wine21.com/13_search/wine_view.html?Idx=167704&lq=LIST,도멘 데 크레스  Domaine des Creisses,프랑스(France) / 서던 프랑스(Southern France) / 랑그독 루씨용(Languedoc Roussillon),카베르네 소비뇽 (Cabernet Sauvignon) / 시라/쉬라즈 (Syrah/Shiraz),,,,,16~18 ℃,"스테이크, 치즈 등과 잘 어울린다.",,1/5,4/5,4/5,4/5,"바닐라, 가죽","스테이크, 치즈",*2015 빈티지: Cellar Tracker 91점,
"쁘띠 룹, 비오니에","Petit Loup, Viognier",https://www.wine21.com/13_search/wine_view.html?Idx=167705&lq=LIST,쁘띠 룹  Petit Loup,프랑스(France) / 서던 프랑스(Southern France) / 랑그독 루씨용(Languedoc Roussillon),비오니에 (Viognier),,,,,10~12 ℃,"샐러드, 해산물 등과 잘 어울린다.",,1/5,3/5,3/5,1/5,"사과, 파인애플, 꿀","해산물, 샐러드",,
"쁘띠 룹, 샤르도네","Petit Loup, Chardonnay",https://www.wine21.com/13_search/wine_view.html?Idx=167706&lq=LIST,쁘띠 룹  Petit Loup,프랑스(France) / 서던 프랑스(Southern France) / 랑그독 루씨용(Languedoc Roussillon),샤르도네 (Chardonnay),,,,,10~12 ℃,"샐러드, 해산물 등과 잘 어울린다.",,1/5,3/5,2/5,1/5,"파인애플, 아카시아, 미네랄, 민트","해산물, 샐러드",,
"쁘띠 룹, 까리냥","Petit Loup, Carignan",https://www.wine21.com/13_search/wine_view.html?Idx=167707&lq=LIST,쁘띠 룹  Petit Loup,프랑스(France) / 서던 프랑스(Southern France) / 랑그독 루씨용(Languedoc Roussillon),까리냥 (Carignan/Carignane),,,,,16~18 ℃,"스테이크, 치즈 등과 잘 어울린다.",,1/5,3/5,3/5,3/5,,"스테이크, 치즈",,
"쁘띠 룹, 메를로 까베르네","Petit Loup, Merlot Cabernet",https://www.wine21.com/13_search/wine_view.html?Idx=167708&lq=LIST,쁘띠 룹  Petit Loup,프랑스(France) / 서던 프랑스(Southern France) / 랑그독 루씨용(Languedoc Roussillon),메를로 (Merlot) / 카베르네 소비뇽 (Cabernet Sauvignon),,,,,16~18 ℃,"스테이크, 치즈 등과 잘 어울린다.",,1/5,3/5,3/5,3/5,감초,"스테이크, 치즈",,
"메종 방뜨낙, 마리","Maison Ventenac, Marie",https://www.wine21.com/13_search/wine_view.html?Idx=167709&lq=LIST,메종 방뜨낙  Maison Ventenac,프랑스(France) / 서던 프랑스(Southern France) / 랑그독 루씨용(Languedoc Roussillon),콜롱바르 (Colombard) / 슈냉 블랑 (Chenin Blanc),,,,,16~18 ℃,"샐러드, 해산물 등과 잘 어울린다.",,1/5,3/5,2/5,1/5,,"해산물, 샐러드",*2018 / 2019 빈티지: Guide Hachette 1 Star*2018 빈티지: Guide Bettane & Desseauve 15/ 20점,
"메종 방뜨낙, 캐롤","Maison Ventenac, Carole",https://www.wine21.com/13_search/wine_view.html?Idx=167710&lq=LIST,메종 방뜨낙  Maison Ventenac,프랑스(France) / 서던 프랑스(Southern France) / 랑그독 루씨용(Languedoc Roussillon),샤르도네 (Chardonnay) / 그로 만생 (Gros Manseng),,,,,10~12 ℃,"해산물, 샐러드 등과 잘 어울린다.",,1/5,3/5,2/5,1/5,"미네랄, 토스트, 꿀","해산물, 샐러드",,
"메종 방뜨낙, 르 파리아","Maison Ventenac, Le Paria",https://www.wine21.com/13_search/wine_view.html?Idx=167711&lq=LIST,메종 방뜨낙  Maison Ventenac,프랑스(France) / 서던 프랑스(Southern France) / 랑그독 루씨용(Languedoc Roussillon),그르나슈 (Grenache),,,,,16~18 ℃,"오리고기, 치즈, 소고기 등과 잘 어울린다.",,1/5,4/5,3/5,3/5,"바닐라, 오크","소고기, 오리고기, 치즈",*2018 빈티지: Jancis Robinson 15.5/20점,
