와인명,와인 영문명,URL,생산자,국가/생산지역,주요품종,스타일,알코올,음용온도,추천음식,수입사,당도,산도,바디,타닌,아로마,음식매칭,등급,기타정보,숙성,양조
"프랑코 파센티, 로쏘 디 몬탈치노","Franco Pacenti, Rosso di Montalcino",https://www.wine21.com/13_search/wine_view.html?Idx=163951&lq=LIST,카날리끼오 프랑코 파센티  Canalicchio Franco Pacenti,이탈리아(Italy) / 토스카나(Toscana) / 몬탈치노(Montalcino),산지오베제 (Sangiovese),Central Italy Red,,16~18 ℃,"전채 요리, 콜드 컷 햄과 잘 숙성된 치즈, 풍부한 소스를 곁들인 해산물 스튜와도 잘 어울린다.",,1/5,4/5,4/5,3/5,"블랙체리, 블루베리, 장미, 허브","붉은육류, 돼지고기, 한식, 서양요리, 아시아요리, 치즈",Rosso di Montalcino DOC(DOP),*2020 - Falstaff 91pts*2019 - Wine Surf 90pts,"정제 후 슬로베니아, 프렌치 오크 배럴에서 8개월 숙성한 후 추가 병 숙성을 통해 출시",300m 해발고도의 포도밭에서 손수확한 포도는 온도 조절 가능한 스테인레리스 스틸 배럴에서 포도껍질의 탄닌과 색을 자연스럽게 뽑아내기 위해 pumping over 및 Rack and Return 방법으로 발효한 후 긴 침용
"프랑코 파센티, 브루넬로 디 몬탈치노","Franco Pacenti, Brunello di Montalcino",https://www.wine21.com/13_search/wine_view.html?Idx=163952&lq=LIST,카날리끼오 프랑코 파센티  Canalicchio Franco Pacenti,이탈리아(Italy) / 토스카나(Toscana) / 몬탈치노(Montalcino),산지오베제 (Sangiovese) 100%,,,16~18 ℃,"스테이크, 숙성 치즈 등 풍미 있는 요리와  잘 어울린다.",,1/5,4/5,4/5,4/5,"레드커런트, 체리, 커피, 오크","붉은육류, 치즈",Brunello di Montalcino DOCG(DOP),*Vivino 4.2 (2020),"정제 후 슬로베니아, 프렌치 오크 배럴에서 32개월 이상 숙성한 후 4개월의 추가 병 숙성을 통해 출시",300m 해발고도의 포도밭에서 손수확한 포도는 온도 조절 가능한 스테인레리스 스틸 배럴에서 포도껍질의 탄닌과 색을 자연스럽게 뽑아내기 위해 pumping over 및 Rack and Return 방법으로 발효한 후 긴 침용
"카날리끼오 프랑코 파첸티, 브루넬로 디 몬탈치노 아나따 리제르바","Canalicchio Franco Pacenti, Brunello di Montalcino Annata Riserva",https://www.wine21.com/13_search/wine_view.html?Idx=163953&lq=LIST,카날리끼오 프랑코 파센티  Canalicchio Franco Pacenti,이탈리아(Italy) / 토스카나(Toscana),브루넬로 (Brunello) 100%,,,16~18 ℃,"붉은육류, 바비큐, 소시지, 꼬치구이, 파스타, 피자, 다양한 치즈와 잘 어울린다.",루벵코리아 (루뱅쿱),1/5,4/5,4/5,4/5,,"붉은육류, 치즈",,,,
"페트롤로, 보기나 발 다르노 디 소프라","Petrolo, Boggina Val d'Arno di Sopra",https://www.wine21.com/13_search/wine_view.html?Idx=163954&lq=LIST,페트롤로   Petrolo,이탈리아(Italy) / 토스카나(Toscana),산지오베제 (Sangiovese) 100%,,,16~18 ℃,"붉은육류, 바비큐, 소시지, 꼬치구이, 파스타, 피자, 다양한 치즈와 잘 어울린다.",루벵코리아 (루뱅쿱),1/5,4/5,3/5,3/5,,"붉은육류, 치즈",,,,
"데이, 비노 노빌레 디 몬테풀치아노","Dei, Vino Nobile di Montepulciano",https://www.wine21.com/13_search/wine_view.html?Idx=163955&lq=LIST,데이  Dei,이탈리아(Italy) / 토스카나(Toscana) / 몬테풀치아노(Montepulciano),프루놀로 젠타일 (Prugnolo Gentile) 90% / 카나이올로 네로 (Canaiolo nero) 10%,Central Italy Red,,16~18 ℃,"붉은육류, 바비큐, 소시지, 꼬치구이, 파스타, 피자, 다양한 치즈와 잘 어울린다.",루벵코리아 (루뱅쿱),1/5,3/5,4/5,3/5,,"붉은육류, 치즈",,,,
"팔레스코, 레 포게레","Falesco, Le Poggere",https://www.wine21.com/13_search/wine_view.html?Idx=163956&lq=LIST,팔레스코 비티아노  Falesco Vitiano,이탈리아(Italy) / 라치오(Lazio),카베르네 소비뇽 (Cabernet Sauvignon) 60% / 산지오베제 (Sangiovese) 40%,,,16~18 ℃,"스테이크, 양고기, 바비큐, 소시지, 불고기, 파스타, 순대, 한국음식 과 잘 어울린다.",루벵코리아 (루뱅쿱),1/5,4/5,3/5,3/5,,"스테이크, 양고기, 파스타",,,,
팔레스코 텔루스 샤도네이,Falesco Tellus Chrdonnay,https://www.wine21.com/13_search/wine_view.html?Idx=163957&lq=LIST,팔레스코 비티아노  Falesco Vitiano,이탈리아(Italy) / 라치오(Lazio),샤르도네 (Chardonnay) 100%,Central Italy White,,10~12 ℃,"훈제 연어, 농어, 광어, 생선구이, 조개구이, 새우, 해산물, 샐러드, 야채, 동남아요리, 아시아요리 등과 잘 어울린다.",루벵코리아 (루뱅쿱),1/5,4/5,3/5,1/5,,,,*2015 빈티지: Wine Spectator 87점,,
"팔레스코, 비티아노 베르멘띠노","Falesco, Vitiano Vermentino",https://www.wine21.com/13_search/wine_view.html?Idx=163958&lq=LIST,팔레스코 비티아노  Falesco Vitiano,이탈리아(Italy) / 움브리아(Umbria),베르멘티노 (Vermentino) 100%,Central Italy White,,10~12 ℃,"스시, 회, 해산물, 조개, 다양한 치즈, 하몽, 프로슈토, 아시아요리, 동남아요리, 파스타 등과 잘 어울린다.",루벵코리아 (루뱅쿱),1/5,4/5,2/5,1/5,,"스시, 해산물, 파스타, 치즈",,,,
"페우디 디 산 그레고리오, 깜빠나로","Feudi di San Gregorio, Campanaro",https://www.wine21.com/13_search/wine_view.html?Idx=163959&lq=LIST,페우디 [페우디 디 산 그레고리오]  Feudi [Feudi di San Gregorio],이탈리아(Italy) / 깜빠니아(Campania),피아노 (Fiano) / 그레코 비앙코 (Greco Bianco),,,8~10 ℃,"전채요리, 회, 스시, 해산물, 건육, 살라미, 하몽, 스낵 등과 잘 어울린다.",루벵코리아 (루뱅쿱),1/5,4/5,2/5,1/5,,"스시, 해산물, 전채요리, 스낵",,,,
떼누따 델레 떼레 네레 에뜨나 로쏘 '깔데라라 쏘따나',"Tenuta delle Terre Nere, Etna Rosso Calderara Sottana'",https://www.wine21.com/13_search/wine_view.html?Idx=163960&lq=LIST,테누타 델레 떼레 네레  Tenuta delle Terre Nere,이탈리아(Italy) / 시칠리아(Sicilia),네렐로 마스칼레제 (Nerello Mascalese) 98% / 네렐로 카푸치오 (Nerello Cappuccio) 2%,Southern Italy Red,,16~18 ℃,"붉은육류, 스테이크, 그릴요리, 양고기, 양갈비, 버섯, 리조토, 파스타 와 잘 어울린다.",루벵코리아 (루뱅쿱),1/5,4/5,3/5,2/5,,버섯,,,,
떼누따 델레 떼레 네레 에뜨나 로쏘 '산 로렌조',Tenuta delle Terre Nere Etna Rosso 'San Lorenzo',https://www.wine21.com/13_search/wine_view.html?Idx=163961&lq=LIST,테누타 델레 떼레 네레  Tenuta delle Terre Nere,이탈리아(Italy) / 시칠리아(Sicilia),네렐로 마스칼레제 (Nerello Mascalese) 98% / 네렐로 카푸치오 (Nerello Cappuccio) 2%,Southern Italy Red,,16~18 ℃,"붉은육류, 스테이크, 그릴요리, 양고기, 양갈비, 버섯, 리조토, 파스타 와 잘 어울린다.",루벵코리아 (루뱅쿱),1/5,4/5,3/5,2/5,,버섯,,,,
"떼누타 델레 떼레 네레, 에뜨나 비양코","Tenuta delle Terre Nere, Etna Bianco",https://www.wine21.com/13_search/wine_view.html?Idx=163962&lq=LIST,테누타 델레 떼레 네레  Tenuta delle Terre Nere,이탈리아(Italy) / 시칠리아(Sicilia),카리칸테 (Carricante) 60% / 카타라토 (Catarratto) 25% / 그레카니코 도라토  (Grecanico Dorato ) 10% / 미넬라 (Minnella) 5%,Southern Italy White,,8~10 ℃,"바비큐, 훈제오리, 오리로스, 치킨, 훈제연어, 장어구이, 참치, 새우, 해산물, 숙성 치즈, 피자, 파스타, 탕수육 등과 잘 어울린다.",루벵코리아 (루뱅쿱),1/5,3/5,3/5,1/5,,"바비큐, 수육, 탕수육, 치즈",,,,
"아르지올라스, 코스타몰리노","Argiolas, Costamolino",https://www.wine21.com/13_search/wine_view.html?Idx=163963&lq=LIST,아르지올라스  Argiolas,"이탈리아(Italy) / 사르데냐,  사르디니아(Sardegna, Sardinia )",베르멘티노 (Vermentino) 100%,,13~14 %,8~10 ℃,"해산물, 샐러드 등과 잘 어울린다.",비케이 트레이딩,1/5,3/5,2/5,1/5,꽃,"해산물, 샐러드",,"*James Suckling 91점*Wine Spectator 88점*Vinos, Ian D’Agata 88+점",,
"안토니오 아르지오라스, 이즈 아르기올라스","Antonio Argiolas, Is Argiolas",https://www.wine21.com/13_search/wine_view.html?Idx=163964&lq=LIST,아르지올라스  Argiolas,"이탈리아(Italy) / 사르데냐,  사르디니아(Sardegna, Sardinia )",베르멘티노 (Vermentino) 100%,Southern Italy White,,8~10 ℃,"스시, 회, 해산물, 조개, 다양한 치즈, 하몽, 프로슈토, 아시아요리, 동남아요리, 파스타 등과 잘 어울린다.",루벵코리아 (루뱅쿱),1/5,3/5,2/5,1/5,,"스시, 해산물, 파스타, 치즈",,*2015 빈티지: Wine Spectator 88점,,
"군터록, 프릿츠 리슬링 프류티","Gunderloch, Fritz Riesling Fruity",https://www.wine21.com/13_search/wine_view.html?Idx=163965&lq=LIST,군터록  Gunderloch,독일(Germany) / 라인헤센(Rheinhessen),리슬링 (Riesling) 100%,,,8~10 ℃,"돼지고기, 삼겹살, 항정살, 장어구이, 해산물, 샐러드, 야채, 불고기, 갈비찜, 수육, 동남아요리, 아시아요리 등과 잘 어울린다.",루벵코리아 (루뱅쿱),1/5,5/5,2/5,1/5,,해산물,,,,
"군터록, 프릿츠 리슬링 드라이","Gunderloch, Fritz Riesling Dry",https://www.wine21.com/13_search/wine_view.html?Idx=163966&lq=LIST,군터록  Gunderloch,독일(Germany) / 라인헤센(Rheinhessen),리슬링 (Riesling) 100%,German Riesling,,8~10 ℃,"돼지고기, 삼겹살, 항정살, 장어구이, 해산물, 샐러드, 야채, 불고기, 갈비찜, 수육, 동남아요리, 아시아요리 등과 잘 어울린다.",루벵코리아 (루뱅쿱),1/5,5/5,4/5,1/5,,해산물,,* 2014 빈티지 - 16년 Wine Spectator 100대 와인,,
"군터록, 리슬링 스페트레제","Gunderloch, Riesling Spatlese",https://www.wine21.com/13_search/wine_view.html?Idx=163967&lq=LIST,군터록  Gunderloch,독일(Germany) / 라인헤센(Rheinhessen),리슬링 (Riesling) 100%,,,8~10 ℃,"돼지고기, 삼겹살, 항정살, 장어구이, 해산물, 샐러드, 야채, 불고기, 갈비찜, 수육, 동남아요리, 아시아요리 등과 잘 어울린다.",루벵코리아 (루뱅쿱),1/5,5/5,2/5,1/5,,해산물,,,,
"피터 제이콥 쿤, 외스트리히 '콰르지트'","Peter Jacob Kuhn, Oestrich Riesling 'Quarzit'",https://www.wine21.com/13_search/wine_view.html?Idx=163968&lq=LIST,피터 제이콥 쿤  Peter Jacob Kuhn,독일(Germany) / 라인가우(Rheingau),리슬링 (Riesling) 100%,German Riesling,,10~12 ℃,"돼지고기, 삼겹살, 항정살, 장어구이, 해산물, 샐러드, 야채, 불고기, 갈비찜, 수육, 동남아요리, 아시아요리 등과 잘 어울린다.",루벵코리아 (루뱅쿱),1/5,4/5,3/5,1/5,레몬,해산물,,*2016 빈티지: Robert Parker 92점,,
"피터 제이콥 쿤, 외스트리히 크로스터베흐","Peter Jacob Kuhn, Oestrich Klosterberg",https://www.wine21.com/13_search/wine_view.html?Idx=163969&lq=LIST,피터 제이콥 쿤  Peter Jacob Kuhn,독일(Germany) / 라인가우(Rheingau),리슬링 (Riesling) 100%,German Riesling,,10~12 ℃,"돼지고기, 삼겹살, 항정살, 장어구이, 해산물, 샐러드, 야채, 불고기, 갈비찜, 수육, 동남아요리, 아시아요리 등과 잘 어울린다.",루벵코리아 (루뱅쿱),1/5,4/5,2/5,1/5,"사과, 미네랄, 오크",해산물,,*2016 빈티지: Robert Parker 93점,,
"슐로스 리저, 리슬링 파인허브","Schloss Lieser, Riesling Feinherb",https://www.wine21.com/13_search/wine_view.html?Idx=163970&lq=LIST,슐로스 리저  Schloss Lieser,독일(Germany) / 모젤-자르-루버(Mosel-Saar-Ruwer),리슬링 (Riesling) 100%,German Riesling,,8~10 ℃,"돼지고기, 삼겹살, 항정살, 장어구이, 해산물, 샐러드, 야채, 불고기, 갈비찜, 수육, 동남아요리, 아시아요리 등과 잘 어울린다.",루벵코리아 (루뱅쿱),1/5,5/5,2/5,1/5,,해산물,,,,
"돈호프, 리슬링 드라이 화이트 라벨","Donnhoff, Riesling Dry White label",https://www.wine21.com/13_search/wine_view.html?Idx=163971&lq=LIST,된호프  Donnhoff,독일(Germany) / 나헤(Nahe),리슬링 (Riesling) 100%,German Riesling,,8~10 ℃,"돼지고기, 삼겹살, 항정살, 장어구이, 해산물, 샐러드, 야채, 불고기, 갈비찜, 수육, 동남아요리, 아시아요리 등과 잘 어울린다.",루벵코리아 (루뱅쿱),1/5,5/5,2/5,1/5,,해산물,,,,
"돈호프, 리슬링 프류티 블랙 라벨","Donnhoff, Riesling fruity Black label",https://www.wine21.com/13_search/wine_view.html?Idx=163972&lq=LIST,된호프  Donnhoff,독일(Germany) / 나헤(Nahe),리슬링 (Riesling) 100%,German Riesling,,8~10 ℃,"돼지고기, 삼겹살, 항정살, 장어구이, 해산물, 샐러드, 야채, 불고기, 갈비찜, 수육, 동남아요리, 아시아요리 등과 잘 어울린다.",루벵코리아 (루뱅쿱),1/5,5/5,2/5,1/5,,해산물,,,,
"돈호프, 크루즈나커 크로텐풀 리슬링 까비넷","Donnhoff, Kreuznacher Kroetenpfuhl Riesling Kabinett",https://www.wine21.com/13_search/wine_view.html?Idx=163973&lq=LIST,된호프  Donnhoff,독일(Germany) / 나헤(Nahe),리슬링 (Riesling) 100%,German Riesling,,8~10 ℃,"돼지고기, 삼겹살, 항정살, 장어구이, 해산물, 샐러드, 야채, 불고기, 갈비찜, 수육, 동남아요리, 아시아요리 등과 잘 어울린다.",루벵코리아 (루뱅쿱),1/5,5/5,2/5,1/5,,해산물,Kabinett(QmP),,,
"된호프, 니더하우저 헤르만숄레 리슬링 베렌아우스레제","Donnhoff, Niederhauser Hermannshohle Riesling Beerenauslese",https://www.wine21.com/13_search/wine_view.html?Idx=163974&lq=LIST,된호프  Donnhoff,독일(Germany) / 나헤(Nahe),리슬링 (Riesling) 100%,German Riesling,,8~10 ℃,"다양한 치즈, 건육, 과일, 타르트, 케이크, 초콜렛 등 디저트와 잘 어울린다.",에노테카코리아,5/5,4/5,3/5,1/5,"열대과일, 허브","건육, 과일, 치즈",Beerenauslese(QmP),,,
"엠리치 쇤레버, 피노그리 '에스'","Emrich Schonleber, Pinot Gris 'S'",https://www.wine21.com/13_search/wine_view.html?Idx=163975&lq=LIST,엠리치 쇤레버  Emrich Schoenleber,독일(Germany) / 나헤(Nahe),피노 그리 (Pinot Gris) 100%,German Grauburgunder,12 %,10~12 ℃,"흰살생선, 샐러드, 건육, 하몽, 프로슈토, 동남아요리, 파스타 등과 잘 어울린다.",루벵코리아 (루뱅쿱),1/5,4/5,4/5,1/5,"미네랄, 바닐라, 오크","흰살생선, 파스타, 동남아요리, 샐러드",,*2015 빈티지: Robert Parker 89점,,
"엠리치 쇤레버, 리슬링","Emrich Schonleber, Riesling",https://www.wine21.com/13_search/wine_view.html?Idx=163976&lq=LIST,엠리치 쇤레버  Emrich Schoenleber,독일(Germany) / 나헤(Nahe),리슬링 (Riesling) 100%,German Riesling,12.5 %,10~12 ℃,"생선 요리, 해산물 요리, 돼지고기, 송아지, 닭고기 등과 잘 어울린다.",루벵코리아 (루뱅쿱),1/5,5/5,3/5,1/5,,"송아지, 닭고기, 해산물",,*2016 빈티지: Robert Parker 89점,,
"엠리치 쇤레버, 렌즈 리슬링","Emrich Schonleber, Lenz Riesling",https://www.wine21.com/13_search/wine_view.html?Idx=163977&lq=LIST,엠리치 쇤레버  Emrich Schoenleber,독일(Germany) / 나헤(Nahe),리슬링 (Riesling) 100%,German Riesling,12.5 %,10~12 ℃,"생선요리, 해산물요리, 돼지고기, 송아지, 닭고기 등과 잘 어울린다.",루벵코리아 (루뱅쿱),1/5,4/5,2/5,1/5,"복숭아, 자몽","송아지, 닭고기, 해산물",,*2016 빈티지: Robert Parker 90점,,
"엠리치 쇤레버, 프루링스프라첸 리슬링 G.G.","Emrich Schonleber, Fruhlingsplatzchen Riesling G.G",https://www.wine21.com/13_search/wine_view.html?Idx=163978&lq=LIST,엠리치 쇤레버  Emrich Schoenleber,독일(Germany) / 나헤(Nahe),리슬링 (Riesling) 100%,German Riesling,12.5 %,10~12 ℃,"돼지고기, 삼겹살, 항정살, 장어구이, 해산물, 샐러드, 야채, 불고기, 갈비찜, 수육, 동남아요리, 아시아요리 등과 잘 어울린다.",루벵코리아 (루뱅쿱),1/5,4/5,2/5,1/5,,해산물,,*2016 빈티지: Robert Parker 93+점,,
"아타디, 템프라니오","Artadi, Tempranillo",https://www.wine21.com/13_search/wine_view.html?Idx=163979&lq=LIST,아타디  Artadi,스페인(Spain) / 리오하(Rioja),템프라니요 (Tempranillo) 100%,,,16~18 ℃,"붉은육류, 불고기, 갈비찜, 양갈비, 치킨, 순대, 한국음식과 잘 어울린다.",루벵코리아 (루뱅쿱),1/5,3/5,4/5,3/5,,"붉은육류, 양갈비, 치킨",,,,
"아타디, '발데진'","Artadi, 'Valdegines'",https://www.wine21.com/13_search/wine_view.html?Idx=163980&lq=LIST,아타디  Artadi,스페인(Spain) / 리오하(Rioja),템프라니요 (Tempranillo) 100%,Spanish Red,,15~17 ℃,"붉은육류, 불고기, 갈비찜, 양갈비, 치킨, 순대, 한국음식과 잘 어울린다.",루벵코리아 (루뱅쿱),1/5,3/5,4/5,3/5,,"붉은육류, 양갈비, 치킨",,*2015 빈티지: Robert Parker 94점,,
"꽁까 도로, 프로세코 뀌베 오로 엑스트라 드라이 밀레시마또","Conca d'Oro, Prosecco Cuvee Oro Extra Dry Millesimato",https://www.wine21.com/13_search/wine_view.html?Idx=163981&lq=LIST,꽁까 도로  Conca d'Oro,이탈리아(Italy) / 베네토(Veneto),글레라 (Glera) 100%,Italian Prosecco,11.5 %,6~8 ℃,식전주 및 디저트 와인으로 즐기기 좋다.,레뱅,1/5,3/5,3/5,1/5,사과,"식전주, 디저트",Prosecco DOC(DOP),"*2017 Decanter 추천와인, Concours Mondal Bruzelles Silver, The Prosecco Masters Gold*2018 The Prosecco Masters Gold",,
"아타디, '라포자'","Artadi, 'La Poza'",https://www.wine21.com/13_search/wine_view.html?Idx=163982&lq=LIST,아타디  Artadi,스페인(Spain) / 리오하(Rioja),템프라니요 (Tempranillo) 100%,Spanish Red,,16~18 ℃,"붉은육류, 불고기, 갈비찜, 양갈비, 치킨, 순대, 한국음식과 잘 어울린다.",루벵코리아 (루뱅쿱),1/5,3/5,4/5,3/5,,"붉은육류, 양갈비, 치킨",,*2015 빈티지: Robert Parker 94점,,
"아타디, '비나 엘 피송'","Artadi, 'Vina El Pison'",https://www.wine21.com/13_search/wine_view.html?Idx=163983&lq=LIST,아타디  Artadi,스페인(Spain) / 리오하(Rioja),템프라니요 (Tempranillo),Spanish Red,,16~18 ℃,"붉은육류, 불고기, 갈비찜, 양갈비, 치킨, 순대, 한국음식과 잘 어울린다.",루벵코리아 (루뱅쿱),1/5,3/5,4/5,3/5,,"붉은육류, 양갈비, 치킨",,*2015 빈티지: Robert Parekr 98+점*Hugh Johnson 죽기전에 마셔야 할 1001 와인,,
"꽁까 도로, 프로세코 뀌베 노빌레 브륏","Conca d'oro, Prosecco Cuvee Nobile Brut",https://www.wine21.com/13_search/wine_view.html?Idx=163984&lq=LIST,꽁까 도로  Conca d'Oro,이탈리아(Italy) / 베네토(Veneto),글레라 (Glera),Italian Prosecco,11~12 %,6~8 ℃,"식전주로도 적합하며, 생선요리와도 궁합이 잘 맞는다.",레뱅,1/5,3/5,2/5,1/5,꿀,식전주,Prosecco DOC(DOP),,,
"오발로, 크리안자","Obalo, Crianza",https://www.wine21.com/13_search/wine_view.html?Idx=163985&lq=LIST,오발로  Obalo,스페인(Spain) / 리오하(Rioja),템프라니요 (Tempranillo) 100%,,,16~18 ℃,"붉은육류, 불고기, 치킨, 순대, 한국음식과 잘 어울린다.",루벵코리아 (루뱅쿱),1/5,3/5,3/5,3/5,,"붉은육류, 치킨",,,,
"꽁까 도로, 스푸만떼 돌체 벨레노 모스카토/라보소 드미 섹","Conca d,oro, Spumante Dolce Veleno Moscasto/Raboso Demi Sec",https://www.wine21.com/13_search/wine_view.html?Idx=163986&lq=LIST,꽁까 도로  Conca d'Oro,이탈리아(Italy) / 베네토(Veneto),모스카토  (Moscato ) 70% / 라보소 (Raboso) 30%,,11 %,6~8 ℃,"스위트 와인으로 적합하며 케이크, 딸기, 각종 과일과 어울린다.",레뱅,4/5,2/5,2/5,1/5,,케이크,,,,
"아바디아 레투에르타, 셀레씨옹 에스페샬","Abadia Retuerta, Seleccion Especial",https://www.wine21.com/13_search/wine_view.html?Idx=163987&lq=LIST,아바디아 레투에르타  Abadia Retuerta,스페인(Spain) / 레온(Leon) / 카스티야 이 레옹(Castilla Y Leon),템프라니요 (Tempranillo) / 카베르네 소비뇽 (Cabernet Sauvignon) / 시라/쉬라즈 (Syrah/Shiraz),,,16~18 ℃,"붉은육류, 불고기, 갈비찜, 양갈비, 치킨, 순대, 한국음식과 잘 어울린다.",루벵코리아 (루뱅쿱),1/5,3/5,4/5,3/5,,"붉은육류, 양갈비, 치킨",,*2010 빈티지: 2014 Wine Spectator 100대 와인 50/100*2011 빈티지: 2015 Wine Spectator 100대 와인 15/100,,
"아바디아 레투에르타, 파고 발데베롱","Abadia Retuerta, Pago Valdebellon",https://www.wine21.com/13_search/wine_view.html?Idx=163988&lq=LIST,아바디아 레투에르타  Abadia Retuerta,스페인(Spain) / 레온(Leon) / 카스티야 이 레옹(Castilla Y Leon),카베르네 소비뇽 (Cabernet Sauvignon) 100%,,,16~18 ℃,"스테이크, 양고기, 바비큐, 소시지, 불고기, 파스타, 순대, 한국음식 과 잘 어울린다.",루벵코리아 (루뱅쿱),1/5,3/5,4/5,3/5,,"스테이크, 양고기, 파스타",,"*2012 빈티지: Robert Parker 94점, Wine Spectator 90점",,
스틸리오 프리미티보 디 만두리아,Stilio Primitivo Di Manduria,https://www.wine21.com/13_search/wine_view.html?Idx=163990&lq=LIST,모투라  Mottura,이탈리아(Italy) / 뿔리아(Puglia) / 만두리아(Manduria),프리미티보 (Primitivo) 100%,,14 %,16~18 ℃,불고기나 스테이크 등의 구운 고기  요리나 치즈와 즐기기에 아주 좋은 와인이다.,,1/5,3/5,5/5,4/5,"체리, 호두","스테이크, 불고기, 치즈",Primitivo di Manduria DOC(DOP),,,
"도미니오 디 아타우타, 비리디아나","Dominio de Atauta, Virdiana",https://www.wine21.com/13_search/wine_view.html?Idx=163991&lq=LIST,도미니오 디 아타우타  Domino de Atauta,스페인(Spain) / 리베라 델 두에로(Ribera del Duero),템프라니요 (Tempranillo) 100%,,,16~18 ℃,"붉은육류, 불고기, 갈비찜, 양갈비, 치킨, 순대, 한국음식과 잘 어울린다.",루벵코리아 (루뱅쿱),1/5,3/5,4/5,3/5,,"붉은육류, 양갈비, 치킨",,,,
"도미니오 디 아타우타, 발데가띠에","Dominio de Atauta, Valdegatiles",https://www.wine21.com/13_search/wine_view.html?Idx=163992&lq=LIST,도미니오 디 아타우타  Domino de Atauta,스페인(Spain) / 리베라 델 두에로(Ribera del Duero),템프라니요 (Tempranillo) 100%,Spanish Ribera Del Duero Red,13.5~14.5 %,16~18 ℃,"붉은육류, 불고기, 갈비찜, 양갈비, 치킨, 순대, 햄버거, 피자, 한국음식 등과 잘 어울린다.",루벵코리아 (루뱅쿱),1/5,3/5,4/5,4/5,,"붉은육류, 햄, 양갈비, 치킨",Ribera del Duero DO(DOP),,,
"도미니오 디 아타우타, 라노스 델 알멘드로","Dominio de Atauta, Llanos del Almendro",https://www.wine21.com/13_search/wine_view.html?Idx=163993&lq=LIST,도미니오 디 아타우타  Domino de Atauta,스페인(Spain) / 리베라 델 두에로(Ribera del Duero),템프라니요 (Tempranillo) 100%,Spanish Ribera Del Duero Red,,16~18 ℃,"붉은육류, 불고기, 갈비찜, 양갈비, 치킨, 순대, 햄버거, 피자, 한국음식 등과 잘 어울린다.",루벵코리아 (루뱅쿱),1/5,4/5,4/5,4/5,,"붉은육류, 햄, 양갈비, 치킨",Ribera del Duero DO(DOP),,,
"도미니오 디 아타우타, 라 말라","Dominio de Atauta, La Mala",https://www.wine21.com/13_search/wine_view.html?Idx=163994&lq=LIST,도미니오 디 아타우타  Domino de Atauta,스페인(Spain) / 리베라 델 두에로(Ribera del Duero),템프라니요 (Tempranillo) 100%,Spanish Ribera Del Duero Red,,16~18 ℃,"붉은육류, 불고기, 갈비찜, 양갈비, 치킨, 순대, 햄버거, 피자, 한국음식 등과 잘 어울린다.",루벵코리아 (루뱅쿱),1/5,3/5,4/5,4/5,,"붉은육류, 햄, 양갈비, 치킨",Ribera del Duero DO(DOP),,,
"엘 세크, 엘 세크","El Seque, El Seque",https://www.wine21.com/13_search/wine_view.html?Idx=163995&lq=LIST,엘 세크   El Seque,스페인(Spain) / 알리칸테(Alicante),모나스트렐 (Monastrell) 100%,,,16~18 ℃,"붉은 육류, 스테이크, 그릴요리, 소시지, 불고기, 갈비찜 등 과 잘 어울린다.",루벵코리아 (루뱅쿱),1/5,3/5,4/5,3/5,,소시지,,,,
"엘 세크, 모나스트렐","El Seque, Monastrell",https://www.wine21.com/13_search/wine_view.html?Idx=163996&lq=LIST,엘 세크   El Seque,스페인(Spain) / 알리칸테(Alicante),모나스트렐 (Monastrell) 100%,Spanish Monastrell,,16~18 ℃,"붉은 육류, 스테이크, 그릴요리, 소시지, 불고기, 갈비찜, 양념갈비, 한국음식 등 과 잘 어울린다.",루벵코리아 (루뱅쿱),1/5,3/5,5/5,4/5,,소시지,,,,
파소스 데 산 마르탱,"Artazu, Pasos de San Martin",https://www.wine21.com/13_search/wine_view.html?Idx=163997&lq=LIST,아르타주  Artazu,스페인(Spain) / 나바라(Navarra),가르나차 (Garnatxa) 100%,,,16~18 ℃,"스테이크, 양갈비, 그릴요리, 불고기, 훈제오리, 바비큐, 갈비찜, 햄버거, 파스타, 한국음식 등과 잘 어울린다.",루벵코리아 (루뱅쿱),1/5,3/5,3/5,4/5,,"양갈비, 훈제오리",,,,
에스펙타클,Espectacle,https://www.wine21.com/13_search/wine_view.html?Idx=163998&lq=LIST,에스펙타클  Espectacle,스페인(Spain) / 몬산트(Montsant),가르나차 (Garnatxa) 100%,,,15~17 ℃,"블고기, 양념갈비, 로스트비프, 바비큐, 그릴요리, 오리고기, 치킨, 숙성 치즈와 잘 어울린다.",루벵코리아 (루뱅쿱),1/5,3/5,3/5,3/5,,"바비큐, 양념갈비, 치즈",,*2014 빈티지: Robert Parker 97점,,
